65c33adfddee454d866aa6a75a5e23ac,"Just as, son of good family (tadyathā kulaputra), empty space does not get burned in the destroying fire at the end of a Kalpa (kalpoddāha) and is not flooded in the destruction by water at the end of an aeon (apskandha), in such a way, the meditation of the bodhisatva does not get burned by any affliction (sarvakleśa) and is not attached to the four meditations, eight liberations, concentrations, and attainments of meditation (sarvadhyānavimokṣasamādhisamāpatti).  The meditation of bodhisatva establishes living beings with distracted thoughts (vikṣiptacittā) in the state of concentration (samāhita).  If he is in the state of concentration, but ends up in an unpleasant situation, he is not irritated (apratihata).  Even thought he always manifests peacefulness (upaśānta) to noble beings (āryajana), he makes flaming efforts (dīptavīrya) in order to bring ordinary people (anāryajana) to maturity.  Being in the state of sameness in concentration (samāhitasamatā), he still teaches those with irregular behaviour (asamacaryā) by means of various kinds of teachings.  He does not see the irregular (asama) in terms of sameness (samatā), and he does not obstruct (virudhyate) the irregular (asama) with sameness (samatā).  Since he is unobstructed (aviruddha), he is called the meditator (dhyāyin) whose thought is just like open space (gaganasamacitta), without any obstruction;  he is called a meditator with great insight (mahāprajña);  he is called the meditator who is not dependent on consciousness (vijñānāpratiṣṭhita).  When meditation is understood in this way, then the meditation of the bodhisatva is like the expanse of open space (gaganasama), which is not dependent on anything (apratiṣṭhitadhyāna).",善男子。喩如虚空火災起時不能焚燒。水災起時不爲所漂。菩薩不爲諸煩惱火之所焚燒。不爲諸禪解脱三 昧所漂。  受生自無定亂。亂心衆生能令得定。  自行已淨不捨精進。  與平等等示現差別。  .  而不見平等及不平等二相。  善能遍觀智慧眞性。  其心不爲愛見所覆。  於諸行中行無所著與虚空等。  善男子。是爲菩薩行禪波羅蜜與虚空等。,善男子譬如虚空。於劫燒時不爲所燒。於水災時不爲所濕。如是菩薩修習禪定。不爲一切諸煩惱火之所焚燒。一切解脱等持等至。  常無間雜令散動有情。  安住禪定而於禪定不生愛味。  於諸聖人常現寂靜。非聖人所勤成就之。  常令定心住於平等。不平等者説法化導。  不見平等及不平等。 於等不等亦不相違。  心無有礙猶如虚空。是故名爲修禪定者。  亦名勝慧修禪定者。  亦名不住識修禪定者。  由此定故而彼菩薩。獲得如是無住禪定猶若虚空。,རིགས་ཀྱི་བུ་འདི་ལྟ་སྟེ་དཔེར་ན་། བསྐལ་པས་སྲེག་པ་ན་ནམ་མཁའ་མི་འཚིག་ཅིང་། ཆུས་འཇིག་པ་ན་ནམ་མཁའ་གཤེར་བར་མི་འགྱུར་བ་དེ་བཞིན་དུ་། བྱང་ཆུབ་སེམས་དཔའི ༼༢༦༠ཨ༡༽ བསམ་གཏན་ནམ་མཁའ་དང་མཚུངས་པ་ཡང་ཉོན་མོངས་པ་ཐམས་ཅད་ཀྱིས་མི་འཚིག་ཅིང་བསམ་གཏན་དང་། རྣམ་པར་ཐར་པ་དང་། ཏིང་ངེ་འཛིན་དང་། སྙོམས་པར་འཇུག་པ་ཐམས་ཅད་ལ་འང་མ་ཆགས་པ་ཡིན་ནོ་༎ མཉམ་པར་བཞག་པ་ཡང་ཡིན་ལ་སེམས ༼༢༽ རྣམ་པར་གཡེངས་པའི་སེམས་ཅན་རྣམས་ཀྱང་ཤིན་ཏུ་འགོད་དོ་༎ མཉམ་པར་བཞག་ཀྱང་དགའ་བ་མེད་ལ་ལངས་ནས་ཀྱང་ཁོང་ཁྲོ་བ་མེད་པ་ཡིན་ནོ་༎ འཕགས་པའི་སྐྱེ་བོ་རྣམས་ལ་ཞི་བ་ཉེ་བར་སྟོན་ཀྱང་འཕགས་པ་མ་ཡིན་པའི་སྐྱེ་བོ་རྣམས་ཡོངས་སུ་སྨིན་པར་བྱ་བའི་ཕྱིར་བརྩོན ༼༣༽ འགྲུས་རབ་ཏུ་འབར་བར་ཡང་བྱེད་དོ་༎ མཉམ་པར་བཞག་ཅིང་མཉམ་པ་ཡང་ཡིན་ལ་མི་མཉམ་པར་སྤྱོད་པ་རྣམས་ལ་ཐ་དད་པར་སྟོན་པ་ཡང་རབ་ཏུ་སྟོན་ཏོ་༎ མཉམ་པ་ཉིད་ཀྱིས་མི་མཉམ་པ་ཡང་མི་མཐོང་ལ་། མི་མཉམ་པས་མཉམ་པ་ཉིད་དང་འགལ་བར་ཡང་མི་བྱེད་དོ་༎ དེ་ནི ༼༤༽ མི་འགལ་ཞིང་འགལ་བ་མེད་པ་ནམ་མཁའ་དང་མཚུངས་པའི་སེམས་ཀྱི་བསམ་གཏན་པ་ཞེས་བྱའོ་༎ ཤེས་རབ་ཆེ་བའི་བསམ་གཏན་པ་ཞེས་བྱའོ་༎ རྣམ་པར་ཤེས་པ་རབ་ཏུ་མི་གནས་པའི་བསམ་གཏན་པ་ཞེས་བྱའོ་༎ གང་གིས་བསམ་གཏན་དེ་ལྟར་མངོན་པར་རྟོགས་པའི་བྱང ༼༥༽ ཆུབ་སེམས་དཔའ་དེ་བསམ་གཏན་ནམ་མཁའ་དང་མཚུངས་པ་སྟེ་། མི་གནས་པའི་བསམ་གཏན་ཡིན་ནོ་༎
ff6006f687934808b2e5fa336977e286,"Then, the Lord went on to speak these verses (atha khalu bhagavāṃs tasyāṃ velāyāṃ imā gāthā abhāṣata):",,爾時世尊説伽他曰。,དེ་ནས་བཅོམ་ལྡན་འདས་ཀྱིས་དེའི་ཚེ་ཚིགས་སུ་བཅད་པ་འདི་དག་གསུངས་སོ་༎
ce8189f2767a4342826dbcb6e36342e9,"67 They purify the abilities of perception (indriya) by meditation, and concentrate with one-pointed mind (ekāgramanas) by recollection (smṛti).Even though they are not dependent on anything, they still remains absorbed in sameness toward all beings (sarvajagat).",,善護諸根修靜慮　常定不著於有情等引平等度世間,བསམ་གཏན་རྣམས་ཀྱིས་དབང་པོ་ཡོངས་སུ་དག་༎ དྲན་པ་རྩེ་གཅིག་ཡིད་ནི ༼༦༽ མཉམ་པར་བཞག་༎གནས་རྣམས་ཐམས་ཅད་ལ་ཡང་མི་གནས་ཤིང་༎ འགྲོ་བ་ཀུན་ལ་མཉམ་ཉིད་སྙོམས་པར་བཞག་༎
1005974a425248209b895202e27cb077,"68 Even though they remain in the inner and outer aspects of existence, they are not dependent on the parts of personality, fields of the senses, or spheres (skandhāyatanadhātu).Staying in the transcendent sphere (vivekagocara) of tranquility (upaśānta), the wise are always in the state of concentration (samāhita).",,於内於外常安住　不依於蘊及處界遠離境界住寂靜　智者其心常在禪,ནང་དང་ཕྱི་རོལ་དག་ན་གནས་པ་ཡི་༎ ཕུང་པོ་སྐྱེ་མཆེད་ཁམས་ལ་མི་གནས་ཤིང་༎ཉེ་བར་ཞི་བ་དབེན་པ་སྤྱོད་ཡུལ་ཏེ་༎ མཁས་པ་དེ་དག་རྟག ༼༧༽ ཏུ་མཉམ་པར་བཞག་༎
25d3a7e8f278410e89cbecacab425801,"69 Since they are always concentrated in universal sameness (samatā), their minds (manas) are similar to (samasadṛśa) the sphere of the dharma (dharmadhātu).Their thoughts are absolutely dissociated (atyantavivikta), but they still manifest it. The wise meditate on everything, but they are not attached to anything.",,於等不等皆平等　達於法界無高下見心與意皆寂靜,མཉམ་པ་ཉིད་ཀྱིས་རྟག་ཏུ་མཉམ་བཞག་པ་༎ ཆོས་ཀྱི་དབྱིངས་དང་མཉམ་ཞིང་མཚུངས་པའི་ཡིད་༎ཤིན་ཏུ་དབེན་པའི་སེམས་ཀྱང་སྟོན་བྱེད་ཅིང་༎ མཁས་པ་བསམ་གཏན་ཀུན་ལའང་མི་ཆགས་སོ་༎
35e7bfeea80a4bee85a4299efff88a55,"70 In order to bring living beings to maturity, they teach about the end of death (cyuti) and birth (jāti).They never give up (parijahāti) concentrating (samādhi), they are the way they are by the power of the understanding of thoughts (cittāvabodhi).",,爲令世間成就故　示現諸禪及變易彼無變易及禪定　自在心趣亦復然,འགྲོ་བ་རྣམས་ཀྱང་ཡོངས་སུ་སྨིན་བྱའི་ཕྱིར་༎ ༼༢༦༠བ༡༽ འཆི་འཕོ་སྐྱེ་བ་འཆི་བ་ཉེར་སྟོན་ཀྱང་༎ཏིང་ངེ་འཛིན་ལས་དེ་དག་མི་ཉམས་ཏེ་༎ དེ་ནི་སེམས་རྟོགས་དབང་གིས་དེ་འདྲའོ་༎
a28183b9934b4b9085d7f159bc03ff07,"71 While in the state of concentration (samādhi) of the sphere without form (ārūpyadhātu), they still practice for the sake of the maturation (pariṇāmanā) of living beings.Illuminating the sphere of desire (kāmadhātu), they are dependent on neither themselves nor living beings.",,現境無色禪定中　示現欲界亦如是皆爲有情成就故　彼復不著於有情,གཟུགས་མེད་ཏིང་ངེ་འཛིན་ཀྱང་སྤྱོད་ཡུལ་ལ་༎ སེམས་ཅན་རྣམས་ནི་ཡོངས་སུ་སྨིན་བྱའི་ཕྱིར་༎ འདོད་པའི་ཁམས་སུའང་རབ་ཏུ་སྣང་བྱེད་དེ་༎ དེ་དག ༼༢༽ བདག་དང་སེམས་ཅན་མི་གནས་སོ་༎
55a5867c64e4429982972e67f146da7e,"72 The sphere of existence is like empty space (gagana), an  illusion (māyā), a mirage (marīci), like a dream (svapna), the moon reflected in water (udakacandra), and a cloud (megha).They, having understood the essential character of all dharmas like this, always remain in the state of concentration.",,境界如空如幻化　陽炎水月夢及雲已知禪定及世間,ནམ་མཁའ་དང་ནི་མཚུངས་པའི་སྤྱོད་ཡུལ་ཏེ་༎ སྒྱུ་མ་དང་ཡང་མཚུངས་ཤིང་སྨིག་རྒྱུ་འདྲ་༎རྨི་ལམ་ཆུ་ཟླ་སྤྲིན་གྱི་མཚན་ཉིད་དུ་༎ ཆོས་རྣམས་ཤེས་ནས་རྟག་ཏུ་མཉམ་པར་བཞག་༎
a704e6c341c74848a2b147e9fb5f3224,"73 In the sphere of thoughts (cittagocara) with all beings, they engage their though and consciousness in living beings.Since their continuity of thoughs (cittasaṃtāṇa) is unobstructed (anāvaraṇa), they have insight (prajñā) also in the continuity of their own thoughts.",,即轉世心成智慧　不能覆蔽於心故則得生於自在心,འགྲོ་བ་ཀུན་གྱིས་སེམས་ཀྱི་སྤྱོད་ཡུལ་དུ་༎ འགྲོ་བ་རྣམས ༼༣༽ ལ་སེམས་དང་བློ་འཇུག་ཅིང་༎སེམས་རྒྱུད་ལ་ནི་སྒྲིབ་པ་མེད་པ་སྟེ་༎ རང་གི་སེམས་ཀྱི་རྒྱུད་ཀྱང་རབ་ཏུ་ཤེས་༎
76f41ba6b7f04eb6987ec6aeb4a9eadc,"74 By means of skill in meditation (dhyāna) and the supernormal knowledge of magical power (ṛddhyabhijñā), they go to a great number of millions of Buddha-fields (buddhakṣetra) to make offerings to innumerable Buddhas, with a mind removed from the vice of all ignorance (sarvājñānakleśa),",,了達禪定及神通　遊歴遍於倶胝刹普能供養於諸佛　無知惑障悉斷除,བསམ་གཏན་རྫུ་འཕྲུལ་མངོན་ཤེས་མཁས་པ་ཡིས་༎ ཞིང་རྣམས་མང་པོ་བྱེ་བར་དེར་འགྲོ་ཞིང་༎མི་ཤེས་ཉོན་མོངས་ཐམས་ཅད་སྤངས་པའི་ཡིད་༎ རྒྱལ་བ་བསམ ༼༤༽ མི་ཁྱབ་ལ་མཆོད་པར་བྱེད་༎
97518848976049c0aa4c949e96558f03,"75 Having trained senses (indriya) and attained the tranquility of minds, they become perfected in peaceful meditation (śamatha) without any false discrimination (avikalpa).Having made living being’s minds tranquil, they are always concentrated on the strength of insight (prajña).",,諸根調伏意寂然　度奢摩他無分別世間及意倶清淨　常恒智力寂亦然,དབང་པོ་རྣམས་ནི་དུལ་ཞིང་ཞི་བའི་ཡིད་༎ ཞི་གནས་ཕ་རོལ་ཕྱིན་ཅིང་མི་རྟོག་པ་༎དེ་ནི་འགྲོ་བ་རྣམས་ལ་ཞི་བའི་ཡིད་༎ རྟག་ཏུ་ཡེ་ཤེས་སྟོབས་ལ་མཉམ་པར་བཞག་༎
9c87b175f70e49dabd6dcdcf447e8218,"76 Even if they are in the state of universal sameness, there is nothing to be attained because it is beyond distinguishing marks (animitta).They who abide in the universal sameness (samatāpratiṣṭhita) are always in the state of concentration.",,以無所得住平等　故名平等遍無相若於平等無所住　是故名爲得定者,མཉམ་པ་ཉིད་དང་མཉམ་པའང་ཡོང་མེད་ལ་༎ མཉམ་པ་ཉིད་ཅེས་བྱ་བར ༼༥༽ མཚན་མེད་དེ་༎མཉམ་ཉིད་དེ་ལ་གང་དག་རབ་གནས་པ་༎ དེ་དག་རྟག་ཏུ་མཉམ་པར་བཞག་པ་ཡིན་༎
65625dbbf4a54412a113362b0cec4937,"6. Prajñā  How, son of good family, does the insight of the bodhisatva become like empty space (kathaṃ kulaputra bodhisatvasya prajñāṃ gaganasamam)?",  善男子。云何菩薩行般若波羅蜜與虚空等。,  善男子云何菩薩修行般若波羅蜜多猶若虚空。,རིགས་ཀྱི་བུ་དེ་ལ་ཇི་ལྟར་ན་བྱང་ཆུབ་སེམས་དཔའ་ཤེས་རབ་ནམ་མཁའ་དང་མཚུངས་པ་ཡིན་ཞེ་ན་།
8c71bff91ef64349b4d66fbcb37e9b1e,"Son of good family, the insight of the bodhisatva becomes like the expanse of the sky when he is endowed with the four qualities. What are those four? (caturbhir dharmaiḥ kulaputra samanvāgatasya bodhisatvasya prajñā gaganasamā bhavati | katame catvāraḥ)  They are, to wit, a) entering into the purity of all beings through the purity of the expanse of the sky (sarvasatvaviśuddhipraveśo gaganaviśuddhyā);  b) entering into the purity of all consciousness through the purity of knowledge (sarvavijñānaviśuddhipraveśo jñānaviśuddhyā);  c) entering into the purity of self and living beings, life principle, and person through the purity of sphere (ātmasatvajīvapudgalaviśuddhipraveśo dhātuviśuddhyā);  d) understanding the purity of all letters through the purity of meaning (sarvākṣaraviśuddhiprativedhato ’rthaviśuddhyā);  When he is endowed with those four qualities, son of good family, the insight of the bodhisatvas becomes like the expanse of the sky.",善男子。若菩薩成就四法。行般若波羅蜜與虚空等。何等爲四。  善男子。若菩薩以我淨故。知衆生亦淨。  以知淨故知識亦淨。  以義淨故知文字亦淨。以法界淨故知一切法亦淨。  .  是爲菩薩成就四法行般若波羅蜜與虚空等。,若菩薩成就四法。修行般若波羅蜜多猶若虚空。云何爲四。  所謂由虚空清淨故入一切有情清淨。  由智清淨故入一切識清淨。  由法界清淨故入我人有情壽者清淨。  由義清淨故入一切文字清淨。  是爲菩薩成就四法。修行般若波羅蜜多猶若虚空。,རིགས་ཀྱི་བུ་ཆོས་བཞི་དང་ལྡན་ན་བྱང་ཆུབ་སེམས་དཔའ་སེམས ༼༦༽ དཔའ་ཆེན་པོ་ཤེས་རབ་ནམ་མཁའ་དང་མཚུངས་པ་ཡིན་ཏེ་། བཞི་གང་ཞེ་ན་། འདི་ལྟ་སྟེ་། ནམ་མཁའ་རྣམ་པར་དག་པས་སེམས་ཅན་ཐམས་ཅད་རྣམ་པར་དག་པར་འཇུག་པ་དང་། ཡེ་ཤེས་རྣམ་པར་དག་པས་རྣམ་པར་ཤེས་པ་ཐམས་ཅད་རྣམ་པར་དག་པར་འཇུག་པ་དང་།  ༼༧༽ ཆོས་ཀྱི་དབྱིངས་རྣམ་པར་དག་པས་བདག་དང་སེམས་ཅན་དང་སྲོག་དང་གང་ཟག་རྣམ་པར་དག་པར་འཇུག་པ་དང་། དོན་རྣམ་པར་དག་པས་ཡི་གེ་ཐམས་ཅད་རྣམ་པར་དག་པར་རབ་ཏུ་རྟོགས་པ་སྟེ་། རིགས་ཀྱི་བུ་ཆོས་བཞི་པོ་དེ་དག་དང་ལྡན་ན་བྱང་ཆུབ་སེམས་དཔའ་ཤེས་རབ ༼༢༦༡ཨ༡༽ ནམ་མཁའ་དང་མཚུངས་པ་ཡིན་ནོ་༎
bdf118cee52e46fa9d96f69b2d12267d,"Son of good family, there are eight purities of the insight of the bodhisatvas. What are the eight? (ime kulputra aṣṭaviśuddhayo bodhisatvasya prajñā gaganasamā bhavati. kathame aṣṭau)  To with, a) although they attain all good qualities (sarvakuśaladharmasamudāgamata), they do not stick to the view of eternity (śāśvatadṛṣṭi);  b) although they strive to get rid of all bad qualities (sarvākuśaladharmaprahāṇavīryārambha), they do not fall into the view of annihilation (uccheda);  c) although they enter into dependent origination (pratītyasamutpādapraveśa), they are not contradictory (virudhyate) with the tolerance that all things are unborn (anutpattikadharmakṣānti);  d) although they illuminate four kinds of special knowledge (catasraḥ pratisaṃvida), they are not attached to interpretation and eloquence (niruktipratibhāna);  e) although they teach four summaries of the dharma (dharmoddāna), they never see anything (na samanupaśyanti) in impermanence, suffering, selfless, or quiescence (anityaduḥkhānātmaśānta);  f) although they teach to enter into action and duties (karmakāryāvatāra), they are free from karmic result (vipāka) and also not disturbed by performing deeds (karmakāra);  g) although they are established in the knowledge of teachings (dharmajñāna) which is beyond discursive thinking (niṣprapañca), they elucidate the division of words of all teachings (sarvadharmapadaprabheda);  h) they attain the illumination of all teachings (sarvadharmāloka) and teach living beings about impurity and purification (saṃkleśavyavadāna).  Those eight are, son of good family, the pure insights of the bodhisatvas.",善男子。若菩薩摩訶薩成就八法。能淨般若波羅蜜。何等爲八。  善男子。若菩薩精勤欲斷一切不善法而不著斷見。精勤欲生一切善法而不著常見。  .  知一切有爲法皆從縁生。而不動於無生忍法。  善分別説一切字句。而常平等無有言説。    善能辨宣一切有爲無常苦法。於無我法界寂靜不動。  能善分別諸所作業。而知一切法無業無報。  善能分別垢法淨法。而知一切法性常淨。善能籌量三世諸法。而知諸法無去來今。  是爲菩薩成就八法能淨般若波羅蜜。,復次善男子若菩薩成就八法。能淨修行般若波羅蜜多。云何爲八。  所謂勤集一切善法不著常見。  勤斷一切不善法不著斷見。  知縁起法而不違於無生法忍。  現四無礙解而不著於四辯。  善能決擇四鄔馱南不見無常苦無我寂靜。  善説業果而亦不動。  於無業果住無戲論。智常顯説一切法句差別之相。  善得一切淨法光明。於諸有情説於清淨及雜染法。  是爲菩薩成就八法能淨修行般若波羅蜜多。,རིགས་ཀྱི་བུ་བྱང་ཆུབ་སེམས་དཔའ་རྣམས་ཀྱི་ཤེས་རབ་ཡོངས་སུ་དག་པ་ནི་འདི་བརྒྱད་དེ་། བརྒྱད་གང་ཞེ་ན་། འདི་ལྟ་སྟེ་། དགེ་བའི་ཆོས་ཐམས་ཅད་ཡང་དག་པར་སྒྲུབ་ཀྱང་རྟག་པར་ལྟ་བར་མི་སྦྱོར་བ་དང་། མི་དགེ ༼༢༽ བའི་ཆོས་ཐམས་ཅད་སྤོང་བར་བརྩོན་འགྲུས་རྩོམ་ཡང་ཆད་པར་ལྟར་བར་མི་ལྟུང་བ་དང་། རྟེན་ཅིང་འབྲེལ་པར་འབྱུང་བ་ལ་འཇུག་ཀྱང་མི་སྐྱེ་བའི་བཟོད་པ་དང་འགལ་བར་མི་བྱེད་པ་དང་། སོ་སོ་ཡང་དག་པར་རིག་པ་བཞི་ཤེས་པར་སྣང་ཡང་ངེས་པའི་ཚིག་གི་སྤོབས་པ་ལ་མི་ཆགས་པ་དང་།  ༼༣༽ ཆོས་ཀྱི་སྡོམ་བཞིའང་སྟོན་ལ་མི་རྟག་པ་དང་། སྡུག་བསྔལ་བ་དང་། བདག་མེད་པ་དང་། ཞི་བ་ཉིད་དུ་དངོས་པོ་ཡང་དག་པར་རྗེས་སུ་མི་མཐོང་བ་དང་། ལས་དང་བྱ་བ་ལ་འཇུག་པ་རབ་ཏུ་སྟོན་ཀྱང་ལས་བྱེད་ཅིང་རྣམ་པར་སྨིན་པ་མེད་པ་ལས་ཀྱང་མི་གཡོ་བ་དང་། སྤྲོས་པ་མེད་པའི་ཆོས ༼༤༽ ཤེས་པ་ལ་གནས་པ་ཡིན་ཡང་ཆོས་ཐམས་ཅད་ཀྱི་ཚིག་རབ་ཏུ་དབྱེ་བ་ངེས་པར་བསྟན་པ་རབ་ཏུ་སྟོན་པ་དང་། ཆོས་ཐམས་ཅད་ཀྱི་སྣང་བ་ལ་རབ་ཏུ་རྙེད་པ་ཡིན་གྱིས་ཀུན་ནས་ཉོན་མོངས་པ་དང་རྣམ་པར་བྱང་བ་ཡང་སེམས་ཅན་རྣམས་ལ་རབ་ཏུ་སྟོན་པ་སྟེ་། རིགས་ཀྱི་བུ་བརྒྱད་པོ་དེ་དག ༼༥༽ ནི་བྱང་ཆུབ་སེམས་དཔའ་རྣམས་ཀྱི་ཤེས་རབ་ཡོངས་སུ་དག་པའོ་༎
0f99dc1d45b742c7abd186b7ebabd8c5,"Son of good family, just as the expanse of the sky is not practiced nor not practiced, in the same way, the bodhisatva practices the insight being free from all practice.",善男子。喩如虚空非行無行。菩薩行般若離一切行亦復如是。,,-
cd09d20ff71140d2ae78f2adffedb313,"Just as the the expanse of the sky is indestructible, in the same way, the bodhisatva practices insight which cannot be broken by any demon.",喩如虚空無能破壞。菩薩行般若一切諸魔無能壞者亦復如是。,,-
0b22bef78b834d54acc618c7d5c60b05,"Just as the nature of the expanse of sky is always calm (upaśānta), in the same way, the bodhisatva practices insight with understanding and seeing calmness.",喩如虚空性常寂靜。菩薩行般若覺見寂靜亦復如是。,,-
2471bd2fbfb74bfd86e9472f05dc63dd,"Just as the nature of the expanse of the sky is always selfless (anātman), in the same way, the bodhisatva practices insight with understanding selflessness.",喩如虚空性常無我。菩薩行般若了知無我亦復如是。,,-
79bc12c9015f4dfcb10943772ae43c13,"Just as the nature of the expanse of the sky is not a being (satva), in the same way, the bodhisatva practices insight being free from belief in a being (sarvasatvadṛṣṭivigata).",喩如虚空性非衆生。菩薩行般若。離一切衆生見亦復如是。,,-
0e3bbb6b1b74487e91d2c63a2aac315a,"Just as the nature of the expanse of the sky is not a life principle (jīva), in the same way, the bodhisatva practices insight being free from belief in a life principle (sarvajīvadṛṣṭivigata).",喩如虚空性無有命。菩薩行般若。離一切命見亦復是。,,-
