id,P000875,P000876,P000877,P000878
7ff67a4a58924a66b4b99e3bb77d5922,"In Indic language: Āryagaganagañjaparipṛccha nāma mahāyanasūtra,In Tibetan: The Exalted Discourse of the Great Vehicle entitled The Questions of Bodhisatva Gaganagañja, volume 1",大方等大集經卷第十四 北涼天竺三藏曇無讖譯 虚空藏品第八之一所問品第一,大集大虚空藏菩薩所問經卷第一 開府儀同三司特進試鴻臚卿肅國 公食邑三千戸賜紫贈司空謚大鑑正號大廣智大興善寺 三藏沙門 不空奉 詔譯,། རྒྱ་གར་སྐད་དུ་། ཨཱརྱ་ག་ག་ན་གཉཛ༡པ༢རི་པṛ༣ཙཚ༤ནཱ༥མ་མ་ཧཱ་ཡཱ༦ན་སū༧ཏྲ་། བོད་སྐད་དུ་། འཕགས་པ༨ནམ་མཁའ༩མཛོད་ཀྱིས་ཞུས་པ་ཞེས་བྱ་བ་ཐེག་པ་ཆེན་པོའི་མདོ་། བམ་པོ་དང་པོ་༎
0e2c5c0c071f45bc83bbbf0308a98cfb,Homage to all the Buddhas and bodhisatvas (namaḥ sarvabuddhabodhisatvebhyaḥ),,,སངས་རྒྱས་དང་༡༠བྱང་ཆུབ་སེམས༡༡དཔའ་ཐམས་ཅད་ལ ༼༢༽ ཕྱག་འཚལ་ལོ་༎
a4679201be64408aa8af78e942e8e38d,I. The Occasion,,,-
fff1765f44ae4f2d97f6a77afa07a863,"Thus I heard: Once the Lord stayed at the place of the Tathāgatas, the courtyard adorned with jewels, the dwelling place of all the Tathāgatas (evaṃ mayā śrutam ekasmin samaye bhagavān tathāgatagocare ratnavyūhamaṇḍalamāḍe sarvatathāgataniveśane);  the accumulation of the ornaments of great merit (mahāpuṇyālaṃkārasaṃbhāropacaye);  the outcome of great conduct (mahācaryāniṣyande);  completely accomplished all qualities of buddhas through the karmic fruition (sarvabuddhadharmavipākābhinirvṛtte);  the place of the bodhisatva, the great beings (mahābodhisatvabhavane); the place of infinite teachings (anatanidarśane);  blessed with the manifestation of tathāgatas (tathāgatavikurvāṇādhiṣṭhāne);  the way into the place through unattached wisdom (asaṅgagocarajñānapraveśe);  the source of great happiness (mahāmuditā samudaye);  the way into the recollection, intelligence, and understanding of religion (smṛtimatigatipraveśe);  never to be derided by anyone (’nānindite);  consideration through wisdom (jñānavyavacāre);  the way into the lack of self-nature (tadasvabhāvapraveśe);  praised through the future world-ages (’parāntakalpābhiṣṭute);  remained in immeasurable multitude of all good qualities (sarvaguṇāprameyasaṃcaye).",爾時婆伽婆。遊如來行處妙寶莊嚴堂上  如來威神大功徳莊嚴衆相具足。  因於本行  佛地得報。  菩薩宮宅稱無量讃。  如來神力之所建立。  入無礙智  行處生勝喜悦。  思念進智分別巧説。          衆徳具足來世所歎。,如是我聞。一時薄伽梵。在如來境界寶莊嚴道場。而此道場皆是如來之所加持。  積集廣大福徳資糧。  大行等流  之所成就。  是諸菩薩所住宮殿。演説無邊甚深法處。  亦是如來遊戲神通無礙智境。  See the record after next  能生廣大善  巧念慧。入無所有    智所行處。    盡未來世稱讃  無量殊勝功徳。,འདི་སྐད་བདག་གིས་ཐོས་པ༡༢དུས་གཅིག༡༣ན་། བཅོམ་ལྡན་འདས་དེ་བཞིན་གཤེགས་པའི་སྤྱོད་ཡུལ་རིན༡༤པོ་ཆེ༡༥བཀོད་པའི་འཁོར་གྱི༡༦ཁྱམས་དེ་བཞིན་གཤེགས་པའི་གནས་༎ བསོད་ནམས་ཆེན་པོའི་རྒྱན༡༧གྱིས༡༨ཚོགས་བསགས༡༩པ་། སྤྱོད་པ་ཆེན་པོའི་རྒྱུ་འཐུན༢༠ ༼༣༽ པ་། སངས་རྒྱས་ཀྱི་ཆོས་ཐམས་ཅད་རྣམ་པར་སྨིན་པས་མངོན་པར་གྲུབ༢༡པ་། བྱང་ཆུབ་སེམས་དཔའ་སེམས་དཔའ༢༢ཆེན་པོའི་གནས༢༣མཐའ་ཡས་པ་ངེས་པར་བསྟན་པ་། དེ་བཞིན་གཤེགས་པའི༢༤རྣམ་པར་སྤྲུལ་པའི་བྱིན་གྱི་རླབས༢༥། མི་ཆགས་པའི་སྤྱོད་ཡུལ་གྱི་ཡེ་ཤེས ༼༤༽ ལ༢༦འཇུག་པ་། དགའ་བ་རྒྱ་ཆེན་པོ་རབ་ཏུ་སྐྱེད་པ་། དྲན་པ་དང་། བློ་གྲོས་དང་། རྟོགས་པ་ལ་འཇུག་པ་།༢༧ ཀུན་ནས་མ་སྨད༢༨པ་། ཡེ་ཤེས་ཀྱིས་རྣམས༢༩པར་དཔྱོད༣༠པ༣༡། དེའི་རང་བཞིན་མ་ཡིན་པ་ལ་འཇུག་པ་། ཕྱི་མའི་མཐའི་བསྐལ་པར་མངོན་དུ་བསྟོད་པ་། ཡོན་ཏན་གྱི་ཚོགས ༼༥༽ ཐམས་ཅད་དཔག་ཏུ་མེད་པ་ན་བཞུགས་ཏེ་།
f00ff244531f433782c479962ed7b8cc,"The Lord had fully woken up to the fact that all moments of existence are of the same character (bhagavān sarvadharmasamatābhisaṃbuddhaḥ);  had set the wheel of religion in motion (supravartitadharmacakro);  training completely endless of disciples (’nantaśiṣyagaṇasuvinītaḥ);  having obtained power of all dharmas (sarvadharmavaśitāprāptaḥ);  knowing well all kinds of intentions in living beings (sarvasatvāśayakāryajña);  having perfected exquisite abilities of perception (indriyaparamapāramitāprāptaḥ);  skilled in subduing the habit of vice which are connections in all sentient being (sarvasatvakleśavāsanānusaṃdhisamudghātanakuśalo);  never ceasing to perform his effortless Buddha-activities (’nābhogabuddhakāryāpratiprasrabdho).  With him was a great congregation of six million monks (mahatā bhikṣusaṃghena sārdhaṃ ṣaṣṭyā bhikṣuniyutaiḥ);  all of them with disciplined mind (sarvair ājāneyacittaiḥ);  thoroughly liberated their mind through right knowledge (samyagājñāsuvimukticittaiḥ);  making effort to completely destroy the connection of all habits of vices (sarvakleśavāsanānusaṃdhisamudghātanābhiyuktais);  the son of tathagata, the king of dharma (tathāgatadharmarājaputrair); skilled in staying according to the profound teaching (dharmagambhīravihārakuśalair);  perfected in the moments of existence beyond objectification (anālambanadharmanirjātaiḥ);  perfected by their admirable behavior (prāsādikeryāpathasaṃpannair);  very worthy of offering (mahādakṣiṇīyais);  faithful to follow the teaching of the Tathagata (tathāgatājñāsupratipannaiḥ).",世尊正覺  善轉法輪。  善能調順無量衆生。  於諸法中皆得自在。  知諸衆生心所趣向。  善能分別一切諸根彼岸。1  善斷結習。  永盡無餘所施佛事自然成辦。  與大比丘衆六百萬人倶。  其心調柔    結習已斷。  皆是如來法王之子。行甚深法善能。  解了無所有法。  殊妙端正威儀具足。  是大福田。  正住如來所教法中。,世尊現證一切諸法平等自在。  善轉無上清淨法輪  善能調伏諸弟子衆。    善達一切有情意樂。  善知一切諸根彼岸。  善斷一切煩惱結習。  於諸佛事任運施作無有休息  與大苾芻衆六百萬人倶。        此諸苾芻皆是如來法王之子。心善解脱慧善解脱。已斷一切煩惱結縛。善説一切甚深佛法。  復能通達於無相法。  端嚴殊特具足威儀。  爲大福田増長之處。  善住如來之所教令 。,བཅོམ་ལྡན་འདས་ཆོས་ཐམས་ཅད་ཀྱི་མཉམ་པ་ཉིད་ནི་མངོན་པར་རྫོགས་པར་སངས་རྒྱས་། ཆོས་ཀྱི་འཁོར་ལོ་ནི་རབ་ཏུ་བསྐོར་༎ སློབ་མ་ཤིན་ཏུ་དུལ་བ་མཐའ་ཡས་པའི་ཚོགས་ནི་མངའ་༎ ཆོས་ཐམས་ཅད་ལ་ནི་མངའ་བརྙེས་། སེམས ༼༦༽ ཅན་ཐམས་ཅད་ཀྱི་བསམ་པའི་བྱ་བ་ནི་ཤིན་ཏུ་མཁྱེན་། དབང་པོ་དམ་པའི་ཕ་རོལ་ཏུ་ནི་བྱོན་། སེམས་ཅན་ཐམས་ཅད་ཀྱི་ཉོན་མོངས་པའི་བག་ཆགས་ཀྱིས་མཚམས་སྦྱོར་བ་ཡང་དག་པར་འཇོམས་པ་ལ་ནི་མཁས་ཤིང་། སངས་རྒྱས་ཀྱི་མཛད་པ་ལྷུན་གྱིས་གྲུབ་པ་ནི་རྒྱུན་མ་བཅད་དོ་༎  ༼༧༽ དགེ་སློང་ས་ཡ་ཕྲག་དྲུག་གི་དགེ་སློང་གི་དགེ་འདུན་ཆེན་པོ་དང་ཐབས་ཅིག་སྟེ་། ཐམས་ཅད་ཀྱང་ཤེས་ཀྱི་སེམས་དང་ལྡན་པ་། ཡང་དག་པའི་ཤེས་པས་སེམས་ཤིན་ཏུ་རྣམ་པར་གྲོལ་བ་། ཉོན་མོངས་པ་ཐམས་ཅད་ཀྱིས་བག་ཆགས་ཀྱི་མཚམས་སྦྱོར་བ་ཡང་དག་པར་འཇོམས ༼༢༤༣བ༡༽ པ་ལ་བརྩོན་པ་། དེ་བཞིན་གཤེགས་པ་ཆོས་ཀྱི་རྒྱལ་པོའི་སྲས་ཆོས་ཟབ་མོ་ལ་གནས་པར་མཁས་པ་། དམིགས་སུ་མེད་པའི་ཆོས་ལས་ངེས་པར་བྱུང་བ་། སྤྱོད་ལམ་མཛེས་པ་ཕུན་སུམ་ཚོགས་པ་། སྦྱིན་པའི་གནས་ཆེན་པོར་གྱུར་པ་། དེ་བཞིན་གཤེགས་པའི་བཀའ་ལ་ཤིན ༼༢༽ ཏུ་ཞུགས་པ་ཤ་སྟག་གོ་༎
dd4a5511daac4513be67012b649cbe58,"The Bodhisatvas, the great beings had assembled from many different buddha-fields and they were innumerable, endless, and inexpressible. With him was also a great assembly of ineffable bodhisatvas. (nānābuddhakṣetrasaṃnipatitair bodhisatvamahāsatvāprameyāpramāṇābhilapyair mahābhilapyabodhisatvagaṇena sārdhaṃ);  skilled in transmigration through infinite buddha-field in an instant (sarvacittakṣaṇikānantabuddhakṣetragatikuśalaiḥ);  had always worshipped the Tathāgatas, skilled in paying homage to them(sarvatathāgatapūjopasthānakuśalair);  sought to receive teachings (atṛptadharmaparyeṣṭibhiḥ);  constantly striving to throughly mature all sentient beings (satatasamitaṃ sarvasatvaparipācanānuyuktaiḥ);  attained the perfection of the best skillful means and knowledge (prajñopāyaparamapāramitābhir);  thoroughly established in unobstructed emancipation (anāvaraṇamokṣapratiṣṭhitaiḥ);  perfectly transcended all mental constructions and conceptual consciousness (sarvakalpavikalpaprapañcasamatikrāntaiḥ);  near to the stage of omniscience. They were like this. (sarvajñajñānāsannībhūtais tad yathā)  The bodhisatva Vidyuddeva, the bodhisatva Yuddhajaya, the bodhisatva Vairocanagarbha, the bodhisatva Parākramavikrama, the bodhisatva Vimatismudghātin, the bodihsatva Vighuṣṭaśabda, the bodhisatva Vyavalokanacakṣur, the bodhisatva Vigatatamasā, (vidyuddena ca bodhisatvena yuddhajayena ca bodhisatvena vairocanagarbhena ca bodhisatvena parākramavikrameṇa ca bodhisatvena vimatisamudghātinā ca bodhisatva vighuṣṭaśabdena ca bodhisatvena vyavalokanacakṣuṣā ca bodhisatvena vigatatamasā ca)  and so forth, with immeasurable, innumerable, incalculable, inconceivable, unequalled, incomparable bodhisatvas, the great beings (evaṃ pramukhair asaṃkhyeyāprameyāpramāṇācintyāsamāmeyair bodhisatvair mahāsatvaiḥ).  they were infinite, ineffable, again ineffable (aprameyānabhilāpyānabhilāpyaiḥ sārdham);",復與大菩薩僧倶。  度一切諸行。    不捨菩薩所行。得無我忍。  於諸衆生不捨大悲。      過諸世間而順世法勤化衆生。  亦能善入如來行地。又復不離菩薩行地。其名曰  普明菩薩摩訶薩。無礙明菩薩。於一切法自在王菩薩。無礙行處菩薩。分別辯覺菩薩。淨無量網明燈王菩薩。不染行處菩薩。壞魔界放光明菩薩。  如是等不可計阿僧祇。不可思不可稱不可量。  無齊限不可説菩薩摩訶薩倶,復有菩薩摩訶薩衆。  從諸佛刹而來集會。其數無量不可思議不可譬喩不可言説。遊戲無邊諸佛世界  供養奉事一切如來。  勸請説法聞法不厭。  常恒成熟一切有情。  善巧方便能到第一清淨彼岸。  住無礙解  超越種種分別戲論。  位皆隣近一切智智。其名曰  電天菩薩戰勝菩薩。遍照菩薩勇健菩薩。摧疑菩薩奮迅菩薩。觀察眼菩薩常舒手菩薩。  與如是等上首菩薩摩訶薩倶  ,སངས་རྒྱས་ཀྱི་ཞིང་སྣ་ཚོགས་ནས་འདུས་པའི་བྱང་ཆུབ་སེམས་དཔའ་སེམས་དཔའ་ཆེན་པོ་དཔག་ཏུ་མེད་པ་ཚད་མེད་པར་བརྗོད་དུ་མེད་པའི་ཡང་བརྗོད་དུ་མེད་པའི་བྱང་ཆུབ་སེམས་དཔའི་ཚོགས་ཆེན ༼༣༽ པོ་དང་ཡང་ཐབས་ཅིག་སྟེ་། ཐམས་ཅད་ཀྱང་སེམས་ཀྱི་སྐད་ཅིག་གིས་སངས་རྒྱས་ཀྱི་ཞིང་མཐའ་ཡས་པར་འགྲོ་བ་ལ་མཁས་པ་། དེ་བཞིན་གཤེགས་པ་ཐམས་ཅད་ལ་མཆོད་པ་དང་། རིམ་གྲོ་བྱ་བ་ལམ་ཁས་པ་། ཆོས་ཉན་པ་ལ་མི་ངོམས་པར་ཡང་དག་པར་ཚོལ་བ་། རྟག་ཏུ ༼༤༽ རྒྱུན་མི་ཆད་པར་སེམས་ཅན་ཐམས་ཅད་ཡོངས་སུ་སྨིན་པར་བྱེད་པ་ལ་བརྩོན་པ་། ཐབས་དང་ཤེས་རབ་དམ་པའི་ཕ་རོལ་ཏུ་ཕྱིན་པ་། སྒྲིབ་པ་མེད་པའི་རྣམ་པར་ཐར་པ་ལ་རབ་ཏུ་གནས་པ་། རྟོག་པ་དང་། རྣམ་པར་རྟོག་པ་དང་། སྤྲོས་པ་ཐམས་ཅད་ལས་ཡང་དག་པར་འདས་པ་།  ༼༥༽ ཐམས་ཅད་མཁྱེན་པའི་ཡེ་ཤེས་ལ་ཉེ་བར་གྱུར་པ་ཤ་སྟག་ལ་འདི་ལྟ་སྟེ་། བྱང་ཆུབ་སེམས་དཔའ་གློག་གི་ལྷ་ཆེས་བྱ་བ་དང་། བྱང་ཆུབ་སེམས་དཔའ་གཡུལ་ལས་རྣམ་པར་རྒྱལ་བ་ཞེས་བྱ་བ་དང་། བྱང་ཆུབ་སེམས་དཔའ་རྣམ་པར་སྣང་མཛད་སྙིང་པོ་ཞེས་བྱ་བ་དང་། བྱང ༼༦༽ ཆུས་སེམས་དཔའ་རྣམ་པར་གནོད་པ་དཔའ་པོ་ཞེས་བྱ་བ་དང་། བྱང་ཆུབ་སེམས་དཔའ་ཡིད་གནིས་ཡང་དག་པར་འཇོམས་པ་ཞེས་བྱ་བ་དང་། བྱང་ཆུབ་སེམས་དཔའ་རྣམ་པར་བསྒྲགས་ལྡན་ཞེས་བྱ་བ་དང་། བྱང་ཆུབ་སེམས་དཔའ་རྣམས་པར་ལྟ་བའི་མིག་ཅེས་བྱ་བ་དང་། བྱང་ཆུབ ༼༧༽ སེམས་དཔའ་མུན་པ་དང་བྲལ་བ་ཞེས་བྱ་བ་དང་། དེ་དག་ལ་སོགས་པ་བྱང་ཆུབ་སེམས་དཔའ་སེམས་དཔའ་ཆེན་པོ་དཔག་ཏུ་མེད་ཚད་མེད་གྲངས་མེད་བསམ་གྱིས་མི་ཁྱབ་མཚུངས་པ་མེད་གཞལ་དུ་མེད་༎ དཔག་གིས་མི་ལང་བརྗོད་དུ་མེད་པའི་ཡང་བརྗོད་དུ་མེད་པ་དག་དང ༼༢༤༤ཨ༡༽ ཡང་ཐབས་ཅིག་གོ་༎
3c1f9b54322b46599e6fc1886443ff30,II. Introduction,,,-
