15040040ab404127b6609b4258168c15,"34. Sāgaramudrāsamādhi  How then, son of good family, does the bodhisatva become unattached to all thoughts and deeds of living beings (sarvasatvacittacaritāsakta) when he obtains the ocean seal samādhi (sāgaramudrāsamādhipratilabdha)?  .  Son of good family, as many as features of living beings appear in the Jambudvipa World, the seal which is like all of them reflects in the great ocean, thus it is called the great ocean (māhasāgara).  In the same way, as many as there are the appearance of thoughts (cittāvabhāsa), the appearance of forms (rūpāvabhāsa), or the appearance of sounds (śabdāvabhāsa), all those reflect in a single appearance (avabhāsa) of the bodhisatva who maintains the ocean seal samādhi, thus it is called the ocean seal samādhi (sāgaramudrāsamādhi).  Just as the great ocean is of a single taste (ekarasa), so the dharma of the bodhisatva is also of a single taste since he knows the taste of liberation (vimukirasa).  Just as the tide of the great ocean is punctual, so the bodhisatva is never late for the seat of awakening (bodhimaṇḍa) by investigating when is the right time and wrong time.  Just as the great ocean decomposes a rotting corpse (mahāsāgaro mṛtakuṇapena sārdhaṃ saṃvasanti), so the bodhisatva breaks down any habitual pattern of vices (sarvakleśavāsanā) or any thought of disciples and isolated buddhas (sarvaśrāvakapratyekabuddhacitta).  Just as, no matter how much water in the great ocean is consumed, there is no increase or decrease, just so, no matter how much the dharma is consumed, the sphere of the dharma (dharmadhātu) of the bodhisatva is not increased or decreased.  Just as the width of the great ocean is immeasurable, so the insight (prajñā) of the bodhisatva is immeasurable.  Just as the depth of the great ocean is hard to fathom (duravagāha), so the profoundness of the bodhisatva is hard for disciples and isolated buddhas to understand.  Just as the great ocean is the place of immeasurable living beings, so the maturing of immeasurable living beings (satvaparipācana) depends on the bodhisatva.  This is the entrance of the ocean seal samādhi (sāgaramudrāsamādhipraveśa), and, son of good family, the bodhisatva who enters into the way is not attached to the thoughts or deeds of any living being (sarvasatvacittacaritāsakta).",  善男子。云何菩薩得海印三昧能知一切衆生心行者。  若菩薩多聞如海。成就慧衆常勤求法。菩薩爲聞法故。盡能施與珍寶庫藏。爲聞法故盡能施與僕從給使妻子眷屬。爲聞法故捨家飾好嚴身之具。爲聞法故謙下給事。爲聞法故捨國土榮位及己身命。菩薩以如是等無數方便。勤求法門而不恃所行。菩薩爲聞法故。去至一由旬乃至百由旬。爲聞一四句偈受持讀誦廣爲人説。不捨是精進。是菩薩自成就多聞。於一切衆生生大悲心。無憂心。不望報心。乃至一衆生不生輕賤而爲説法。從一日乃至七日而無食想。乃至命終不捨説法。以説法善根迴向海印三昧。隨所聞法受持讀誦通利。善知義趣不依文字。眞實堅持終身不捨。菩薩發大欲精進。以此大欲精進力故。不久便得海印三昧。得此三昧已。即得自然無量阿僧祇百千萬法門。得無量阿僧祇百千萬億修多羅。不從他聞自然能説一切諸 佛所説悉能受持。能了一切衆生心行。善男子。喩如閻浮提一切衆生身及餘外色。如是等色海中皆有印像。以是故名大海印。菩薩亦復如是。得大海印三昧已。能分別見一切衆生心行。於一切法門皆得慧明。                    是爲菩薩得海印三昧。見一切衆生心行所趣,  善男子云何菩薩。獲得海印三摩地。不染一切有情心行。    善男子以何因縁名爲海印三摩地。如贍部洲諸有情等若干色類。皆於海中而現影像故名大海。  如是若干有情一切心色之類。乃至音聲彼諸影像。皆於菩薩心海中現。是故名爲海印三摩地。  譬如大海同一鹹味。菩薩一味法解脱智亦復如是。  譬如大海不越潮限。菩薩觀時非時故不越成菩提時。坐於道場亦復如是。  譬如大海不宿死屍。菩薩不與一切習氣煩惱及聲聞縁覺心倶亦復如是。  譬如大海容納萬流不増不減。菩薩容受一切諸法無有増減亦復如是。  譬如大海其廣無涯。菩薩慧用無邊亦復如是。  譬如大海深難得底。菩薩智海一切聲聞縁覺難測亦復如是。  譬如大海能作。無量世界依止。菩薩作諸有情依止亦復如是。  善男子是爲菩薩善入海印三摩地已。不染一切有情心行,རིགས་ཀྱི་བུ་དེ་ལ་ཇི་ལྟར་ན་བྱང་ཆུབ་སེམས་དཔའ་རྒྱ ༼༥༽ མཚོའི་ཕྱག་རྒྱའི་ཏིང་ངེ་འཛིན་ཐོབ་ཅིང་སེམས་ཅན་ཐམས་ཅད་ཀྱི་སེམས་དང་སྤྱོད་པ་ལ་མི་ཆགས་པ་ཡིན་ཞེ་ན་།  རིགས་ཀྱི་བུ་འདི་ལྟ་སྟེ་དཔེར་ན་འཛམ་བུའི་གླིང་ན་སེམས་ཅན་རྣམས་ཀྱི་གཟུགས་སྣང་བ་ཇི་སྙེད་པར་དེ་དག་ཐམས་ཅད་དང་འདྲ་བའི་ཕྱག་རྒྱ་རྒྱ་མཚོ་ཆེན་པོ་ལ་ཡོད་དེ་། ༼༦༽ དེའི་ཕྱིར་མཚོ་ཆེན་པོ་ཞེས་བྱའོ་༎ དེ་བཞིན་དུ་སེམས་ཅན་ཐམས་ཅད་ཀྱི་སེམས་སུ་སྣང་བའམ་། གཟུགས་སུ་སྣང་བའམ་། སྒྲར་སྣང་བ་ཇི་སྙེད་པ་དེ་དག་ཐམས་ཅད་རྒྱ་མཚོའི་ཕྱག་རྒྱའི་ཏིང་ངེ་འཛིན་ལ་གནས་པའི་བྱང་ཆུབ་སེམས་དཔའ་སྣང་བ་གཅིག་ལ་སྣང་བར་འགྱུར་ཏེ་། དེའི ༼༧༽ ཕྱིར་རྒྱ་མཚོའི་ཕྱག་རྒྱའི་ཏིང་ངེ་འཛིན་ཅེས་བྱའོ་༎ འདི་ལྟ་སྟེ་དཔེར་ན་རྒྱ་མཚོ་ཆེན་པོ་ནི་རོ་གཅིག་པ་ཡིན་ནོ་༎ དེ་བཞིན་དུ་བྱང་ཆུབ་སེམས་དཔའ་ཡང་ཆོས་ལ་རྣམ་པར་གྲོལ་བའི་རོར་ཤེས་པས་རོ་གཅིག་པ་ཡིན་ནོ་༎ འདི་ལྟ་སྟེ་དཔེར་ན་རྒྱ་མཚོ་ཆེན་པོ་ནི་དུས་ལས་མི་ཡོལ་བ་ཡིན་ནོ་༎ དེ ༼༢༧༩ཨ༡༽ བཞིན་དུ་བྱང་ཆུབ་སེམས་དཔའ་ཡང་དུས་དང་དུས་མ་ཡིན་པ་ལ་སོ་སོར་རྟོག་པས་བྱང་ཆུབ་ཀྱི་སྙིང་པོའི་དུས་ལས་མི་ཡོལ་ལོ་༎ འདི་ལྟ་སྟེ་། དཔེར་ན་རྒྱ་མཚོ་ཆེན་པོ་ནི་ཤི་བའི་རོ་དང་ལྷན་ཅིག་མི་གནས་སོ་༎ དེ་བཞིན་དུ་བྱང་ཆུབ་སེམས་དཔའ་ཡང་བག་ཆགས་ཀྱི་ཉོན་མོངས་པ་ཐམས ༼༢༽ ཅད་དང་། ཉན་ཐོས་དང་། རང་སངས་རྒྱས་ཀྱི་སེམས་ཐམས་ཅད་དང་ལྷན་ཅིག་མི་གནས་སོ་༎ འདི་ལྟ་སྟེ་། དཔེར་ན་རྒྱ་མཚོ་ཆེན་པོ་ནི་ཆུ་ཐམས་ཅད་ཟད་པས་བྲི་བའམ་གང་བ་མེད་དོ་༎ དེ་བཞིན་དུ་བྱང་ཆུབ་སེམས་དཔའ་ཡང་ཆོས་ཐམས་ཅད་ཟད་པས་ཆོས་ཀྱི་དབྱིངས་བྲི་བའམ་གང ༼༣༽ བར་མི་བྱེད་དོ་༎ འདི་ལྟ་སྟེ་། དེར་ན་རྒྱ་མཚོ་ཆེན་པོ་ནི་ཁ་ཚོན་ཚད་མེད་དོ་། དེ་བཞིན་དུ་བྱང་ཆུབ་སེམས་དཔའ་ཡང་ཤེས་རབ་ཀྱིས་ཚད་མེད་དོ་༎ འདི་ལྟ་སྟེ་། དཔེར་ན་རྒྱ་མཚོ་ཆེན་པོ་ནི་ཟབ་ཅིང་གཏིང་དཔག་དཀའ་བ་ཡིན་ནོ་༎ དེ་བཞིན་དུ་བྱང་ཆུབ་སེམས་དཔའ་ཡང་ཟབ་ཅིང་ཉན ༼༤༽ ཐོས་དང་། རང་སངས་རྒྱས་ཐམས་ཅད་ཀྱིས་གཏིང་དཔག་དཀའ་བ་ཡིན་ནོ་༎ འདི་ལྟ་སྟེ་། དཔེར་ན་རྒྱ་མཚོ་ཆེན་པོ་ནི་སེམས་ཅན་ཚད་མེད་པའི་གནས་ཡིན་ནོ་༎ དེ་བཞིན་དུ་བྱང་ཆུབ་སེམས་དཔའ་ཡང་སེམས་ཅན་ཡོངས་སུ་མིན་པར་བྱ་བ་ཚད་མེད་པའི་གནས་ཡིན་ནོ་༎ འདི་ནི་རྒྱ་མཚོའི ༼༥༽ ཕྱག་རྒྱའི་ཏིང་ངེ་འཛིན་ལ་འཇུག་པ་ཡིན་ཏེ་། རིགས་ཀྱི་བུ་དེ་ལྟར་ཞུགས་པའི་བྱང་ཆུབ་སེམས་དཔའ་ནི་སེམས་ཅན་ཐམས་ཅད་ཀྱི་སེམས་དང་སྤྱོད་པ་ལ་མི་ཆགས་པ་ཡིན་ནོ་༎
a8c704a639c543eba74ea17ba1c17458,"35. Saṅgasamatikrama  How then, son of good family, does the bodhisatva transcend all attachments (sarvasaṅgasamatikrama)?  What is called ‘attachment’ means the manifestation of viewpoints (dṛṣṭiparyutthāna) on the dharmas.  The bodhisatva transcends all attachments since he is free from any manifestation of viewpoints (dṛṣṭiparyutthāna).  Just as the wind (vāyu) is not attached to the vault of the sky, so the bodhisatva who is endowed with the wind-like thought is not attached to any living being.",  善男子。云何菩薩得知諸塵界無礙者。    若菩薩以眼空故知色亦空。以色離故知眼亦離。耳鼻舌身亦如是。意空故知法亦空。以法離故知意亦離。菩薩如實知空性離性。於内外法無有障礙。知諸結本性淨故則不起使。於一切法無所有著。以不見諸法著處著法著者。  是爲菩薩能得知諸塵界無礙,  善男子云何菩薩。得無染著心如虚空風無有障礙。    善男子若菩薩。於一切法遠離見纒心無所著。  譬如大風於虚空中無所染著。如是菩薩於一切法心無所著亦復如是。 是爲菩薩得無染著。心如虚空風無有障礙大集大虚空藏菩薩所問經卷第三丙午歳高麗國大藏都監奉　　勅雕造,རིགས་ཀྱི་བུ་དེ་ལ་ཇི་ལྟར་ན་བྱང་ཆུབ་སེམས་དཔའ་ཆགས་པ་ཐམས་ཅད་ལས་ཡང་དག་པར་འདས་པ་ཡིན ༼༦༽ ཞེ་ན་། ཆགས་པ་ཞེས་བྱ་བ་ནི་གང་ཆོས་རྣམས་ལ་ལྟ་བ་ཀུན་ནས་ལྡང་བའོ་༎ བྱང་ཆུབ་སེམས་དཔའ་ནི་ལྟ་བ་ཀུན་ནས་ལྡང་བ་ཐམས་ཅད་དང་བྲལ་བས་ཆགས་པ་ཐམས་ཅད་ལས་ཡང་དག་པར་འདས་པ་ཡིན་ནོ་༎ འདི་ལྟ་སྟེ་། དཔེར་ན་རླུང་མར་ནི་ནམ་མཁའི་དཀྱིལ་ན་མི་ཆགས ༼༧༽ སོ་༎ དེ་བཞིན་དུ་བྱང་ཆུབ་སེམས་དཔའ་རླུང་མར་ལྟ་བུའི་སེམས་དང་ལྡན་པ་ཡང་སེམས་ཅན་ཐམས་ཅད་ལ་མི་ཆགས་སོ་༎
ccc4139fe34e451e8153d19a8d394df5,"36. Ālokalabdha  Then, those good men know the way of good conduct (cāritra) and dignified manner (ācāra). Here, the dignified manner means mindfulness (smṛti) and the good conduct means non-distraction (avikṣepa).  They obtain the light (āloka) being free from darkness (andhakāra). Here, what is called the darkness is the ignorance (ajñāna) of dharmas, and what is called the light is the unhindered knowledge (apratihatajñāna) of dharmas, thus those are called being free from darkness and obtaining the light.",  善男子。云何菩薩威儀行成就。  離諸闇冥得勝光明。,  大集大虚空藏菩薩所問經卷第四開府儀同三司特進試鴻臚卿肅國公食邑三千戸賜紫贈司空謚大鑒正號大廣智大興善寺三藏沙門不空奉　　　　　　　　　詔譯善男子云何菩薩善知軌儀。  修行離暗獲得光明。不隨他縁得自然智。速到大乘一切智智。,ཡང་སྐྱེས་བུ་དམ་པ་དེ་དག་ནི་སྤྱོད་པ་དང་། ཆོ་གའི་ཚུལ་ཤེས་པ་ཡིན་ཏེ་། དེ་ལ་ཆོ་ག་ནི་དྲན་པའོ་༎ སྤྱོད་པ་ནི་རྣམ་པར་མི་གཡེང་བའོ་༎ དེ་དག་ནི་མུན་པ་དང ༼༢༧༩བ༡༽ བྲལ་ཞིང་སྣང་པ་ཐོབ་པ་ཡང་ཡིན་ཏེ་དེ་ལ་མུན་པ་ཞེས་བྱ་བ་ནི་གང་ཆོས་རྣམས་ལ་མི་ཤེས་པའོ་༎ སྣང་བ་ཞེས་བྱ་བ་ནི་གང་ཆོས་རྣམས་ལ་ཡེ་ཤེས་ཐོགས་པ་མེད་པ་སྟེ་། དེའི་ཕྱིར་དེ་དག་མུན་པ་དང་བྲལ་ཞིང་སྣང་བ་ཐོབ་པ་ཞེས་བྱའོ་༎
fc112807f5ac41d6b4154753e4a385d6,"37. Sarvajñajñāna  Those good men obtain the self-originated knowledge (svayaṃbhujñāna), not being dependent on the knowledge of others (jñānāparapraṇeya).  .  Why is that? This is because they are dependent on the self-originated knowledge (svayaṃbhujñāna), and do not seek the knowledge of other beings (parasatvajñāna).  When the bodhisatva does not depend on others, obtains the self-originated knowledge (svayaṃbhujñāna), and teaches the knowledge of determining the dharma (dharmaviniścayajñānanirdeśa), then he immediately attains the knowledge of omniscience (sarvajñajñāna).",  於諸法中得自然智。速得成就一切智行者。  若菩薩發起所作修習正行。諸業盡是如來所許智者所讃。所謂身口意業。以行此業故。悦可諸佛及餘賢聖善知識等。所造諸業無能譏嫌。最勝無上無與等者無能毀損。所作諸業終不悔退。所作諸業不離愚癡。所作諸業皆能觀知。所作諸業終不動轉。所作諸業究竟吉祥。是菩薩知所作業非憍慢。所造慧所作業非愚癡所造。如是所作善業已。一切三昧諸陀羅尼門。悉現在前不從他聞。菩薩若見諸佛。若不見諸佛。終不退轉助菩提道諸善根。若遇適意善知識不適意善知識。不退菩提法。是菩薩過一切障礙地。離一切諸魔結使修三解脱。般若波羅蜜力故。疾得佛道自然道一切智道如來道。是爲菩薩威儀行成就。離諸闇冥得勝光明。於諸法中得自然智。速得成就一切智行。    ,  善男子若菩薩。於彼所行軌儀一切諸行。不退不動獲得光明。名爲正法自智光明。亦名於法無障礙智。能離於暗獲得光明。不隨他縁得自然智。    何以故。  彼菩薩住自然智光明之時。於他有情及於此法。照了決定。不隨他縁。速疾能證薩婆若智。,སྐྱེས་བུ་དམ་པ་དེ་དག་ནི་ཡེ་ཤེས་གཞན་གྱི་དྲིང་ལ་མི་འཇོག་ཅིང་རང་གིས ༼༢༽ ཡེ་ཤེས་ཐོབ་བ་ཡིན་ཏེ་།  དེ་ཅིའི་ཕྱིར་ཞེ་ན་། དེ་དག་རང་བྱུང་གི་ཡེ་ཤེས་ལ་མངོན་པར་གནས་ཤིང་སེམས་ཅན་གཞན་ཡེ་ཤེས་འདོད་པར་བྱེད་པ་མ་ཡིན་ནོ༣༣༎ གང་གི་ཚེ་བྱང་ཆུབ་སེམས་དཔའ་ཆོས་གཏན་ལ་འབེབས་པའི་ཡེ་ཤེས་བསྟན་པ་འདི་ལ་གཞན་གྱི་དྲིང་ལ་མི་འཇོག་ཅིང་རང་གིས་ཡེ་ཤེས་ཐོབ ༼༣༽ པར་གྱུར་པ་དེའི་ཚེ་མྱུར་དུ་ཐམས་ཅད་མཁྱེན་པའི་ཡེ་ཤེས་ཐོབ་པར་འགྱུར་རོ་༎
7748cc89323d466a8dc12859e0c18218,"Verses 87-118  Then on that occasion the Lord uttered these verses (atha khalu bhagavāṃs tasyāṃ velāyāṃ imā gāthā abhāṣata):  87 The wise one whose thought is detached from any viewpoint (dṛṣti), who accumulates merits (puṇya), who is without the appearance of distinguishing marks (nimittāvyutthāna), and who transforms everything into awakening, becomes imperishable.",  爾時世尊欲重宣此義而説偈言  已離邊無礙　慧功徳莊嚴彼離諸著相　迴向無上道,  爾時世尊説伽陀曰  已脱諸見之智者　於生死中具福徳住於瑜伽離諸相　迴向菩提無盡處,དེ་ནས་བཅོམ་ལྡན་འདས་ཀྱིས་དེའི་ཚེ་ཚིགས་སུ་བཅད་པ་འདི་དག་གསུངས་སོ་༎ གང་ཞིག་ལྟ་བ་ཀུན་ལས་སེམས་དབེན་ཞིང་༎ མཁས་པ་བསོད་ནམས་ཚོགས་ནི་རབ་བྱེད་ལ་༎མཚན་མ་ལྡང་བ་ཡོངས་སུ་སྤངས ༼༤༽ ནས་སུ་༎ བྱང་ཆུབ་ཕྱིར་བསྔོས་དེ་ནི་ཟད་མི་འགྱུར་༎
edfc90dbfd724822bdb0309fcf31bb04,"88 Having abandoned pride and conceit (mānātimāna), seeking for the accumulation of knowledge (jñānasaṃbhāra), the wise one, having the nature of infinite space (anantagaganasvabhāva), fulfils the knowledge of omniscience (sarvajñajñānaṃ paripūrayati).",捨我慢憍慢　慧者莊嚴智無障礙解脱　具足一切智,應具一切智資糧　無邊智慧虚空性無色無相亦無法　則能滿足一切智,ང་རྒྱལ་ལས་ཀྱང་ང་རྒྱལ་ཀུན་སྤངས་ནས་༎ དེ་ནི་ཡེ་ཤེས་ཚོགས་རྣམས་ཚོལ་བར་བྱེད་༎མཐའ་ཡས་བློ་ལྡན་ནམ་མཁའི་ངོ་བོ་ཉིད་༎ ཀུན་མཁྱེན་ཡེ་ཤེས་ཡོངས་སུ་རྫོགས་པར་བྱེད་༎
0778958cde834c7b8cd64475f1f10029,"89 Son of the Victorious One (jinaputra), the recollection of the Buddha (buddhānusmṛti) is without the nature of form or essential character (rūpalakṣaṇadharmatā). Where there is no moving of thought or mind (cittamanas), there is the recollection of the Buddha.",非色非種性　念佛非功徳不憶念法身　是念佛所許,應念佛身勝生子　於彼心意不散動不取色相及種姓　是故名爲念如來,རྒྱལ་བའི་སྲས་དེ་སངས་རྒྱས་རྗེས་དྲན་པ་༎ གཟུགས ༼༥༽ དང་མཚན་གྱི་ཆོས་སུ་མ་ཡིན་ཏེ་༎གང་ན་སེམས་དང་ཡིད་ནི་མི་རྒྱུ་བ་༎ དེ་ནི་འཐུན་པར་སངས་རྒྱས་རྗེས་སུ་དྲན་༎
ea96538d06d04731a4d72ab5ea750c9a,"90 The dharma which is free from desire (rāga), essentially transcendent, always peaceful and calm, the absence of distinguishing marks (animitta), and is free from any objective support (sarvālambana) is the recollection of the dharma (dharmānusmṛti).",離欲性寂靜　非相非明闇無心無意行　如是名念法,法體遠離於諸欲　湛然寂靜常無相若能遠離於所縁　是故名爲眞念法,ཆོས་ནི་འདོད་ཆགས་བྲལ་ཞིང་རང་བཞིན་དབེན་༎ ཞི་ཞིང་རབ་ཞི་རྟག་ཏུ་མཚན་མ་མེད་༎གང་ཞིག་དམིགས་པ་ཐམས་ཅད་བྲལ་གྱུར་པ་༎ དེ་འདིར་ཆོས་ནི་རྗེས་སུ་དྲན་པ ༼༦༽ ཡིན་༎
81f118f58a464243b1911e672d9bc76c,"91 The holy Saṃgha which is unconditioned (anabhisaṃskṛta), empty (śūnyatā), without distinguishing marks (animitta), liberated from wishing (praṇidhāna) and in which there is no thinking nor any activity of recollection is the recollection of the Saṇgha (saṃghānusmṛti).",聖無爲無愛　無諸煩惱染以解脱得稱　名念僧無礙,無爲無染常解脱　是故名爲念僧伽,འཕགས་པའི་དགེ་འདུན་ཤིན་ཏུ་འདུས་མ་བྱས་༎ སྟོང་པ་མཚན་མེད་སྨོན་ལམ་རྣམ་པར་གྲོལ་༎དེ་ལ་སེམས་མེད་དྲན་དང་འཇུག་པ་མེད་༎ དེ་ནི་དགེ་འདུན་རྗེས་སུ་དྲན་པ་ཡིན་༎
3f63ea54bada410d9be3641f34ba33b4,"92 The renunciation which abandons all parts of personality (sarvaskandha), gives away any object of vices (sarvakleśavastu), purified from thought-constructions and discriminations (kalpavikalpa) without arrogance is the recollection of renunciation (tyāgānusmṛti).",已捨一切受　無陰界入行解脱諸動念　名究竟念捨,一切資縁諸事物　悉能捨施無所著無思清淨無分別　是故名爲念於捨,ཕུང་པོ་ཡོན་སུ་བཏང་བ་ཐམས་ཅད་གཏོང་༎ ཉོན་མོངས་དངོས་པོ་ཐམས་ཅད་ལེགས་པར ༼༧༽ འདོར་༎སྙེམས་པ་མེད་ཅིང་རྟོག་དང་རྣམ་རྟོག་དག་༎ འདི་ནི་གཏོང་བ་ལེགས་པར་རྗེས་སུ་དྲན་༎
14b5c13a6963488eb1fea1e66f70b519,"93 The morality which is unsullied (anāsrava), unconditioned (asaṃskṛta), without any activity of body, speech or mind (kāyavākcitta), without any origination, and not dependent on the triple states of existence (tribhava) is the recollection of morality (śīlānusmṛti).",不依無漏戒　不行身口意不生過三有　名念無漏戒,無爲尸羅無諸漏　離身語意不流轉不生三有無所依　是爲正念無漏戒,ཚུལ་ཁྲིམས་ཟག་པ་མེད་ཅིང་འདུས་མ་བྱས་༎ ལུས་དང་དག་དང་ཡིད་ཀྱིས་འཇུག་པ་མེད་༎འབྱུང་བ་མེད་ཅིང་སྲིད་གསུམ་མི་གནས་པ་༎ དེ་ནི་ཚུལ་ཁྲིམས་རྗེས་སུ་དྲན་པ་ཡིན་༎
1977cf79f96c4acf827b3539cac4e051,"94 God is pure and free from impurity (mala) or vices (kleśa), dwells in the Tuṣita Heaven (tuṣitabhavanastha), and obtains the stage of consecration (abhiṣeka). Recollecting such pure beings, one thinks “I will also become like him, the Lord, soon.”",如天淨無垢　兜率灌頂天憶念自業報　當作天中天,淨居諸天體無垢　及住兜率紹法王應念如是清淨天　不久我常亦如彼,ལྷ་གང ༼༢༨༠ཨ༡༽ དག་ཅིང་དྲི་མེད་ཉོན་མོངས་མེད་༎ དགའ་ལྡན་གནས་པ་དབང་བསྐུར་ཐོབ་གྱུར་པ་༎སེམས་ཅན་དག་པ་དེ་དག་འདི་དྲན་ཞིང་༎ བདག་ཀྱང་མྱུར་དུ་དེ་འདྲར་འགྱུར་སྙམ་སེམས་༎
