8fb487095077441ab2f67104fcbb5c46,kiṃ bhadanta viśākhāputraiḥ karma kṛtaṃ yasya karmaṇo vipākena adūṣyanapakāriṇo rājñā prasenajitā praghātitāḥ |  teṣāṃ ca śirāṃsi (79) peḍāyāṃ prakṣipya viśākhāyā upanāmitāni |,བཙུན་པ་། ས་ག་མའི་བུ་རྣམས་ཀྱིས་ལས་ཅི་ཞིག་བགྱིས་ན་ལས ༼༢༽ དེའི་རྣམ་པར་སྨིན་པས་ནོངས་པ་མ་བགྱིས་ཤིང་སྐྱོན་མ་མཆིས་པར་རྒྱལ་པོ་གསལ་རྒྱལ་གྱིས་བཀུམ་ནས དེ་རྣམས་ཀྱི་མགོས་གཟེབ་བཀང་སྟེ་ས་ག་མ་ལ་བསྐུར་ལགས་།
f1fa0767fe74466bbe27d3360ffa729d,bhagavān āha | ebhir eva bhikṣavaḥ karmāṇi kṛtāny upacitāni pūrvavad yāvat phalanti khalu dehinām |,བཅོམ་ལྡན་འདས་ཀྱིས་བཀའ་སྩལ་པ་། དགེ་སློང་དག་འདི་དག་ཁོ་ནས་ལས་རྣམས་བྱས་ཤིང་བསགས ༼༣༽ བ་དག་ནི་ཞེས་བྱ་བ་ནས་ལུས་ཅན་རྣམས་ལ་འབྲས་བུར་འགྱུར་ཞེས་བྱ་བའི་བར་གོག་མ་བཞིན་དུའོ་༎
a711483a167f4021b42280ff90b388ca,bhūtapūrvaṃ bhikṣavo ’nyatamasmin karvaṭake śauṇḍikaḥ prativasati |  saṃbahulāś (257v) caurā madyaṃ paryeṣamāṇāḥ tasya sakāśam upasaṃkrāntāḥ |  asti madyam iti pṛcchanti |,དགེ་སློང་དག་སྔོན་བྱུང་བའི་འོར་ཞིག་ན་ཆང་འཚོང་ཞིག་གནས་སོ་༎ ཆོམ་རྐུན་པ་རབ་ཏུ་མང་པོ་ཆང་ཚོལ་ཞིང་དེའི་དྲུང་དུ་འོངས་ནས་དྲིས་པ་༎ ཆང་ཡོད་དམ་།
8bdf042abeea4b35b4ac6f5e783c2788,śauṇḍikapatnyābhihitā astīti |,ཆང་འཚོང་གི ༼༤༽ ཆུང་མས་སྨྲས་པ་། ཡོད་དོ་ཞེས
745758de9a3d4a0d84d5db736716ff3b,teṣāṃ madyaṃ dattam |  avadraṃgo nāsti |,དེ་རྣམས་ལ་ཆང་བླུད་ན འཛར་བ་མེད་ནས
80be43a658264ecb83a001700de1dcb1,tayā vṛṣo darśitaḥ |  etaṃ praghātayata |,དེས་གླང་ཞིག་བསྟན་དེ འདི་སོད་ཅིག་།
761b7d7dd0424bb7b3860740c2487745,te kathayanti | śastraṃ nāsti |,དེ་རྣམས་ཀྱིས་སྨྲས་པ་། མཚོན་ཆ་མེད་དོ་༎
2bfbf063eeeb4113b0f1e7690113b3c6,tayā bandhakaṃ gṛhītam | śastraṃ dattam |  te taṃ praghātayitum ārabdhāḥ |,དེས་གཏའ་བླངས་ནས་མཚོན་ཆ་བྱིན་པ་དང་། དེ་རྣམས་ཀྱིས་དེ་བསད་པར་བརྩམས་སོ་༎
e30aabf2742d4f7c8adac917b14f2e0c,sa hanyamānaś cetanāṃ puṣṇāti |  yad ahaṃ ghātye tat sarvam anayā śauṇḍikapatnyā |  tatropapadye ’haṃ yatraiṣāṃ śirāṃsi chitvā peḍāyāṃ pūrayitvā etasyāṃ preṣayeyam iti |,དེ་གསོད་པ་ན་སེམས ༼༥༽ ལ བདག་གསོད་པ་གང་ཡིན་པ་འདི་དག་ཐམས་ཅད་ནི་ཆང་འཚོང་གི་ཆུང་མ་འདི་ཡིན་གྱིས་། བདག་གང་དུ་འདི་རྣམས་ཀྱི་མགོ་བཅད་ནས་གཟེབ་བཀང་སྟེ་འདི་ལ་བསྐུར་བར་འགྱུར་བ་དེར་སྐྱེ་བར་གྱུར་ཅིག་ཅེས་བསམས་སོ་༎
4eb34ff932f24de3a5f82ec194fe497c,kiṃ manyadhve bhikṣavaḥ |  yo ’sau vṛṣa eṣa evāsau rājā prasenajit kosalaḥ tena kālena tena samayena |  ye te caurā eta eva te viśākhāputrāḥ |  yā sā śauṇḍikapatnī eṣaiva sā viśākhā tena kālena tena samayena iti vistaraḥ |,དགེ་སློང་དག་ཇི་སྙམ་དུ་སེམས་། དེའི་ཚེ་དེའི ༼༦༽ དུས་ཀྱི་གླང་གང་ཡིན་པ་དེ་ནི་ཀོས་ལའི་རྒྱལ་པོ་གསལ་རྒྱལ་འདི་ཉིད་ཡིན་ནོ་། བཅོམ་རྐུན་པ་ངག་ཡིན་པ་དེ་རྣམས་ནི་ས་ག་མའི་བུ་འདི་དག་ནིད་ཡིན་ནོ་༎ དེའི་ཚེ་དེའི་དུས་ཀྱི་ཆག་འཚོང་གི་ཆུང་མ་གང་ཡིན་པ་དེ་ནི་ས་ག་མ་འདི་ཉིད་ཡིན་ནོ་ཞེས་རྒྱས་པར་བྱའོ་༎
effd526832e1458b8ca89bfb16959c5f,buddho bhagavān rājagṛhe viharati veṇuvane kalandakanivāpe |  tena khalu samayena pañcābhijñasya ṛṣer āśramapadam |  tena tasmin paryaṭatā āśramapadasya nātidūre cikkhale bhūpradeśe prasrāvaḥ kṛtaḥ |  daivayogāt tṛṣārtā mṛgī taṃ pradeśam anuprāptā |  tayāsau tṛṣṇārtayā pītaḥ (80) strīndriyaṃ ca ghrātam |  acintyaḥ satvānāṃ karmavipākaḥ | āpannasatvā saṃvṛttā |,སངས་རྒྱས ༼༧༽ བཅོམ་ལྡན་འདས་རྒྱལ་པོའི་ཁབ་ན་འོད་མའི་ཚལ་བྱ་ཀ་ལན་ད་ཀའི་གནས་ན་བཞུགས་སོ་༎ དེའི་ཚེ་དྲང་སྲོང་མངོན་པར་ཤེས་པ་ལྔ་དང་ལྡན་པའི་བསྟི་གནས་ཤིག་ཡོད་དེ་། དེ་དེ་ན་འཆག་པ་ལས་བསྟི་གནས་དང་ཧ་ཅང་ཡང་མི་རིང་བའི་ས་རྫབ་ཅན་གྱི་ཕྱོགས་ཤིག་ཏུ་གཅིན་ཁུ ༼ག༨༤ཨ༡༽ ཆུ་དང་བཅས་པ་ཞིག་གཅིས་སོ་༎ གློ་བུར་དུ་རི་དགས་མོ་སྐོམ་པས་ཉེན་པ་ཞིག་ཕྱོགས་དེར་འོངས་ཏེ་། དེ་སྐོམ་པས་ཉེན་པས་དེ་འཐུངས་ནས་མོའི་དབང་པོ་ལ་བསྣམས་སོ་༎ སེམས་ཅན་རྣམས་ཀྱི་ལས་ཀྱི་རྣམ་པར་སྨིན་པ་ནི་བསམ་གྱིས་མི་ཁྱབ་པས་སེམས ༼༢༽ ཅན་དང་ལྡན་པར་གྱུར་ཏོ་༎
9064c37607da4b4180875ba97a4caf6e,yāvad apareṇa samayena tasminn eva pradeśe āgatya prasūtā | dārako jātaḥ |  sā taṃ ghrātvā visabhāgasatva iti chorayitvā prakrāntā |  yāvat tena ṛṣiṇā tad āśramaṃ paryaṭatā sa dārako dṛṣṭaḥ |  sa samanvāhartuṃ pravṛttaḥ kasyāyaṃ putra iti |,ཇི་ཙམ་ན་དུས་གཞན་ཞིག་ན་ཕྱོགས་དེ་ཉིད་དུ་འོངས་ནས་ཁྱེའུ་ཞིག་བྱུང་བ་དང་། དེས་དེ་བསྣམས་ན་སྐལ་པ་མི་མཐུན་པའི་སེམས་ཅན་ཡིན་ནས་བོར་ཏེ་སོང་སོང་། ཇི་ཙམ་ན་དྲང་སྲོང་དེ་བསྟི་གནས་དེ་ན་འཆག་པ་ལས་ཁྱེའུ་དེ་མཐོང་ནས་། འདི ༼༣༽ སུའི་བུ་ཡིན་ཞེས་དེ་བསམ་པ་ལ་ཞུགས་པ་ལས་།
67346ea7bcd84f959518551eb078000e,yāvat paśyaty ātmānam | tenāsau āśramapadaṃ praveśita āpāyitaḥ poṣitaḥ saṃvardhitaḥ |  tasya mṛgasya yādṛśaṃ śira iti mṛgaśiro mṛgaśira iti saṃjñā saṃvṛttā |,ཇི་ཙམ་ན་བདག་གི་ཡིན་པར་མཐོང་ནས་དེས་དེ་བསྟི་གནས་སུ་བཞག་སྟེ་བསྣུན་བསྙོད་བསྐྱེད་ནས དེའི་མགོ་རི་དགས་ཀྱི་འདྲ་བས་རི་དགས་མགོ་རི་དགས་མགོ་ཞེས་བྱ་བར་གྲགས་སོ་༎
ce7e00c53a6f468db9c2ad1c192cd651,apareṇa samayena sa ṛṣiḥ kālagataḥ | mṛgaśirasā kapālākoṭanī vidyā śikṣitā |  sa kapālam ākoṭya sarvaṃ vyākaroti |  yadi tāvat khaṃkhaṭasvaro bhavati ūrdhvagāmī bhavati devopapattiṃ vyākaroti  atha madhyo bhavati ūrdhvagāmī bhavati manuṣyopapattiṃ vyākaroti | etat sugatinimittam |  atha durgatinimittam | yadi tāvad gadgadasvaro bhavati adhogāmī bhavati narakopapattiṃ vyākaroti |  atha madhyasvaro bhavati adhogāmī bhavati tiryagupapattiṃ |  atha mṛdusvaro ’dhogāmī bhavati pretopapattim |,དུས་གཞན་ཞིག་ན་དྲང་སྲོང་ཤི ༼༤༽ ནས་རི་དགས་མགོས་ཀླད་པའི་ཐོད་པ་རྡོབ་པའི་རིག་པ་བསླབས་ཏེ་། དེས་ཐོད་པ་བརྡབས་ནས་ཐམས་ཅད་ལུང་སྟོན་པར་བྱེད་དོ་༎ གལ་ཏེ་རེ་ཞིག་སྒྲ་དྲག་པོར་གྱུར་ན་གྱེན་དུ་འགྲོ་བ་ལྷར་སྐྱེ་བར་འགྱུར་བར་ལུང་སྟོན་པར་བྱེད་དོ་༎ འོན་ཏེ་འབྲིང་དུ་གྱུར་ན་གྱེན་དུ་འགྲོ་བ་མིར་སྐྱེ ༼༥༽ བར་འགྱུར་བར་ལུང་སྟོན་པར་བྱེད་དེ་། དེ་ནི་བདེ་འགྲོའི་རྟགས་སོ་༎ ངན་འགྲོའི་རྟགས་ནི་གལ་ཏེ་རེ་ཞིག་སྒྲ་མི་གསལ་བར་གྱུར་ན་འོག་ཏུ་འགྲོ་བ་སེམས་ཅན་དམྱལ་བར་སྐྱེ་བར་འགྱུར་བར་ལུང་སྟོན་པར་བྱེད་དོ་༎ འོན་ཏེ་སྒྲ་འབྲིང་དུ་གྱུར་ན་འོག་ཏུ་འགྲོ་བ་ངུད་འགྲོར་སྐྱེ་བར་འགྱུར ༼༦༽ བར་ལུང་སྟོན་པར་བྱེད་དོ་༎ འོན་ཏེ་སྒྲ་ཆུང་བར་གྱུར་ན་འོག་ཏུ་འགྲོ་བ་ཡི་དགས་སུ་སྐྱེ་བར་ལུང་སྟོན་པར་བྱེད་དོ་༎
e14a115b420f4d95ac2bc28b4b701967,tato bhagavatā tasya vinayakālaṃ jñātvā āyuṣmān ānanda uktaḥ |  gacchānanda catvāri śirāṃsy ādāya srotaāpannasya sakṛdāgāmino ’nāgāmino ’rhataś ceti |,དེ་ནས་བཅོམ་ལྡན་འདས་ཀྱིས་དེའི་འདུལ་བའི་དུས་མཁྱེན་ནས་ཚེ་དང་ལྡན་པ་ཀུན་དགའ་བོ་ལ་བཀའ་སྩལ་པ་། ཀུན་དགའ་བོ་སོང་ལ་རྒྱུན་དུ་ཞུགས་པ་དང་། ལན ༼༧༽ གཅིག་ཕྱིར་འོང་བ་དང་། ཕྱིར་མི་འོང་བ་དང་། དགྲ་བཅོམ་པའི་མགོ་བཞི་ཁྱེར་ཅིག་།
53b5acc75a9647a7903904b659b5183e,evaṃ bhadantety ayuṣmān ānando bhagavataḥ pratiśrutaḥ |  catvāri śirāṃsy ādāya tasya ṛṣeḥ sakāśaṃ gataḥ | vyākuruṣveti |,བཙུན་པ་བཀའ་བཞིན་འཚལ་ཞེས་ཚེ་དང་ལྡན་པ་ཀུན་དགའ་བོས་བཅོམ་ལྡན་འདས་ལས་མཉན་ནས མགོ་བཞི་ཁྱེར་ཏེ་དྲང་སྲོང་དེའི་དྲུང་དུ་སོང་ནས་ཁྱོད་ཀྱིས་ལུང་སྟོན་ཅིག་།
2e45e0e504e84a10bc2ec282ed5df69d,sa srotaāpannasyeti15 kapālam ākoṭya kathayaty  ayaṃ deveṣūpapannaḥ |  sakṛdāgāmino ’py evam eva |  anāgāmino ’py evam eva |  arhataḥ kapālam (81) ākoṭya viṣayaṃ na jānāti na vijānāti |  tasyaitad abhavat |,དེས་རྒྱུན་དུ ༼ག༨༤བ༡༽ ཞུགས་པའི་ཐོད་པ་ལ་བརྡབས་ནས་སྨྲས་པ་། འདི་ནི་ལྷ་རྣམས་སུ་སྐྱེས་སོ་༎ ལན་གཅིག་ཕྱིར་འོང་བ་ཡང་དེ་བཞིན་ནོ་༎ ཕྱིར་མི་འོང་བའི་ཡང་དེ་བཞིན་ནོ་༎ དགྲ་བཅོམ་པའི་ཐོད་པ་ལ་བརྡབས་ན་མ་ཤེས་རྣམ་པར་མ་ཤེས་ནས་ངོ་ཚ་བས དེ་འདི་སྙམ་དུ་སེམས་ཏེ་།
cdc920924c7c4bf4a2eb9bd2643ff858,bhraṣṭo ’smi tasmād upadeśataḥ kiṃathavā na cāryakule16 prasūtaḥ |kiṃ vā nimittāni na tādṛśāniyenāsya na jānāmi taṃ hi pracāram |,གང་ཕྱིར ༼༢༽ འདི་ཡི་འགྲོ་བ་མ་ཤེས་པ་༎བདག་ཅི་བསྟན་པ་དེ་ལས་ཉམས་གྱུར་ཏམ་༎འོན་ཏེ་སློབ་དཔོན་རིགས་ལས་མ་སྐྱེས་སམ་༎འོན་ཏེ་རྟགས་རྣམས་དེ་འདྲ་མ་ཡིན་ནམ་༎
67de0e744fc641e38e984c49de2eecb6,āyuṣmān ānandaḥ kathayati |,ཚེ་དང་ལྡན་པ་ཀུན་དགའ་བོས་སྨྲས་པ་།
7c9b79df3ae14cbf9c13d59ef613f9c8,na sarvavidyāsu kṛtaśramas tvaṃyenāsya jānāsi taṃ hi pracāram |adhīṣva tāvan nikhilāṃ vidyāṃlokasya paścād vyapadekṣyasi tvam iti |,གང་ཕྱིར་འདི་ཡི་འགྲོ་བ་མ་ཤེས་པ་༎ཁྱོད་ཀྱིས་རིག་པ་ཀུན་ལེགས ༼༣༽ གོམས་མ་བྱས་༎རེ་ཞིག་རིག་པ་མཐའ་དག་རྟོགས་བྱོས་ལ་༎ཁྱོད་ཀྱིས་ཕྱིན་ནས་འཇིགས་རྟེན་ལུང་སྟོན་ཅིག་༎
8dba869531764db3a9811a43d2bb2fb0,mṛgaśirāḥ (258r) kathayati |  asti kaścit tvayā sarvavidyāsu kṛtāvī dṛṣṭaḥ |,རི་དགས་མགོས་སྨྲས་པ་། ཁྱོད་ཀྱིས་རིག་པ་ཐམས་ཅད་ལ་བྱང་བ་འགའ་མཐོང་ངམ་མཐོང་བ་ཡོད་དམ་།
caab8b8fc1434a94a410d217f85a2ca5,sa kathayati | asti | tathāgato ’rhat samyaksaṃbuddhaḥ sarvavidyāyāṃ pāraṃgataḥ |,དེས་སྨྲས་པ་། དེ་བཞིན་གཤེགས་པ་དགྲ་བཅོམ་པ ༼༤༽ ཡང་དག་པར་རྫོགས་པའི་སངས་རྒྱས་རིག་པ་ཐམས་ཅད་ཀྱི་ཕ་རོལ་ཏུ་ཕྱིན་པ་ཡོད་དོ་༎
4bef72de639144aaaeb165be146a230e,atha mṛgaśirā yena bahagavāṃs tenopasaṃkrāntaḥ | upasaṃkramya bhagavantam idam avocat |,དེ་ནས་རི་དགས་མགོ་བཅོམ་ལྡན་འདས་གང་ན་བ་དེར་སོང་ནས་པྱིན་པ་དང་བཅོམ་ལྡན་འདས་ལ་འདི་སྐད་ཅེས་གསོལ་ཏོ་༎
1610bbfbe0784737ab6acb71eca13cc2,tiryakpretamanuṣyadevaniraye jānāsi jantor gatimśiṣṭaṃ nopalabhe ca satvacaritaṃ vidyāparādhe sati |ācakṣva tribhavārṇavasya mahato vistīrṇapāraṃ prabhokiṃ tat sarvaparapravādivijaya śiṣṭaṃ na vijñāyate || iti ||,ངུད་འགྲོ་ཡི་དགས་དམྱལ་བ་ལྷ་མི་སྐྱེ་བོའི་འགྲོ་འཚལ་ན་།༼༥༽ རིག་པའི་སྐྱོན་གྱིས་སེམས་ཅན་སྦྱོད་པ་དྲུག་པ་མ་འཚལ་གྱིས་༎གཙོ་བོ་སྲིད་པ་གསུམ་གྱི་མཚོ་ཆེན་ཕ་རོལ་བྱོན་པ་པོ་༎ཕ་རོལ་སྨྲ་ཀུན་ལས་རྒྱལ་དྲུག་པ་མ་འཚལ་དེ་ཅི་གསུངས་༎
6810ea731f1847879516350f43d2d060,bhagavān āha |,བཅོམ་ལྡན་འདས་ཀྱིས་བཀའ་སྩལ་པ་།
ec82503ec9a3456d98c01b9c0aebbc88,ayoghanahatasyaiva jvalato jātavedasaḥanupūrvopaśāntasya yathā na jñāyate gatiḥ |17(82)tathā samyagvimuktānāṃ kāmapaṅkaughatāriṇāmprajñaptaṃ vā gatir nāsti prāptānām acalaṃ padam || iti ||,མེར་བསྲེགས་པ་ཡི་ལྕགས་ཀྱི་མེ་༎ ལྕགས ༼༦༽ ཀྱི་ཐོ་བས་བརྡུངས་བྱས་ནས་༎རིམ་གྱིས་ཉེ་བར་ཞི་བ་ཡི་༎ འགྲོ་བ་ཇི་ལྟར་མི་མངོན་པ་༎དེ་བཞིན་འདོད་པའི་འདམ་ཚོགས་ལས་༎ གལ་ཏེ་ཡང་དག་རྣམ་གྲོལ་བ་༎མི་གཡོ་གོ་འཕང་ཐོབ་རྣམས་ཀྱི་༎ འགྲོ་བ་གདགས་སུ་ཡོད་མ་ཡི་༎
5ef12c43e7524802a5a3688ce22a30b4,evam ukte mṛgaśirā bhagavantam idam avocat |,དེ་སྐད་ཅེས་བཀའ་སྩལ ༼༧༽ པ་དང་། བཅོམ་ལྡན་འདས་ལ་རི་དགས་མགོས་འདི་སྐད་ཅེས་གསོལ་ཏོ་༎
6419c4fb331445d7b4abe9125e1bf3cb,labheyāhaṃ bhadanta svākhyāte dharmavinaye pravrajyām upasaṃpadaṃ bhikṣubhāvaṃ careyam ahaṃ bhagavato ’ntike brahmacaryam iti |,བཙུན་པ་བདག་ལེགས་པར་གསུངས་པའི་ཆོས་འདུལ་བ་ལ་རབ་ཏུ་འབྱུང་བ་དང་བསྙེན་པར་རྫོགས་པ་དགེ་སློང་གི་དངོས་པོ་ཐོབ་པ་ལྟ་ན་། བདག་བཅོམ་ལྡན་འདས་ཀྱི་སྦྱན་སྔར་ཚངས་པར་སྤྱོད ༼ག༨༥ཨ༡༽ པ་སྤྱོད་པར་བགྱིའོ་༎
797ea66ce16c45fea4897a47dc32374e,tato bhagavatā pravrājita upasaṃpāditaḥ |  pravrājyopasaṃpādya yathābhiramyaṃ rājagṛhe vihṛtya yena śrāvastī tena cārikāṃ prakrāntaḥ |  anupūrveṇa cārikāṃ caran śrāvastīm anuprāptaḥ | śrāvastyāṃ viharati pūrvārāme mṛgāramatuḥ prāsāde |,དེ་ནས་བཅོམ་ལྡན་འདས་ཀྱིས་རབ་ཏུ་ཕྱུང་བསྙེན་པར་རྫོགས་པར་མཛད་༎ དེ་རབ་ཏུ་ཕྱུང་ཞིང་བསྙེན་པར་རྫོགས་པར་མཛད་ནས་རྒྱལ་པོའི་ཁབ་ཏུ་ཇི་ཙམ་བཞེད་ཀྱི་བར་དུ་བཞུགས་ནས་མཉན་ཡོད་གང་ན་བ་དེར་རྒྱུ་ཞིང་གཤེགས་ཏེ་།  ༼༢༽ རིམ་གྱིས་རྒྱུ་ཞིང་གཤེགས་པ་དང་མཉན་ཡོད་དུ་བྱོན་ནས་མཉན་ཡོད་ཀྱི་རི་དགས་འཛིན་གྱི་མའི་སྔོན་གྱི་ཀུན་དགའ་ར་བའི་ཁང་བཟངས་ན་བཞུགས་སོ་༎
73fd921c239443c39edacaaab14446d2,abhyavakāśe caṃkramyamāṇena nakṣatrāṇi viparītāni dṛṣṭāni |  dṛṣṭvā ca punar āyuṣmantaṃ mṛgaśirasam āmantrayate |,དེ་ནས་བཅོམ་ལྡན་འདས་བླ་གབ་མེད་པ་ན་འཆག་ཅིང་རྒྱུ་སྐར་རྣམས་གྱུར་བ་གཟིགས་སོ་༎ གཟིགས་ནས་ཚེ་དང་ལྡན་པ ༼༣༽ རི་དགས་མགོ་ལ་བཀའ་སྩལ་པ་།
f339a9b4ca564753953ea08d50518f94,samanvāhara mṛgaśiraḥ kiyac cireṇa devo varṣiṣyatīti |,རི་དགས་མགོ་ཇི་སྲིད་ཅིག་ན་ལྷས་ཆར་འབེབས་པར་འགྱུར་སོམས་ཤིག་།
34ff01ce00d7442d84b6bbebb973d43f,sa kathayati | naṣṭo ’yaṃ bhadanta lokaḥ pranaṣṭo ’yam |  yathā nakṣatrāṇi vyavasthitāni dvādaśabhir varṣaiḥ |,དེས་བསམས་ནས་བཙུན་པ་འཇིག་རྟེན་འདི་མ་རུང་འདི་རབ་ཏུ་མ་རུང་ལགས་ཏེ་། རྒྱུ་སྐར་རྣམས་ཇི་ལྷར་གནས་པ་དང་སྦྱར་ན་ལོ་བཅུ་གཉིས་སུ་ཆར་མི་འབབ ༼༤༽ ལགས་སོ་༎
c86e4595d0f1466098d65690c78e1805,bhagavatā nakṣatrāṇi samāny adhiṣṭhāyoktaḥ | punar jānīṣveti |,བཅོམ་ལྡན་འདས་ཀྱིས་རྒྱུ་སྐར་རྣམས་མཐུན་པར་བྱིན་གྱིས་བརླབས་ནས་བཀའ་སྩལ་བ་། ཡང་ཤེས་པར་གྱིས་ཤིག་།
f9cfaf222ad24165bbbd505c8e36bc08,sa kathayati | ṣaḍbhir varṣair evam | bhagavatā punaḥ paryanuyukto bravīti | paṃcabhir varṣaiḥ | evaṃ yāvat saptabhir divasair iti |,དེས་གསོལ་བ་། ལོ་དྲུག་ཏུ་ལགས་སོ་༎ དེ་བཞིན་དུ་བཅོམ་ལྡན་འདས་ཀྱིས་ཡང་སྨྲས་པ་དང་། གསོལ་པ་། ལོ་ལྡར་ལགས་སོ་༎ ༼༥༽ དེ་བཞིན་དུ་ཞག་བདུན་གྱི་བར་དུའོ་༎
54e305690e294307a5724346cfc4f14c,tatra bhagavān bhikṣūn āmantrayate sma |  śayanāsanaṃ bhikṣavaś channe gopayata |  adyaiva śalabhasaṃnipātena devo varṣiṣyati |  tatra ye snāsyanti teṣām utpādagaṇḍapiṭakāni na (83) bhaviṣyantīti |  iti hi mṛgaśiro nakṣatrāṇi capalāni caṃcalāny anavasthāyīni | jīvitam api caṃcalam anavasthitam ity evam uktaḥ |,དེ་ནས་བཅོམ་ལྡན་འདས་ཀྱིས་དགེ་སློང་རྣམས་ལ་བཀའ་སྩལ་པ་། དགེ་སློང་དག་གནས་མ་ལ་རྣམས་སྐྱབས་ཡོད་པར་སྦོས་ཤིག་། དེ་རིང་ཁོ་ནར་ལྷས་ཕྱེ་མའི་ཚོགས་ལྟ་བུའི་ཆར་འབེབས་པར་འགྱུར་ཏེ་། དེ་ལ་ཁྲུས་བྱེད་པ་གང ༼༦༽ ཡིན་པ་དེ་རྣམས་ལ་འབྲས་དང་ཕོལ་མིག་འབྱུང་བར་མི་འགྱུར་རོ་༎ རི་དགས་མགོ་དེ་ལྟར་ན་རྒྱུ་སྐར་རྣམས་ནི་འགྱུར་བ་གཡོ་བ་མི་བརྟན་པ་ཡིན་ཏེ་། སྲོག་ཀྱང་གཡོ་བ་མི་བརྟན་པ་ཡིན་ནོ་༎
df032aa0578641a0a0b887e3824d4b43,mṛgaśirā bhagavato ’bhiprasannaḥ | tathābhiprasannena cārhatvaṃ sākṣātkṛtam |  tato vimuktiprītisukhasaṃvedī gāthā bhāṣate |,བཅོམ་ལྡན་འདས་ཀྱིས་དེ་སྐད་ཅེས་བཀའ་སྩལ་པ་དང་། རི་དགས་མགོ ༼༦༽ མངོན་པར་དད་པར་གྱུར་ཏོ་༎ དེ་ལྟར་མངོན་པར་དད་པར་གྱུར་བས་དགྲ་བཅོམ་པ་མངོན་སུམ་དུ་བྱས་སོ་༎ དེ་ནས་རྣམ་པར་གྲོལ་བའི་དགའ་བ་རབ་ཏུ་མྱོང་ནས་ཚིགས་སུ་བཅད་པས་སྨྲས་པ་།
19eac2a1d57d47d8a9d01b1701e38c37,gatir mṛgāṇāṃ pavanam ākāśaṃ pakṣiṇāṃ gatiḥ |gatir virāgiṇāṃ dharmo nirvāṇaṃ gatir arhatām || iti ||,རི་དགས་རྣམས་ནི་ནགས་ཁྲོད་རྟེན་༎ འདབ་ཆགས་རྣམས་ནི་མཁའ་ལ ༼ག༨༥བ༡༽ རྟེན་༎རྣམ་པར་སྒོམ་པ་ཆོས་ལ་རྟེན་༎ དགྲ་བཅོམ་མྱ་ངན་འདས་ལ་རྟེན་༎རི་དགས་འཛིན་གྱི་མ་ས་ག་མས་༎
