fed69e1ddbc54ebeb6c16257c42564ac,§22 athāparaḥ pudgalaḥ dve saṃghāvaśeṣe āpattī āpannaḥ  praticchannāṃ cāpraticchannāṃ ca vibhrāntaḥ |  sa āgatya punar upasaṃpannaḥ |  sa yāṃ praticchādya vibhrāntas tāṃ praticchādyaiva bhikṣūṇām ārocayati |  yām apraticchādya ‹tāṃ praticchādya› bhikṣūṇām ārocayati |  bhi(7)kṣavo bhagavataḥ | bhagavān āha ||  dadata yūyaṃ bhikṣavaḥ tasya pudgalasya ubhayasaṃtateḥ parivāsa‹ṃ›┇ekasyā‹ḫ› pūrvikāyā dvitīyasya paścim‹ak›āyā iti | yo vā punar anyo ’py evaṃjātīyaḥ ||,ཡང་གང་ཟག་གཞན་ཞིག་དགེ་འདུན་ལྷག་མའི་ལྟུང་བ་གཉིས་བྱུང་བ་བཅབས་པ་དང་། མ ༼༣༽ བཅབས་པར་བབས་ཏེ་། དེ་འོངས་ནས་སླར་བསྙེན ༼H༢༥༢ཨ༣༽ པར་རྫོགས་ཏེ་། དེ་བཅབས་ནས་བབས་པ་གང་ཡིན་པ་དེ་བཅབས་བཞིན་དུ་དགེ་སློང་རྣམས་ལ་སྨྲས་། མ་བཅབས་པ་གང་ཡིན་པ་དེ་ཡང་མ་བཅབས་པར་དགེ་སློང་རྣམས་ལ ༼H༢༥༢ཨ༤༽ སྨྲས་པ་དང་། དགེ་སློང་རྣམས་ཀྱིས་བཅོམ་ལྡན་འདས ༼༤༽ ལའོ་༎ བཅོམ་ལྡན་འདས་ཀྱིས་བཀའ་སྩལ་པ་། དགེ་སློང་དག་ཁྱེད་ཀྱིས་གང་ཟག་དེའི་ལྟུང་བ་དེ་དང་། གཞན་ཡང་དེ ༼H༢༥༢ཨ༥༽ ལྟ་བུ་དང་མཐུན་པ་སུ་ཡང་རུང་བ་ལ་གཅིག་གིས་སྔ་མ་དང་ཕྱི་མ་དང་གཉིས་ཀའི་རྒྱུད་ནས་བཟུང་སྟེ་སྤོ་བ་བྱིན་ཅིག་།,"Now then, another person committed two saṃghāvaśeṣa offences, one was concealed but another one was not. He, having left the saṃgha,  on being ordained again,  informs the monks that he does afterwards conceal the offence which formerly he concealed.  Afterwards, he does conceal the offence which formerly he did not conceal.  The monks inform the blessed one. The blessed one said;  Bhikṣus! Grant that person parivāsa corresponding to both durations from that one previous offence, and the second from the last offence. This case is implemented as a judicial precedent."
b4a97108c84d4d15bd9c301bed1b5f43,§23 athāparaḥ pudgalaḥ saṃghāvaśeṣe dve āpattī āpannaḥ praticchannāṃ cāprati(8)cchannāṃ ca  vibhrāntaḥ | sa āgatya punar upasaṃpannaḥ |  sa yāṃ praticchādya vibhrāntaḥ tāṃ ‹a›praticchādyaiva bhikṣūṇām ārocayati |  yāṃ apraticchādya tām apraticchādyaiva bhikṣūṇām ārocayati | bhikṣavo bhagavataḥ |  bhagavān āha • || dadata yūyaṃ bhikṣavaḥ tasya pudgalasya eka(9)sya āpatteḥ pūrvikāyā‹ḥ› saṃtateḥ parivāsam | ekasyā‹ḫ› paścimakāyā‹ḥ› ṣaḍ rātraṃ mānāpyam iti┇yo vā punar anyo ’py evaṃjātīyaḥ ||,ཡང་གང་ཟག་གཞན་ཞིག་དགེ་འདུན་ལྷག་མའི ༼༥༽ ལྟུང་བ་གཉིས ༼H༢༥༢ཨ༦༽ བྱུང་བ་བཅབས་པ་དང་། མ་བཅབས་པར་བབས་ཏེ་འོངས་ནས་སླར་བསྙེན་པར་རྫོགས་ཏེ་། དེས་བཅབས་ནས་བབས་པ་གང་ཡིན་པ་དེ་མ་བཅབས་པར་དགེ་སློང་རྣམས་ལ་སྨྲས་། མ་བཅབས ༼H༢༥༢ཨ༧༽ པར་གང་ཡིན་པ་དེ་མ་བཅབས་པར་སྨྲས་པ་དང་། དགེ་སློང་རྣམས་ཀྱིས ༼༦༽ བཅོམ་ལྡན་འདས་ལའོ་༎ བཅོམ་ལྡན་འདས་ཀྱིས་བཀའ་སྩལ་པ་། དགེ་སློང་དག་ཁྱེད་ཀྱིས་གང་ཟག་དེའི ༼H༢༥༢བ༡༽ ལྟུང་བ་དེ་དང་། གཞན་ཡང་དེ་ལྟ་བུ་དང་མཐུན་པ་སུ་ཡང་རུང་བ་ལ་གཅིག་ནི་སྔ་མའི་རྒྱུད་ནས་བཟུང་སྟེ་སྤོ་བ་བྱིན་ཅིག་། གཅིག་ནི་ཞག་དྲུག་གི་མགུ་བར་བྱ་བ་བྱིན་ཅིག་།,"Now then, another person committed two saṃghāvaśeṣa offences, one was concealed but another one was not. He, having left the saṃgha, on being ordained again,  informs the monks that he does not afterwards conceal the offence which formerly he concealed.  Afterwards, he does not conceal the offence which formerly he did not conceal. The monks inform the blessed one.  The blessed one said; Bhikṣus! Grant that person parivāsa corresponding to duration concealed belongs to one period from the previous offence i.e., the duration he concealed the offence before he left; and the six-night mānāpya for the second offence. This case is implemented as a judicial precedent."
af9bf85c4c3c4e59b3c5760985a4919f,§24 athāparaḥ pudgalaḥ saṃghāvaśeṣe dve āpattī āpannaḥ praticchannāṃ cāpraticchannāṃ ca vi‹bhrāntaḥ |  sa āgatya punar upasaṃpannaḥ |  sa yāṃ praticchādya vi› (10)bhrānta‹ḥ› tām apraticchādya bhikṣūṇām ārocayati |  yāṃ ‹a›praticchādya tāṃ praticchādya bhikṣūṇām ārocayati | bhikṣavo bhagavataḥ |  bhagavān āha • || dadata yūyaṃ bhikṣavaḥ tasya pudgalasya ekasyā āpatteḥ pūrvikāyā‹ḥ› saṃtateḥ parivāsam | ekasyāḥ paścimakāyāḥ ‹parivāsam›  iti | (304v1) yo vā punar anyo ’py evaṃjātīyaḥ |,༼༧༽ ཡང་གང ༼H༢༥༢བ༢༽ ཟག་གཞན་ཞིག་དགེ་འདུན་ལྷག་མའི་ལྟུང་བ་གཉིས་བྱུང་བ་བཅབས་པ་དང་། མ་བཅབས་པར་བབས་ཏེ་། དེ་འོངས་ནས་སླར་བསྙེན་པར་རྫོགས་ཏེ་། དེས་བཅབས་པ་གང་ཡིན་པ་དེ་མ་བཅབས ༼H༢༥༢བ༣༽ པར་དགེ་སློང་རྣམས་ལ་སྨྲས་། མ་བཅབས་པ་གང་ཡིན་པ་དེ་བཅབས་པར ༼༡༦༩ཨ༡༽ དགེ་སློང་རྣམས་ལ་སྨྲས་པ་དང་། དགེ་སློང་རྣམས་ཀྱིས་བཅོམ་ལྡན་འདས་ལའོ་༎ བཅོམ་ལྡན་འདས་ཀྱིས་བཀའ ༼H༢༥༢བ༤༽ སྩལ་པ་། དགེ་སློང་དག་ཁྱེད་ཀྱིས་གང་ཟག་དེའི་ལྟུང་བ་དེ་དང་། གཞན་ཡང་དེ་ལྟ་བུ་དང་མཐུན་པ་སུ་ཡང་རུང་བ་ལ་གཅིག་ནི་སྔོན་གྱི་རྒྱུད་ནས་བཟུང་སྟེ་སྤོ ༼༢༽ བ་བྱིན་ཅིག་། གཅིག ༼H༢༥༢བ༥༽ ནི་ཕྱི་མའི་རྒྱུད་ནས་བཟུང་སྟེ་སྤོ་བ་བྱིན་ཅིག་།,"Now then, another person commits two saṃghāvaśeṣa offences, one was concealed but another one was not. He, having left the saṃgha,  on being ordained again,  informs the monks that he does not afterwards conceal the offence which formerly he concealed;  but afterwards, he does conceal the offence which formerly did not conceal. The monks inform the blessed one.  The blessed one said; Bhikṣus! Grant that person parivāsa corresponding to duration concealed belongs to one period from the previous offence i.e., the durations he concealed the offence before he left, and duration concealed belongs to one period from the last offence i.e., the durations he concealed after he re-ordained. This case is implemented as a judicial precedent."
83b8254bb4e4457497e12128b9e07c53,§25 athāparaḥ pudgalaḥ saṃghāvaśeṣām āpattim 6 āpannaḥ  praticchannāṃ cāpraticchannāṃ ca vibhrāntaḥ |  sa āgatya punar upasaṃpannaḥ |  sa yāṃ praticchādya vibhrāntaḥ tām apraticchādya bhikṣūṇām ārocayati |  yā‹ṃ› ‹a›praticchā(2)dya tām apraticchādyaiva bhikṣūṇām ārocayati •  bhikṣavo bhagavataḥ | bhagavān āha |  dadata yūyaṃ bhikṣavas tasya pudgalasya ekasyā āpatteḥ pūrvikāyāḥ santateḥ parivāsam | ekasyāḥ paścimikāyā‹ḥ› ṣaḍ rātraṃ mānāpyam iti | yo vā punar anyo ’py evaṃjātīyaḥ |,ཡང་གང་ཟག་གཞན་ཞིག་གིས་དགེ་འདུན་ལྷག་མའི་ལྟུང་བ་གཉིས་བྱུང་བ་བཅབས་པ་དང་། མ་བཅབས་པར་བབས་ཏེ་། དེ་འོངས་ནས ༼H༢༥༢བ༦༽ སླར་བསྙེན་པར་རྫོགས་ཏེ་། དེས་བཅབས་ནས་བབས་པ་གང་ཡིན་པ་དེ་མ་བཅབས ༼༣༽ པར་དགེ་སློང་རྣམས་ལ་སྨྲས་། མ་བཅབས་པ་གང་ཡིན་པ་དེ་མ་བཅབས་པ་ཁོ་ནས་དགེ་སློང་རྣམས་ལ ༼H༢༥༢བ༧༽ སྨྲས་པ་དང་། དགེ་སློང་རྣམས་ཀྱིས་བཅོམ་ལྡན་འདས་ལའོ་༎ བཅོམ་ལྡན་འདས་ཀྱིས་བཀའ་སྩལ་པ་། དགེ་སློང་དག་ཁྱེད་ཀྱིས་གང་ཟག་དེའི་ལྟུང་བ་དེ་དང་། གཞན་ཡང་དེ ༼H༢༥༣ཨ༡༽ ལྟ ༼༤༽ བུ་དང་མཐུན་པ་སུ་ཡང་རུང་བ་ལ་གཅིག་གི་ནི་སྔོན་གྱི་རྒྱུད་ནས་བཟུང་སྟེ་སྤོ་བ་བྱིན་ཅིག་། གཅིག་གི་ནི་ཞག་དྲུག་གི་མགུ་བར་བྱ་བ་བྱིན་ཅིག་།,"Now then, another person commits two saṃghāvaśeṣa offences, one was concealed but another one was not. He, having left the saṃgha,  on being ordained again,  informs the monks that he does not afterwards conceal the offence which formerly he concealed;  afterwards, he does not conceal the offence which formerly he did not conceal.  The monks inform the blessed one. The blessed one said;  Bhikṣus! Grant that person parivāsa corresponding to duration concealed belongs to one period from the previous offence i.e., the durations he concealed it before he left; then grant a six-night mānāpya from the last one. This case is implemented as a judicial precedent."
35ea452db01c4ace9fab6e6f9be6ecb1,§26 athāparaḥ pudgalaḥ e(3)vaṃ pārivāsika‹ḫ› paryuṣitaparivāsaḥ mānāpyacārikaḥ caritamānāpya‹ḥ› • śikṣādattakaś ca vaktavyaḥ |  yathā vibhrāntaḥ evaṃ śramaṇoddeśakatvaṃ pratijānāti |  unmattakatvaṃ pratijānāti | ‹vi›kṣiptacittakatvaṃ vedanābhinnakatvam adarśanāyotkṣiptakatvaṃ apratiniḥsṛṣṭe pāpake dṛ(4)ṣṭigate utkṣiptakatvam iti vistareṇa vācyaṃ ||,བབས་པ་ཇི་ལྟ་བ ༼H༢༥༣ཨ༢༽ བཞིན་དུ་སྤོ་བ་དང་། སྤོ་བ་སྤྱད་པ་དང་། མགུ་བར་བྱ་བ་དང་། མགུ་བར་བྱ་བ་སྤྱོད་པ་དང་། བསླབ་པ་བྱིན་པ་ལ་ཡང་དེ ༼༥༽ བཞིན་དུ་བརྗོད་པར་བྱའོ་༎ བབས་པ་ཇི་ལྟ་བ་བཞིན་དུ་དགེ ༼H༢༥༣ཨ༣༽ ཚུལ་ཉིད་དུ་ཁས་བླངས་པ་དང་། སྨྱོས་པ་ཉིད་དང་། སེམས་འཁྲུགས་པ་ཉིད་དང་། ཚོར་བས་ཉེན་པ་ཉིད་དང་། མ་མཐོང་བས་གནས་ནས་དབྱུང་བ་ཉིད་དང་། ཕྱིར་མི་བྱེད་པས་གནས ༼H༢༥༣ཨ༤༽ ནས་དབྱུང་བ་ཉིད་དང་། སྡིག་པ ༼༦༽ ཅན་གྱི་ལྟ་བར་སོང་བ་མི་འདོར་བས་གནས་ནས་དབྱུང་བ་ཉིད་ལ་ཡང་དེ་བཞིན་དུ་རྒྱས་པར་བརྗོད་པར་བྱའོ་༎,"Now then, another person who is regarded as pārivāsika, is as the following, paryuṣitaparivāsa, mānāpyacārika, caritamānāpya and śikṣādattaka.  One should acknowledge all these following persons as the vibhrānta:  śrāmaṇeraka, unmattaka, vikṣiptacittaka, vedanābhinnaka, and the three types of utkṣepaka.” If one shall give the full references."
87c87726b215498dbbc4b4a58338eb9e,§27 athāparaḥ pudgalaḥ saṃghāvaśeṣām āpattim āpannaḥ | parimāṇavatī praticchannā | sa saṃghenādarśanāyotkṣiptaḥ | osāritaḥ sa tā āpattī‹ḥ› praticchādya bhikṣūṇām ārocayati |  bhikṣavo bhagavataḥ | bhagavān āha |  dadata yūyaṃ bhikṣa(5)vaḥ tasya pudgalasya tāsām āpattīnāṃ parimāṇavatya iti 7 kṛtvā ubhayasantateḥ parivāsaṃ pūrvikāyāḥ paścimakāyāś ca iti | yo vā punar anyo ’py evaṃjātīyaḥ ||,ཡང་གང་ཟག་གཞན་ཞིག་དགེ་འདུན་ལྷག ༼H༢༥༣ཨ༥༽ མའི་ལྟུང་བ་ཚད་དང་ལྡན་པ་བྱུང་བ་བཅབས་པ་དེ་དགེ་འདུན་གྱིས་མ་མཐོང་བས་གནས་ནས་དབྱུང་བ་བྱས་ཏེ་བསླང་ཟིན་པ་དེས་ལྟུང་བ་རྣམས ༼༧༽ བཅབས་ནས་དགེ་སློང་རྣམས་ལ་སྨྲས ༼H༢༥༣ཨ༦༽ པ་དང་། དགེ་སློང་རྣམས་ཀྱིས་བཅོམ་ལྡན་འདས་ལའོ་༎ བཅོམ་ལྡན་འདས་ཀྱིས་བཀའ་སྩལ་པ་། དགེ་སློང་དག་ཁྱེད་ཀྱིས་གང་ཟག་དེ་དང་། གཞན་ཡང་དེ་ལྟ་བུ་དང ༼H༢༥༣ཨ༧༽ མཐུན་པ་སུ་ཡང་རུང་བ་ལ་ལྟུང་བ་དེ་རྣམས་ཚད་དང་ལྡན་པའོ་ཞེས་བྱོས་ལ་སྔ་མ ༼༡༦༩བ༡༽ དང་ཕྱི་མ་གཉིས་ཀའི་རྒྱུད་ནས་བཟུང་སྟེ་སྤོ་བ་བྱིན་ཅིག,"Now then, another person commits saṃghāvaśeṣa offences, with a definite measure, they concealed. He was expelled from the saṃgha because he did not recognise the offence. Having been reintegrated into the saṃgha, he informs the monks that he concealed these offences.  The monks inform the blessed one. The blessed one said;  Bhikṣus! Grant that person parivāsa after having determined in accord with the definite measure of those offences, i.e., of both durations, which are the first i.e., the duration before he was expelled and the last i.e., the duration after he is reintegrated into the saṃgha.” This case is implemented as a judicial precedent."
e35a7ec11d89495aa8d3c078855263c8,§28 athāparaḥ pudgalaḥ saṃghāvaśeṣām āpattim āpannaḥ | parimāṇavatī praticchannā┇sa saṃ(6)ghena adarśanāyotkṣiptaḥ | osāritaḥ sa tā āpattīr apraticchādya bhikṣūṇām ārocayati |  bhikṣavo bhagavataḥ | bhagavān āha •  dadata yūyaṃ bhikṣavaḥ tasya pudgalasya tāsām āpattīnāṃ parimāṇavata iti 8 kṛtvā pūrvikāyāḥ saṃtateḥ parivāsam iti | yo vā (7) punar anyo ’py evaṃjātīyaḥ |,ཡང་གང་ཟག་གཞན་ཞིག ༼H༢༥༣བ༡༽ དགེ་འདུན་ལྷག་མའི་ལྟུང་བ་ཚད་དང་ལྡན་པ་བྱུང་བ་བཅབས་པ་དེ་དགེ་འདུན་གྱིས་མ་མཐོང་བས་གནས་ནས་དབྱུང་བ་བྱས་ཏེ་བསླང་ཟིན་པ་དེས་ལྟུང་བ་དེ་རྣམས་མ་བཅབས་པར་དགེ་སློང་རྣམས ༼H༢༥༣བ༢༽ ལ་སྨྲས་པ་དང་། དགེ ༼༢༽ སློང་རྣམས་ཀྱིས་བཅོམ་ལྡན་འདས་ལའོ་༎ བཅོམ་ལྡན་འདས་ཀྱིས་བཀའ་སྩལ་པ་། དགེ་སློང་དག་ཁྱེད་ཀྱིས་གང་ཟག་དེ་དང་། གཞན་ཡང་དེ་ལྟ་བུ་དང་མཐུན་པ ༼H༢༥༣བ༣༽ སུ་ཡང་རུང་བ་ལ་ལྟུང་བ་དེ་རྣམས་ཚད་དང་ལྡན་པའོ་ཞེས་བྱོས་ལ་སྔོན་གྱི་རྒྱུད་ནས་བཟུང་སྟེ་སྤོ་བ་བྱིན་ཅིག་།,"Now then, another person commits saṃghāvaśeṣa offences, with a definite measure, they concealed. He was expelled from the saṃgha because he did not recognise the offence. Having been reintegrated into the saṃgha, he informs the monks that he did not conceal these offences.  The monks inform the blessed one. The blessed one said;  Bhikṣus! Grant that person parivāsa after having determined in accord with the definite measure of those offences, i.e., of duration which belongs to the previous offence.” This case is implemented as a judicial precedent."
4be108071e824dbbb2f59e922cf3d2bd,§29 athāparaḥ pudgalaḥ saṃghāvaśeṣām āpattim āpannaḥ | parimāṇavatī apraticchannā | sa saṃghena adarśanāyotkṣipta‹ḥ› | osāritaḥ sa tā āpattī‹ḫ› praticchādya bhikṣūṇām ārocayati |  bhikṣavo bhagavataḥ | bhagavān āha ||  dadata yūyaṃ bhi(8)kṣavas tasya pudgalasya tāsām āpattīnāṃ parimāṇavatya iti 9 kṛtvā paścimikāyās saṃtateḥ parivāsa‹m› iti • yo vā punar anyo ’py evaṃjātīyaḥ ||,ཡང་གང་ཟག་གཞན ༼༣༽ ཞིག་དགེ་འདུན་ལྷག་མའི་ལྟུང་བ་ཚད་དང་ལྡན་པ་བྱུང་བ ༼H༢༥༣བ༤༽ མ་བཅབས་པ་དེ་དགེ་འདུན་གྱིས་མ་མཐོང་བས་གནས་ནས་དབྱུང་བ་བྱས་ཏེ་བསླང་ཟིན་པ་དེས་ལྟུང་བ་དེ་རྣམས་བཅབས་ཏེ་དགེ་སློང་རྣམས་ལ་སྨྲས་པ་དང་། དགེ་སློང་རྣམས་ཀྱིས་བཅོམ ༼H༢༥༣བ༥༽ ལྡན་འདས་ལའོ་༎ བཅོམ་ལྡན་འདས་ཀྱིས་བཀའ ༼༤༽ སྩལ་པ་། དགེ་སློང་དག་ཁྱེད་ཀྱིས་གང་ཟག་དེ་དང་། གཞན་ཡང་དེ་ལྟ་བུ་དང་མཐུན་པ་སུ་ཡང་རུང་བ་ལ་ལྟུང་བ་དེ་རྣམས་ཚད་དང་ལྡན ༼H༢༥༣བ༦༽ པའོ་ཞེས་བྱོས་ལ་ཕྱི་མའི་རྒྱུད་ནས་བཟུང་སྟེ་སྤོ་བ་བྱིན་ཅིག་།,"Now then, another person commits saṃghāvaśeṣa offences, with a definite measure, they were not concealed. He was expelled from the saṃgha because he did not recognise the offence. Having been reintegrated into the saṃgha, he informs the monks that he concealed these offences.  The monks inform the blessed one. The blessed one said;  Bhikṣus! Grant that person parivāsa after having determined in accord with the definite measure of those offences, i.e., of duration which belongs to the last offence.” This case is implemented as a judicial precedent."
5fd71eba9bfd49dca82d046247415846,§30 athāparaḥ pudgalaḥ saṃghāvaśeṣām āpattim āpannaḥ | parimāṇavatī apraticchannā | sa saṃghena adarśanāyotkṣipya 10 |  osāritaḥ sa tā (10) āpattīr apraticchādya bhikṣūṇām ārocayati |  bhikṣavo bhagavataḥ | bhagavān āha |  dadata yūyaṃ bhikṣavas tasya pudgalasya tāsām āpattīnāṃ parimāṇavatyeti kṛtvā ṣaḍ rātraṃ mānāpyam iti | yo vā punar anyo ’py evaṃjātīyaḥ |,ཡང་གང་ཟག་གཞན་ཞིག་དགེ་འདུན་ལྷག་མའི་ལྟུང་བ་ཚད་དང་ལྡན་པ་བྱུང་བ་མ་བཅབས་པ་དེ ༼༥༽ དགེ་འདུན ༼H༢༥༣བ༧༽ གྱིས་མ་མཐོང་བས་གནས་ནས་དབྱུང་བ་བྱས་ཏེ་། བསླང་ཟིན་པ་དེས་ལྷུང་བ་དེ་རྣམས་མ་བཅབས་པར་དགེ་སློང་རྣམས་ལ་སྨྲས་པ་དང་། དགེ་སློང་རྣམས་ཀྱིས་བཅོམ་ལྡན་འདས་ལའོ་༎ ༼H༢༥༤ཨ༡༽ བཅོམ་ལྡན་འདས་ཀྱིས་བཀའ་སྩལ་པ་། དགེ་སློང་དག་ཁྱེད་ཀྱིས་གང་ཟག་དེ་དང་། གཞན་ཡང ༼༦༽ དེ་ལྟ་བུ་དང་མཐུན་བ་སུ་ཡང་རུང་བ་ལ་ལྟུང་བ་དེ་རྣམས་ཚད་དང་ལྡན ༼H༢༥༤ཨ༢༽ པའོ་ཞེས་བྱོས་ལ་ཞག་དྲུག་གི་མགུ་བར་བྱ་བ་བྱིན་ཅིག་།,"Now then, another person commits saṃghāvaśeṣa offences, with a definite measure, they were not concealed. He was expelled from the saṃgha because he did not recognise the offence.  Having been reintegrated into the saṃgha, he informs the monks that he did not conceal these offences.  The monks inform the blessed one. The blessed one said;  Bhikṣus! Grant that person a mānāpya after having determined in accord with the definite measure of those offences.” This case is implemented as a judicial precedent."
c4e88a54771042b9b0b204cc2fb1f754,§31 yathā parimāṇavatī‹r› evam aparimāṇavatī‹ḥ› ||  ya(305r1)thā adarśanāyotkṣiptakena aṣṭau evam apratikarmāyotkṣipta‹kena› evam aṣṭau apratiniḥsṛṣṭe pāpake dṛṣṭigate utkṣiptakena aṣṭau ||,ཚད་དང་ལྡན་པ་ཇི་ལྟ་བ་བཞིན་དུ་ཚད་དང་མི་ལྡན་པ་ཡང་དེ་བཞིན་ནོ་༎ མ་མཐོང་བས་གནས་ནས་དབྱུང་བ་བརྒྱད་ཡིན་པ་ཇི་ལྟ་བ ༼H༢༥༤ཨ༣༽ བཞིན་དུ་ཕྱིར་མི་བྱེད་པས་གནས ༼༧༽ ནས་དབྱུང་བ་བརྒྱད་དང་། སྡིག་པ་ཅན་གྱི་ལྟ་བར་སོང་བ་མི་འདོར་བས་གནས་ནས་དབྱུང་བ་བརྒྱད་ཀྱང་དེ་བཞིན་ནོ་༎,"The case of indefinite measure should be treated in the same way as of definite measure.  So as the eight types of one who is expelled because he does not recognise the offence, as well as eight types of the one who is expelled because he does not try to mend the guilt and eight types of one who is expelled when his wrong view is not yet counteracted."
5a00312ce1d94f8f874ae4cd9b1f76a5,§32 pārivāsikaḥ pudgalaḥ saṃghāvaśeṣām āpattim āpanno vibhrāntas |  sa āgatya punar upasaṃpannaḥ | etat prakaraṇaṃ bhikṣavo bhagavata āro(2)cayanti | bhagavān āha |  aparyuṣitaparivāsaṃ ‹parivasa›tu | paryuṣitaparivāso bhaviṣyatīti ||,སྤོ་བ་པོའི་གང་ཟག་དགེ་འདུན་ལྷག ༼H༢༥༤ཨ༤༽ མའི་ལྟུང་བ་བྱུང་ནས་བབས་ཏེ་། དེ་འོངས་ནས་སླར་བསྙེན་པར་རྫོགས་པའི་སྐབས་དེ་དགེ་སློང་རྣམས་ཀྱིས་བཅོམ་ལྡན་འདས་ལ ༼༡༧༠ཨ༡༽ གསོལ་པ་དང་། བཅོམ་ལྡན་འདས་ཀྱིས་བཀའ་སྩལ་པ་།  ༼H༢༥༤ཨ༥༽ མ་སྤྱད་པ་སྤྱོད་དུ་ཆུག་ཅིག་དང་སྤོ་བ་སྤྱད་པར་འགྱུར་རོ་༎,"A person, who is a pārivāsika, commits a saṃghāvaśeṣa offence. Having left the saṃgha,  he returns to ordination again. The monks inform the blessed one on that matter. The blessed one said;  let him practice his uncompleted period of exclusion. Once he completed it, he will be known as a paryuṣitaparivāsa."
