d77bf73748194b77962528af9a5ce5b0,dvāv imau kāśyapa pravrajitasya paridāgho katamo dvau · yad uta sakāṣāyasya ca kāṣāyadhāraṇaṃ śīlavaṃtā guṇavaṃtā cāntikād upasthānaparicaryāsvīkaraṇaṃ cetīme kāśyapa dvau pravrajitasya paridāgho · tatredam ucyate 7 sakaṣāyacittasya kāṣāyadhāraṇaṃ śīlānvitānāṃ ca sakāśa sevanāparicaryupasthānabhivādanaṃ ca dharmāv imau dvau parivarjanīyā·,沙門復有二事悔。何等為二事。一者不應行強披袈裟。二者身不自持戒。持戒比丘反承事。,復次迦葉。出家學者有二煩熱。云何為二。一者藏濁持袈裟。二者欲令有戒行者承順於己。,又出家人有二燒法。何謂為二。一者垢心受著法衣。二者受他持戒善人供養。,佛告迦葉。有二種法增出家熱惱。云何二種。一受持袈裟心懷不淨。二恃己戒德訶責非行。我今於此而說頌曰。雖復披袈裟 心行不淨行設身有戒德 而用於惡言催伏非行者 此二須遠離,འོད་སྲུང་འདི་གཉིས་ནི་རབ་ཏུ་བྱུང་བའི་ཡོངས་སུ་གདུང་བ་སྟེ་། གཉིས་གང་ཞེ་ན་། རྙོག་པ་དང་བཅས་པའི་སེམས་ཀྱིས་ངུར་སྨྲིག་འཆད་པ་དང་། ཚུལ་ཁྲིམས་དང་ལྡན་པ་། ཡོན་ཏན་དང་ལྡན་པ་ལས་བསྙེན་བཀུར་དང་རིམ་གྲོར་བྱ་བ་བདག་གིར་བྱེད་པ་སྟེ་འདི་གཉིས་སོ་༎ དེ་ལ་འདི་སྐད་ཅེས་བྱ་སྟེ་། རྙོག་དག་བཅས་པའི་སེམས་ཀྱིས་ངུར་སྨྲིག་འཆང་བ་དང་༎ བསྙེན་བཀུར་རིམ་གྲོ་བྱེད་དང་གུས་པར་སྨྲ་བ་དག་༎ ཚུལ་ཁྲིམས་ལྡན་པ་རྣམས་ལ་སྟེན་པར་བྱེད་པ་སྟེ་༎ ཆོས་གཉིས་འདི་དག་ཡོངས་སུ་སྤང་བར་བྱ་བ་ཡིན་༎
4c5cf3fdbee0437c9b83ff06716c129c,dvāv imau kāśyapa pravrajitasya dīrghaglānyau katamau dvau · yad uta abhimānikasya ca cittanidhyaptir mahāyānasaṃprasthitānāṃ ca satvānā vicchandanā ime kāśyapa dvau pravrajitasya dīrghagailānyo · tatredam ucyate 8nidhyapti cittasy’ abhimānikānāṃ vicchandanāyāpi ca buddhayānaṃ · ime hi dve pravrajitasya glānye ukte jinenāpratipudgalena,沙門復有二事病難愈。何等為二事。一者心邪亂。二者人有作菩薩道者止斷。,出家學者復有二病。云何為二。一者憍慢不觀其心。二者毀呰學摩訶衍者。,又出家人有二種病。何謂為二。一者懷增上慢而不伏心。二者壞他發大乘心。,佛告迦葉。有二種法醫出家人病。云何二法。一行大乘者見心決定。二為諸眾生不斷佛法。我今於此而說頌曰。若有出家者 行彼大乘行見心恒決定 不斷於佛法此二出家人 佛說名無病,འོད་སྲུང་འདི་གཉིས་ནི་རབ་ཏུ་བྱུག་བའི་ནད་གསོར་མི་རུང་བ་སྟེ་། གཉིས་གང་ཞེ་ན་༎ མངོན་པའི་ང་རྒྱལ་གྱིས་སེམས་ངེས་པར་སེམས་པ་དང་ཐེག་པ་ཆེན་པོ་ལ་ཡང་དག་པར་ཞུགས་པའི་གང་ཟག་རྣམས་ཀྱི་འདུན་པ་ཟློག་པ་སྟེ་འདི་གཉིས་སོ་༎ དེ་ལ་འདི་སྐད་ཅེས་བྱ་སྟེ་། མངོན་པའི་ང་རྒྱལ་སེམས་ལ་ངེས་སེམས་དང་༎ སངས་རྒྱས་ཐེག་པ་ལས་ནི་འདུན་པ་ཟློག་༎ འདི་གཉིས་རབ་ཏུ་བྱུང་བའི་ནད་ཡིན་ཞེས་༎ གང་ཟག་མཚུངས་པ་མེད་པའི་རྒྱལ་བས་གསུངས་༎ ༼ཊེ྾ཏ་མོབེ༹ད༽
49074a0b8c214087b28e0834cf467405,dvāv imo kāśyapa pravrajitasya acikitso gailānyau · katamau dvau · yad utābhīkṣṇāpatti-āpadyanatā · avyutthānatā cetī ime kāśyapa dvau pravrajitasya acikitso glānyo 9,,,,佛告迦葉。有二種法為出家人長病。云何二種。一得阿波諦重罪。二不能發露懺悔。我今於此而說頌曰。出家比丘眾 犯彼阿波諦不能懺滅罪 愚迷不重戒剎那剎那實 此惡長為病,-
7d7c29b5243c40e895108ea1cc67db2f,dvāv imau kāśyapa pravrajitasya śalyo katamau dvau · yad uta śikṣāpadasamatikkramaṃ ca anādattasārasya ca kālakriyā ime kāśyapa dvau pravrajitasya śalyo 10,沙門復有二事。何等為二事。一者都犯戒。二者於法中無所得。(Text moved),,,,འོད་སྲུང་འདི་གཉིས་ནི་རབ་ཏུ་བྱུང་བའི་ཟུག་རྔུ་སྟེ་། གཉིས་གང་ཞེ་ན་། བསླབ་པའི་གཞི་ལས་འགལ་བ་དང་། སྙིང་པོ་མ་བླངས་པར་འཆི་བའི་དུས་བྱེད་པ་སྟེ་། འདི་གཉིས་སོ་༎ དེ་ལ་འདི་སྐད་ཅེས་བྱ་སྟེ་། བསླབ་པའི་གཞི་ལས་འགལ་བར་གྱུར་པ་དང་༎ སྙིང་པོ་མ་བླངས་པར་ནི་དུས་བྱེད་པ་༎ འདི་གཉིས་རབ་ཏུ་བྱུང་བའི་ཟུག་རྔུ་ཞེས་༎ ལྷ་མིའི་སྟོན་པ་ཐམས་ཅད་མཁྱེན་པས་གསུངས་༎
f3331fd64fa44b0a967bd2750e93a329,śrramaṇa śramaṇa iti kāśyapa ucyate · kiyan nu tāvat kāśyapa śrramaṇaḥ śramaṇa ity ucyate · catvāra ime kāśyapa śramaṇaḥ katame catvāraḥ yad uta varṇarūpaliṅgasaṃsthānaśramaṇa · ācāraguptikuhakaśrramaṇaḥ kīrtiśabdaślokaśrramaṇaḥ bhūtapratipattiśrramaṇaḥ ime kāśyapa catvāraḥ śramaṇāḥ ·,佛語迦葉。沙門何故。正字沙門。有四事字為沙門。何等為四。一者形容被服像如沙門。二者外如沙門內懷媮女*閻。三者求索嘩名自貢高。四者行不犯真沙門也。,復次迦葉。沙門稱說沙門者。云何沙門稱說沙門有四沙門。云何為四。一者色像沙門二者詐威儀沙門。三者名譽沙門。四者真實沙門。,又大迦葉。謂沙門者。有四種沙門。何謂為四。一者形服沙門。二者威儀欺誑沙門。三者貪求名聞沙門。四者實行沙門。,佛告迦葉。此有沙門為沙門名。迦葉白言。云何沙門為沙門名。迦葉。此有四種沙門。云何四種。一行色相沙門。二密行虛誑沙門。三求名聞稱讚沙門。四實行沙門。迦葉此是四種沙門。,འོད་སྲུང་དགེ་སྦྱོང་དགེ་སྦྱོང་ཞེས་བྱ་བ་ཇི་ཙམ་གྱིས་ན་དགེ་སྦྱོང་དགེ་སྦྱོང་ཞེས་བྱ་ཞེ་ན་། འོད་སྲུང་བཞི་པོ་འདི་དག་ནི་དགེ་སྦྱོང་སྟེ་། བཞི་གང་ཞེ་ན་། ཁ་དོག་དང་རྟགས་དང་དབྱིབས་ཀྱི་དགེ་སྦྱོང་དང་ཆོ་ག་སྲུང་ཞིང་ཚུལ་འཆོས་པའི་དགེ་སྦྱོང་དང་བརྗོད་པའི་སྒྲ་ཚིགས་སུ་བཅད་པའི་དགེ་སྦྱོང་དང་བརྗོད་པའི་སྒྲ་ཚིགས་སུ་བཅད་པའི་དགེ་སྦྱོང་དང་། ཡང་དག་པར་སྒྲུབ་པའི་དགེ་སྦྱོང་ངོ་༎
ecfb9057e7464cffb284cc93714fee89,tatra kāśyapa katamo varṇarūpaliṅgasaṃsthānaśramaṇaḥ iha kāśyapa ih’ ekatya śrramaṇa varṇarūpaliṅgasaṃsthānasamanvāgato bhavati · saṃghāṭīpariveṣṭhito muṇḍaśiraḥ su{}pātrapāṇaiḥ parigṛhītaḥ sa ca bhavaty apariśuddhakāyakarmasamudācāra apariśuddhavākkarmasamudācāraḥ apariśuddhamanaskarmasamudācārau bhavati· ayukta amuktaḥ adāntaḥ aśāntaḥ aguptaḥ avinītaḥ lubdhaḥ alaso duḥśīlappāpadharmasamācāraḥ ayam ucyate kāśyapa varṇarūpaliṅgasaṃsthānaśramaṇaḥ,何等為形容被服如沙門者。髠頭剔鬚。著袈裟持鉢。心不正不持戒。但欲作惡喜學外道。是為被服如沙門。,云何色像沙門。若有沙門成就色像。剔除鬚髮被著法服手持應器。彼身惡行口意惡行。不習調御亦不守護。犯戒作惡貪不精進。是謂迦葉色像沙門。,何謂形服沙門。有一沙門形服具足被僧伽梨。剃除鬚髮執持應器。而便成就不淨身業不淨口業不淨意業。不善護身慳嫉懈怠破戒為惡。是名形服沙門。,迦葉白言。云何名行色相沙門。迦葉。此一沙門。雖復剃除鬚髮著佛袈裟受持鉢器色相具足。而身不清淨。口不清淨。意不清淨。不自調伏麁惡不善。廣貪財利命不清淨。得破戒罪法。迦葉。此名行色相沙門。,འོད་སྲུང་དེ་ལ་ཁ་དོག་དང་རྟགས་དང་དབྱིབས་ཀྱི་དགེ་སྦྱོང་གང་ཞེ་ན་། འོད་སྲུང་འདི་ལ་དགེ་སྦྱོང་ཁ་ཅིག་ཁ་དོག་དང་རྟགས་དང་དབྱིབས་དང་ལྡན་པར་གྱུར་ཏེ་༎ ཆོས་གོས་སྣམ་སྦྱར་གྱོན་ཅིང་མགོ་བྲེགས་ཏེ་། ལག་ན་ལྷུང་བཟེད་ཐོགས་མོད་ཀྱི་དེ་ལུས་ཀྱི་ལས་ཡོངས་སུ་མ་དག་པར་སྤྱོད་། ངག་གི་ལས་ཡོངས་སུ་མ་དག་པར་སྤྱོད་༎ ཡིད་ཀྱི་ལས་ཡོངས་སུ་མ་དག་པར་སྤྱོད་ཅིང་མ་དུལ་བ་མ་ཞི་བ་༎ མ་བསྲུངས་པ་། མ་བྱང་བ་༎ འཚོ་བ་ཡོངས་སུ་མ་དག་པ་། བརྐམ་པ་། ལེ་ལོ་ཅན་། ཚུལ་ཁྲིམས་འཆལ་པ་། སྡིག་པའི་ཆོས་ཅན་ཡིན་ཏེ་། འོད་སྲུང་དེ་ནི་ཁ་དོག་དང་རྟགས་དང་དབྱིབས་ཀྱི་དགེ་སྦྱོང་ཞེས་བྱའོ་༎
b56ba4a1959140ff8c2e5c23de78b358,tatra kāśyapa katamaḥ ācāraguptikuhakaḥ śramaṇaḥ iha kāśyapa ihaikatya śrramaṇaḥ ācāracāritrasaṃpanno bhavati saṃprajānacārī caturbhi īryāpathair lūhānnapānabhojīsaṃtuṣṭaḥ caturbhir āryavaṃśer asaṃsṛṣṭo gṛhasthapravrajitair alpabhāṣyo ’lpamaṃtraḥ te cāsyeryāpathāḥ kuhanalapanatayā kalpitā bhavaṃti · na cittapariśuddhaye · na śamāya nopaśamāya · na damāya · upalaṃbhadṛṣṭikaś ca bhavati · śunyatānupalaṃbhāś ca dharmeṣu śrrutvā prapātasaṃjñī bhavati · śunyatāvādināṃ ca bhikṣuṇām aṃtike aprasādasaṃjñīm utpādayati iyam ucyate kāśyapa ācāraguptikuhakaśrramaṇaḥ,何因外如沙門內懷媮女*閻者。安徐而行。安徐而出安徐而入。外道麁惡於山間草屋為廬。內無信著我著我所。中有因苦直信者反自嫉妬。,云何詐威儀沙門。若有沙門成就禮節。遊步正智。食知止足。行四聖種。不樂眾聚道俗之會。少言少睡。然彼威儀詐不真實不期淨心。不習止息而有見想。於空便起如坑之想。諸有比丘習行空者。發怨家想。是謂迦葉詐威儀沙門。,何謂威儀欺誑沙門。有一沙門具足沙門身四威儀。行立坐臥一心安詳。斷諸美味修四聖種。遠離眾會。出家憒閙之眾。言語柔軟。行如是法皆為欺誑。不為善淨而於空法有所見得。於無得法生恐畏心。如臨深想。於空論比丘生怨賊想。是名威儀欺誑沙門。,迦葉白言云何名密行虛誑沙門。迦葉。此一沙門。雖知行業亦具威儀。喫麁惡飲食。詐歡詐喜。於行住坐臥。恒搆虛誑。又不親近在家出家四聖種族。詐默無言誑賺有情。心無清淨亦無調伏。亦不息念虛妄推度。住著我人之相。若遇空法而生怖畏如登崖險。若見比丘善談空者如遇冤家。迦葉。此說名為密行虛誑沙門。,འོད་སྲུང་དེ་ལ་ཆོ་ག་སྲུང་ཞིང་ཚུལ་འཆོས་པའི་དགེ་སྦྱོང་གང་ཞེ་ན་། འོད་སྲུང་འདི་ལ་དགེ་སྦྱོང་ཁ་ཅིག་ཆོ་ག་དང་། སྤྱོད་ཡུལ་དང་། སྤྱོད་པ་ཕུན་སུམ་ཚོགས་ཤིང་སྤྱོད་ལམ་བཞིར་ཤེས་བཞིན་དུ་སྤྱོད་ལ་༎ ཟས་དང་སྐོམ་ངན་པ་ཟ་འཐུང་། འཕགས་པའི་རིགས་བཞི་པོ་དག་གིས་ཆོག་པར་འཛིན་༎ བས་མཐའི་གནས་མལ་ལ་མངོན་པར་དགའ་། ཁྱིམ་པ་དང་རབ་ཏུ་བྱུང་བ་རྣམས་དང་མི་འདྲེ་ལ་ཚིག་ཉུང་ཞིང་སྨྲ་བ་ཉུང་མོད་ཀྱི་དེའི་སྤྱོད་ལམ་དེ་དག་ཀྱང་ཚུལ་འཆོས་པ་དང་། ཁ་གསག་གིས་ཡོངས་སུ་བརྟགས་པ་ཡིན་ཏེ་། སེམས་ཡོངས་སུ་དག་པར་བྱ་བའི་ཕྱིར་མ་ཡིན་༎ དུལ་བར་བྱ་བའི་ཕྱིར་མ་ཡིན་༎ ཉེ་བར་ཞི་བར་བྱ་བའི་ཕྱིར་མ་ཡིན་གྱི་༎ དམིགས་པར་ལྟ་བ་ཡིན་ཏེ་། ངར་འཛིན་པ་དང་ང་ཡིས་འཛིན་པ་ལ་གནས་ཤིང་སྟོང་པ་ཉིད་ཀྱིས་མི་དམིགས་པའི་ཆོས་རྣམས་ལ་གཡང་སར་འདུ་ཤེས་པ་ཡིན་། སྟོང་པ་ཉིད་སྨྲ་བའི་དགེ་སློང་རྣམས་ལ་ཡང་དགྲར་འདུ་ཤེས་པ་ཡིན་ཏེ་། འོད་སྲུང་དེ་ནི་ཆོ་ག་སྲུང་ཞིང་ཚུལ་འཆོས་པའི་དགེ་སྦྱོང་ཞེས་བྱའོ་༎
227665c68d9c4b5bb2b9233971b41319,tatra kāśyapa katamaḥ kīrtiśabdaślokaḥ śrramaṇaḥ iha kāśyapa ihaikatya śrramaṇaḥ pratisaṃkhyāya śīlaṃ rakṣati · kathamān pare jānīyuḥ śīlavatān iti · pratisaṃkhyāya śrutam udgṛhṇīte kathamāṃ pare jānīyur bahuśrruta iti · pratisaṃkhyāyāraṇye prativasati · kathamāṃ pare jānīyur āraṇyaka iti · pratisaṃkhyāya alpecchaḥ saṃtuṣṭaḥ pravivikto viharati · yāvad eva paropadarśanāya na nirvedāya na virāgāya na nirodhāya · nopaśamāya · na saṃbodhaye · na śrrāmaṇyāya · na brāhmaṇyāya · na nirvāṇāya · ayam ucyate kāśyapa kīrtiśabdaślokaśrramaṇa,何因為求索嘩名者。媮女*閻持戒令他人稱譽。媮女*閻學經令他人稱譽。媮女*閻僻處令人稱譽。不自剋責求度脫。但有媮女*閻,云何名譽沙門。若有沙門奉持禁戒。欲令他人知奉持戒。精進學問欲令他人知精進學。住止山澤中欲令他人知住山澤。少欲知足精勤獨住欲令他知。不厭至死。不求離欲。不樂盡止。不欲求道。息心梵行。不為泥洹。是謂迦葉名譽沙門。,何謂名聞沙門。有一沙門以現因緣而行持戒。欲令人知自力讀誦。欲令他人知為多聞。自力獨處在於閑靜。欲令人知為阿練若。少欲知足行遠離行。但為人知不以厭離。不為善寂不為得道。不為沙門婆羅門果。不為涅槃。是為名聞沙門。,迦葉白言。云何名為求名聞稱讚沙門。迦葉。此一沙門。為求名聞稱讚詐行持戒。惑亂他人恃衒多聞要他稱讚。或居山野。或處林間。詐現少欲無貪。假行清淨之行。於其心內無其離欲。無其寂靜無其息慮。無證菩提亦不為沙門。亦不為婆羅門。亦不為涅槃。而求稱讚名聞。迦葉。此名求名聞稱讚沙門。,འོད་སྲུང་དེ་ལ་བརྗོད་པའི་སྒྲ་ཚིགས་སུ་བཅད་པའི་དགེ་སྦྱོང་གང་ཞེ་ན་། འོད་སྲུང་འདི་ལ་དགེ་སྦྱོང་ཁ་ཅིག་ཇི་ལྟར་བདག་ཚུལ་ཁྲིམས་དང་ལྡན་པར་གཞན་གྱིས་ཤེས་པར་འགྱུར་སྙམ་དུ་སོ་སོར་བརྟགས་ནས་ཚུལ་ཁྲིམས་སྲུང་། ཇི་ལྟར་མང་དུ་ཐོས་པར་གཞན་གྱིས་ཤེས་པར་འགྱུར་སྙམ་དུ་སོ་སོར་བརྟགས་ནས་ཐོས་པ་འཛིན་༎ ཇི་ལྟར་བདག་དགོན་པར་གཞན་གྱིས་ཤེས་པར་འགྱུར་སྙམ་དུ་སོ་སོར་བརྟགས་ནས་དགོན་པ་ལ་གནས་ཤིང་སོ་སོར་བརྟགས་ནས་འདོད་པ་ཉུང་ལ་ཆོག་ཤེས་པ་དང་། རབ་ཏུ་དབེན་པར་གྱུར་ཏེ་༎ འདི་ལྟར་གཞན་ལ་བསྟན་པའི་ཕྱིར་ཡིན་གྱི་སྐྱོ་བར་བྱ་བའི་ཕྱིར་མ་ཡིན་༎ འདོད་ཆགས་དང་བྲལ་བར་བྱ་བའ་ཕྱིར་མ་ཡིན་། འགོག་པར་བྱ་བའི་ཕྱིར་མ་ཡིན་༎ ཉེ་བར་ཞི་བར་བྱ་བའི་ཕྱིར་མ་ཡིན་༎ རྫོགས་པར་བྱང་ཆུབ་པར་བྱ་བའི་ཕྱིར་མ་ཡིན་། དགེ་སྦྱོང་གི་ཕྱིར་མ་ཡིན་༎ ཚངས་པའི་ཕྱིར་མ་ཡིན་༎ མྱ་ངན་ལས་འདས་པའི་ཕྱིར་མ་ཡིན་ཏེ་༎ འོད་སྲུང་དེ་ནི་བརྗོད་པའི་སྒྲ་ཚིགས་སུ་བཅད་པའི་དགེ་སྦྱོང་ཞེས་བྱའོ་༎
