5e220bb868814379a85a3d21931f1a44,tadyathā kāśyapa vāyudhātuḥ sarvabuddhakṣetrāṇi viṭhapayati · evam eva kāśyapa bodhisatvasyopāyakauśalyaṃ sarvabuddhadharmān viṭhapayati · tatredam ucyate · vāyur yath’ eva viṭhapeti kṣetrād buddhāna nānāvidha āśayāto ·upāya evaṃ hi jinorasānān viṭhapaṃti dharmān sugatokta-m-agrān*,發心諸經法悉從中生。譬如風。悉成諸佛國土。菩薩如是。漚惒拘舍羅悉成諸佛經。,譬如風界莊嚴一切諸佛國土。如是迦葉。菩薩善權莊嚴一切諸佛國土。,迦葉。譬如一切風種。皆能成立一切世界。菩薩方便亦復如是。皆能成立一切佛法。,佛告迦葉。譬如風界遍滿一切諸佛剎土。迦葉。菩薩亦爾。以善方便遍眾生界令解佛法。我今於此。而說頌曰。譬如風界 隨自勢力 普遍佛剎諸菩薩眾 亦復如是 以善方便為其佛子 說最上法,འོད་སྲུང་འདི་ལྟ་སྟེ་༎ དཔེར་ན་རླུང་གི་ཁམས་ནི་སངས་རྒྱས་ཀྱི་ཞིང་ཐམས་ཅད་རྣམ་པར་སྒྲུབ་བོ་༎ འོད་སྲུང་དེ་བཞིན་དུ་བྱང་ཆུབ་སེམས་དཔའི་ཐབས་མཁས་པ་ཡང་སེམས་ཅན་ཐམས་ཅད་ལ་སངས་རྒྱས་ཀྱི་ཆོས་ཐམས་ཅད་རྣམ་པར་སྒྲུབ་བོ་༎ དེ་ལ་འདི་སྐད་ཅེས་བྱ་སྟེ་། དཔེར་ན་རླུང་ནི་སངས་རྒྱས་དགོངས་པ་བཞིན་༎ རྣམ་པ་སྣ་ཚོགས་ཞིང་རྣམས་རྣམ་པར་སྒྲུབ་༎ དེ་བཞིན་རྒྱལ་སྲས་རྣམས་ཀྱི་ཐབས་མཁས་ཀྱང་༎ བདེ་གཤེགས་གསུངས་པའི་ཆོས་མཆོག་རྣམ་པར་སྒྲུབ་༎
440663f35a86462cac2949b5b2fc2be1,tadyathāpi nāma kāśyapa mārasya pāpīmataś caturaṃgaṃ balasainya sarvadevair na śakyam abhibhavituṃ paryādatuṃ vā · evam eva kāśyapa śuddhāśayo bodhisatvasarvamārair na śakyam abhibhavituṃ paryādattuṃ vā ·,,,,佛告迦葉。譬如魔冤領四軍兵。欲界諸天不能降彼。迦葉。菩薩亦爾。得意清淨一切眾魔不能惑亂。我今於此。而說頌曰。譬如魔冤 領四軍兵 欲界諸天不能降彼 菩薩亦爾 得意清淨一切眾魔 不可惑亂,འོད་སྲུང་འདི་ལྟ་སྟེ་དཔེར་ན་བདུད་སྡིག་ཅན་གྱི་དཔུང་གི་ཚོགས་ཡན་ལག་བཞི་པ་ནི་འདོད་པ་ན་སྤྱོད་པའི་ལྷ་ཐམས་ཅད་ཀྱི་ཟིལ་གྱིས་གནོན་པའམ་། ཡོངས་སུ་ཟད་པར་བྱ་བར་མི་ནུས་སོ་༎ འོད་སྲུང་དེ་བཞིན་དུ་བྱང་ཆུབ་སེམས་དཔའ་བསམ་པ་དག་པ་ཡང་བདུད་ཐམས་ཅད་ཀྱི་ཟིལ་གྱིས་གནོན་པའམ་། ཡོངས་སུ་ཟད་པར་བྱ་བར་མི་ནུས་སོ་༎
b248e07cc5774772b830b3d9f0aa945f,tadyathāpi nāma kāśyapa śuklapakṣe candramaṇḍalaṃ paripūryate vardhate ca · evam eva kāśyapa āśayaśuddho bodhisatvaḥ sarvaśukladharmair vardhate · tatredam ucyate 6 śuklapakṣe yathā candramaṇḍalaṃ paripūryate vardhati no ca hīyate · emeva śuddhāśayabodhisatvoḥ śuddhehi dharmehi sadā vivardhate ·,譬如月初生時日日增益。菩薩如是。精進具足於功德。(Text moved),譬如月初日日增長。如是迦葉。菩薩至誠清淨增長一切白淨之法。,譬如月初生時。光明形色日日增長。菩薩淨心亦復如是。一切善法日日增長。,佛告迦葉。譬如白月漸漸增長乃至圓滿。迦葉。菩薩亦爾。以無染心求一切法乃至圓滿。我今於此。而說頌曰。譬如白月 漸漸增長 直至圓滿菩薩亦爾 以無染心 求修諸善漸漸增進 白法圓滿,འོད་སྲུང་འདི་ལྟ་སྟེ་༎ དཔེར་ན་ཟླ་བ་ཡར་གྱི་ངོ་ལ་ཟླ་བའི་དཀྱིལ་འཁོར་སྐྱེ་ཞིང་གང་བར་འགྱུར་རོ་༎ འོད་སྲུང་དེ་བཞིན་དུ་བྱང་ཆུབ་སེམས་དཔའ་བསམ་པ་དག་པ་ཡང་དཀར་པོའི་ཆོས་ཐམས་ཅད་ཀྱིས་རྫོགས་ཤིང་རྒྱས་པར་འགྱུར་རོ་༎ དེ་ལ་འདི་སྐད་ཅེས་བྱ་སྟེ་། དཔེར་ན་ཟླ་བའི་དཀྱིལ་འཁོར་ཡར་ངོ་ལ་༎ སྐྱེ་ཞིང་ཡོངས་སུ་གང་འགྱུར་འབྲི་མི་འགྱུར་༎ དེ་བཞིན་བསམ་དག་བྱང་ཆུབ་སེམས་དཔའ་ཡང་༎ དཀར་པོའི་ཆོས་ཀྱིས་རྟག་ཏུ་རྒྱས་པར་འགྱུར་༎
70f513baa801466a8ad9a4c9443de023,tadyathāpi nāma kāśyapa sūryamaṇḍalam ekapramuktābhi sūryaraśmibhiḥ satvānām avabhāsaṃ karoti · evam eva kāśyapa bodhisatvam ekapramuktābhiḥ prajñāraśmibhiḥ satvānāṃ jñānāvabhāsaṃ karoti · tatredam ucyate 7 ··mekapramuktābhi yath’eva sūryo raśmībhi satvāna karoti bhāsam*evaṃ jinānāṃ suta jñānaraśmibhi prajñāya satvāna ’vabhāsa kurvati ·,譬如日。無所不照天下皆見其明菩薩如是。智慧光明悉照十方人。經道之明。,譬如日出照諸眾生。如是迦葉。菩薩以一般若波羅蜜。照一切眾生。,一切善法日日增長。迦葉。譬如日之初出一時放光。普為一切眾生照明。菩薩亦爾放智慧光。一時普照一切眾生。,佛告迦葉。譬如日出放大光明。照彼世間無不朗然。迦葉。菩薩亦爾。放智慧光照諸眾生。無不開悟。我今於此。而說頌曰。譬如日出 照彼世間 一切物像無不朗然 菩薩亦爾 放智慧光照諸有情 無不開解,འོད་སྲུང་འདི་ལྟ་སྟེ་༎ དཔེར་ན་ཉི་མའི་དཀྱིལ་འཁོར་ལས་ལན་ཅིག་བྱུང་བའི་འོད་ཟེར་རྣམས་ཀྱིས་སེམས་ཅན་ཐམས་ཅད་ལ་སྣང་བར་བྱེད་དོ་༎ འོད་སྲུང་དེ་བཞིན་དུ་བྱང་ཆུབ་སེམས་དཔའ་རྣམས་ཀྱིས་ལན་ཅིག་བྱུང་བའི་ཤེས་རབ་ཀྱི་འོད་ཟེར་རྣམས་ཀྱིས་ཀྱང་སེམས་ཅན ༡༢༨བ༡༢༨བ༡་ཐམས་ཅད་ལ་ཤེས་པའི་སྣང་བ་བྱེད་དོ་༎ དེ་ལ་འདི་སྐད་ཅེས་བྱ་སྟེ་༎ དཔེར་ན་ཉི་ལས་ལན་ཅིག་བྱུང་བ་ཡི་༎ འོད་ཟེར་རྣམས་ཀྱིས་སེམས་ཅན་སྣང་བར་བྱེད་༎ དེ་བཞིན་རྒྱལ་སྲས་ཡེ་ཤེས་འོད་ཟེར་གྱིས་༎ སེམས་ཅན་རྣམས་ལ་ཤེས་རབ་སྣང་བར་བྱེད་༎
6784b950990046559915b0ec24ee6d6c,tadyathāpi nāma kāśyapa siṅho mṛgarājā yato yata · eva prakramate sarvatrābhīto ’nutrasta evaṃ prakkramati · evam eva kāśyapa śīlaśrutaguṇadharmapratiṣṭhito bodhisatvo yato yata eva prakramate sarvatrābhīto ’nutrasta eva prakkramate · tatredam ucyate 8 yathā hi siṅho mṛgarāja kesarī yenecchakaṃ yāti asaṃtrasaṃto ·em eva śīlaṃ śrutajñāna susthito yenecchakaṃ gacchati bodhisatvo ·,譬如師子。獨行獨步無所畏。菩薩如是被戒德之鎧。獨行獨步無所畏。,譬如師子鹿王隨其所行。一切無有恐怖。如是迦葉。菩薩住戒功德隨其所行。一切無有恐怖。,迦葉。譬如師子獸王。隨所至處不驚不畏。菩薩亦爾。清淨持戒真實智慧。隨所住處不驚不畏。,佛告迦葉。譬如師子獸王有大威德。於彼一切所行之處不驚不怖。迦葉。菩薩亦爾。安住多聞戒德。如是一切所往之處不驚不怖。我今於此。而說頌曰。師子獸王 威德勇猛 所行之處心無驚怖 菩薩亦爾 安住多聞持戒智慧 於彼世間 所行之處離諸怖畏,འོད་སྲུང་འདི་ལྟ་སྟེ་། དཔེར་ན་རི་དགས་ཀྱི་རྒྱལ་པོ་སེང་གེ་ནི་ག་ལས་གར་འགྲོ་བ་ཐམས་ཅད་དུ་མི་འཇིགས་མི་སྐྲག་པ་ཉིད་དུ་འགྲོའོ་༎ འོད་སྲུང་དེ་བཞིན་དུ་བྱང་ཆུབ་སེམས་དཔའ་ཐོས་པ་དང་། ཚུལ་ཁྲིམས་དང་། བསླབ་པ་དང་། སྦྱངས་པའི་ཡོན་ཏན་དང་། ཡོ་བྱད་བསྙུངས་པ་དང་། ཏིང་ངེ་འཛིན་དང་། ཡེ་ཤེས་ལ་གནས་པ་ཡང་ག་ལས་གར་འགྲོ་བ་ཐམས་ཅད་མི་འཇིགས་མི་སྐྲག་པ་ཉིད་དུ་འགྲོའོ་༎ དེ་ལ་འདི་སྐད་ཅེས་བྱ་སྟེ་། རི་དགས་རྒྱལ་པོ་སེང་གེ་རལ་པ་ཅན་༎ འཇིགས་པ་མེད་པར་གང་དུ་འདོད་པར་འགྲོ་༎ དེ་བཞིན་བྱང་ཆུབ་སེམས་དཔའ་ཚུལ་ཁྲིམས་དང་༎ ཐོས་དང་ཡེ་ཤེས་གནས་པ་དགའ་མགུར་འགྲོ་༎
8d019a3e3cc24a97a2a6ec6aaeba5379,tadyathāpi nāma kāśyapa sudāntaḥ kuṃjaro nāgas sarvabhāravahanatayā na parikhidyate · evam eva kāśyapa sudāntacitto bodhisatva sarvasatvānāṃ sarvabhāravahanatā na parikhidyate · tatredam ucyate 9 yathāpi nā go balavān sudānto bhāraṃ vahaṃto na-d-upeti khedaṃ ·sudāntacitto tathā bodhisatvo satvāna bhāreṇa na khedam aiti ·,,譬如象王堪諸重擔終無疲厭。如是迦葉。菩薩善調御心為一切眾生。堪任重擔而無厭惓。,譬如善調象王。能辦大事身不疲極。菩薩亦爾。善調心故。能為眾生作大利益心無疲倦。,佛告迦葉。譬如龍象有大勢力。擔負一切重物而無疲苦。迦葉。菩薩亦爾。擔負一切眾生五蘊諸苦。不得其苦。我今於此。而說頌曰。譬如龍象 有大勢力 身負重物而不疲苦 菩薩亦爾 擔負眾生五蘊諸苦 亦無疲苦,འོད་སྲུང་འདི་ལྟ་སྟེ་དཔེ་ན་བལ་གླང་གླང་པོ་ཆེ་ཤིན་དུ་དུལ་བ་ནི་ཁལ་ཐམས་ཅད་ཁྱེར་བས་ཡོངས་སུ་སྐྱོ་བ་མེད་དོ་༎ འོད་སྲུང་དེ་བཞིན་དུ་བྱང་ཆུབ་སེམས་དཔའ་སེམས་ཤིན་དུ་དུལ་བ་ཡང་སེམས་ཅན་ཐམས་ཅད་ཀྱི་དོན་གྱི་ཕྱིར་ཕུང་པོ་ལྔའི་ཁུར་ཁྱེར་བས་ཡོངས་སུ་སྐྱོ་བ་མེད་དོ་༎ དེ་ལ་འདི་སྐད་ཅེས་བྱ་སྟེ་། དཔེར་ན་རབ་དུལ་སྟོབས་ལྡན་གླང་པོ་ཆེ་༎ ཁལ་རྣམས་ཁྱེར་ཡང་ཡོངས་སུ་སྐྱོ་བ་མེད་༎ དེ་བཞིན་བྱང་ཆུབ་སེམས་དཔའ་སེམས་རབ་དུལ་༎ སེམས་ཅན་ཁུར་གྱིས་སྐྱོ་བར་འགྱུར་བ་མེད་༎
34fdef9f4166451d8dd2c616f1a50ff5,tadyathāpi nāma kāśyapa padmam udake jātam udakena na lipyate · evam eva kāśyapa bodhisatvo loke jāto lokadharmehi na lipyate · tatredam ucyate 10 padmaṃ yathā kokanadaṃ jaleruhaṃ jalena no lipyati kardamena vā ·lokesmi jāto tatha bodhisatvo na lokadharmehi kadāci lipyate ·,,譬如蓮花生在淤泥而不著水。如是菩薩生在世間不著世法。,迦葉。譬如有諸蓮花。生於水中水不能著。菩薩亦爾。生於世間而世間法所不能污。,佛告迦葉。譬如蓮華生長水中淤泥濁水而不能染。迦葉。菩薩亦爾。雖生世間。世間雜染終不能著。我今於此。而說頌曰。譬如蓮華 出生水中 濁水淤泥而不可染 菩薩亦爾 雖生世間種種雜染 而不能著,འོད་སྲུང་འདི་ལྟ་སྟེ་། དཔེར་ན་པད་མ་ནི་ཆུ་ལས་སྐྱེས་ཀྱང་ཆུས་མི་གོས་སོ་༎ འོད་སྲུང་དེ་བཞིན་དུ་བྱང་ཆུབ་སེམས་དཔའ་འཇིག་རྟེན་དུ་སྐྱེས་ཀྱང་འཇིག་རྟེན་གྱི་ཆོས་རྣམས་ཀྱིས་མི་གོས་སོ་༎ དེ་ལ་འདི་སྐད་ཅེས་བྱ་སྟེ་། དཔེར་ན་པད་མ་ཆུ་ལས་སྐྱེས་གྱུར་ཀྱང་༎ ཆུའམ་རྫབ་ཀྱིས་དེ་ལ་གོས་པ་མེད་༎ དེ་བཞིན་བྱང་ཆུབ་སེམས་དཔའ་འཇིག་རྟེན་སྐྱེས་༎ འཇིག་རྟེན་ཆོས་ཀྱིས་ནམ་ཡང་གོས་པ་མེད་༎
7225ac854dfd452f8310c7eff5bc88b0,tadyathāpi nāma kāśyapa viṭapacchinno vṛkṣo mūle ’nupahate punar eva virohati · evam eva kāśyapa upāyakauśalyakleśacchinno bodhisatvaḥ sarvakuśalamūlasaṃyojane ’nupahate punar eva traidhātuke virohati · tatredam ucyate 11 yathāpi vṛkṣo viṭapasmi cchinno virohate mūla dṛḍhe ’nupadrute ·evaṃ upāyo ’pahato virohate mūlasmi saṃyojana suprahīṇe ·,譬如草木。雖無上枝下根由復生。菩薩如是。雖斷三處極大慈續見世間。,譬如伐樹雖截其枝。而不伐根復生如故。如是迦葉。菩薩以善權心。雖斷結縛猶生三界。,菩薩亦爾。生於世間而世間法所不能污。迦葉。譬如有人伐樹根在還生。菩薩亦爾。方便力故。雖斷結使有善根愛還生三界。,佛告迦葉。譬如有人方便斷樹不斷樹根。而於後時復生大地。迦葉。菩薩亦爾。以方便力斷彼煩惱。不斷彼種以大悲善根復生三界。我今於此。而說頌曰。譬如有人 以其方便 而斷樹身不斷樹根 如是後時 復生大地菩薩亦爾 以善方便 斷彼煩惱不斷彼種 以大悲故 復生三界,འོད་སྲུང་འདི་ལྟ་སྟེ་དཔེར་ན་ཤིང་ལྗོན་པ་ཡལ་ག་བཅད་པ་ནི་རྩ་བ་མ་སྣང་ན་སླར་ཡང་ས་ལས་སྐྱེའོ་༎ འོད་སྲུང་དེ་བཞིན་དུ་བྱང་ཆུབ་སེམས་དཔའ་ཐབས་ལ་མཁས་པ་ཉོན་མོངས་པའི་ཡལ་ག་བཅད་པ་ཡང་སྙིང་རྗེ་ཆེན་པོ་དགེ་བའི་རྩ་བ་ལ་ཀུན་ཏུ་སྦྱོར་བ་མ་ཉམས་ན་སླར་ཡང་ཁམས་གསུམ་དུ་སྐྱེའོ་༎ དེ་ལ་འདི་སྐད་ཅེས་བྱ་སྟེ་། དཔེར་ན་ཤིང་ལྗོན་ཡལ་ག་བཅད་པ་ནི་༎ རྩ་བ་བརྟན་པ་མ་སྣང་སླར་ཡང་སྐྱེ་༎ དེ་བཞིན་རྩ་བ་ཀུན་སྦྱོར་མ་སྤངས་ན་༎ ཐབས་ཀྱིས་བསལ་ཀྱང་སླར་ཡང་སྐྱེ་བར་འགྱུར་༎
d8e54b7e6dfe4991beee46c9a3360477,tadyathāpi nāma kāśyapa nānādigvidikṣu mahānadīṣv āpskandho mahāsamudre praviṣṭaḥ sarvam ekaraso bhavati yad uta lavaṇarasaḥ evam eva kāśyapa nānāmukhopacitaṃ kuśalamūlaṃ bodhisatvasya bodhāya pariṇāmitaṃ sarvam ekarasaṃ bhavati yad ida vimuktirasaṃ · tatredam ucyate 12 nānānadīnām udakaṃ praviṣṭaṃ mahāsamudr’ ekarasaṃ yathā syāt*kuśalāni nānāmukhasaṃcitāni parināmitāni ekarasāni bodhaye,譬如萬川四流皆歸於海。合為一味。菩薩如是。持若干種行合會功德。持用成願一味。入薩芸若中。,譬如諸方江河之水。入於大海悉為一味。如是迦葉。菩薩作若干種善願功德。當作佛道悉為一味。,方便力故。雖斷結使有善根愛還生三界。迦葉。譬如諸方流水。入大海已皆為一味。菩薩亦爾。以種種門集諸善根。迴向阿耨多羅三藐三菩提皆為一味。,佛告迦葉。譬如諸方所流河水。皆歸大海同一鹹味。迦葉。菩薩亦爾。所有一切善根。種種利益迴向菩提。與彼涅槃同歸一味。我今於此。而說頌曰。譬如一切 江河諸水 皆入大海同一鹹味 菩薩亦爾 所有一切善根利益 迴向菩提 及彼真際同歸一味,འོད་སྲུང་འདི་ལྟ་སྟེ་དཔེར་ན་ཕྱོགས་དང་ཕྱོགས་མཚམས་ཐ་དད་པ་ནས་ཀླུང་ཆེན་པོའི་ཆུའི་ཕུང་པོ་རྒྱ་མཚོ་ཆེན་པོར་བབ་པ་ནི་འདི་ལྟ་སྟེ་། ལན་ཚྭའི་རོར་རོ་གཅིག་པར་འགྱུར་རོ་༎ འོད་སྲུང་དེ་བཞིན་དུ་བྱང་ཆུབ་སེམས་དཔའི་དགེ་བའི་རྩ་བ་སྒོ་ཐ་དད་པ་ནས་བསགས་པ་བྱང་ཆུབ་ཏུ་ཡོངས་སུ་བསྔོས་པ་ཐམས་ཅད་ཀྱང་འདི་ལྟ་སྟེ་། ཐམས་ཅད་མཁྱེན་པ་ཉིད་ཀྱི་རོར་རོ་གཅིག་པར་འགྱུར་རོ་༎ དེ་ལ་འདི་སྐད་ཅེས་བྱ་སྟེ་། དཔེར་ན་ཐ་དད་ཕྱོགས་ཀྱི་ཆུ་ཀླུང་རྣམས་༎ རྒྱ་མཚོ་ཆེར་བབ་རོ་གཅིག་འགྱུར་བ་བཞིན་༎ ཐ་དད་སྒོ་ནས་དགེ་བ་བསགས་བྱས་པ་༎ བྱང་ཆུབ་བསྔོས་པ་རྣམས་ཀྱང་རོ་གཅིག་འགྱུར་༎
3fdbcae6ee5e4e87ae6360141d8f28ed,tadyathāpi nāma kāśyapa sumerupratiṣṭhitā caturmahārājakāyikās trayastriṃśāś ca devāḥ evam eva kāśyapa bodhicittakuśalamūlapratiṣṭhitā bodhisatvasya sarvajñatā tatredam ucyate 13 caturmahārājikas trāyastriṃśā yathā sumerusthita devasaṃghā ·tatha bodhisatvā kuśale pratiṣṭhitāḥ sarvajñatā prāpya vadaṃti dharmān*,譬如須彌山忉利住其上。菩薩如是發心成薩芸若。,譬如四天王三十三天住須彌山。如是迦葉。菩薩善根心中。,迦葉。譬如須彌山王。忉利諸天及四天王皆依止住。菩薩菩提心亦復如是。為薩婆若所依止住。,佛告迦葉。譬如四大天王及忉利天眾。要彼安住妙高之山。迦葉。菩薩亦爾。為一切智所修善法。要彼安住菩提大心。我今於此。而說頌曰。譬如四王 及帝釋眾 要彼安住妙高之山 菩薩亦爾 為一切智所修善法 安住菩提,འོད་སྲུང་འདི་ལྟ་སྟེ་དཔེར་ན་རྒྱལ་ཆེན་བཞིའི་རིས་དང་། སུམ་ཅུ་རྩ་གསུམ་པའི་ལྷ་རྣམས་ནི་རི་རབ་ལ་གནས་སོ་༎ འོད་སྲུང་དེ་བཞིན་དུ་བྱང་ཆུབ་སེམས་དཔའ་ཐམས་ཅད་མཁྱེན་པ་ཉིད་ཀྱང་བྱང་ཆུབ་ཀྱི་སེམས་ཀྱི་དགེ་བའི་རྩ་བ་ལ་གནས་སོ་༎ དེ་ལ་འདི་སྐད་ཅེས་བྱ་སྟེ་༎ དཔེར་ན་རྒྱལ་ཆེན་བཞི་ཡི་རིས་རྣམས་དང་༎ སུམ་ཅུ་རྩ་གསུམ་ལྷ་ཚོགས་རི་རབ་གནས་༎ དེ་བཞིན་བྱང་ཆུབ་སེམས་དཔའ་དགེར་གནས་ཏེ་༎ ཐམས་ཅད་མཁྱེན་ཉིད་ཐོབ་ནས་ཆོས་ཀྱང་སྟོན་༎
c4ff7b78ec5441cd90cb5700bb0646d9,tadyathāpi nāma kāśyapa āmātyasaṃgṛhītā rājānaḥ sarvarājakāryāṇi kurvanti · evam eva kāśyapa upāyasaṃgṛhītā bodhisatvasya prajñā sarvabuddhakāryāṇi karoti · tatredam ucyate 14 yathā hi rājāna āmātyasaṃgrahā sarvāṇi kāryāṇi karoti nityaṃ ·tatha bodhisatvasya upāyasaṃgrraho buddhārtha prajñāya karonti nitya,譬如國王得傍臣共治。則好漚惒拘舍羅。如是菩薩。所作為如佛。,譬如國王大臣所助。乃具成辦一切國事。如是迦葉。菩薩般若波羅蜜善根所助。乃具成辦一切佛事。,迦葉。譬如有大國王。以臣力故能辦國事。菩薩智慧亦復如是。方便力故。皆能成辦一切佛事。,佛告迦葉。譬如國王欲行王事須假宰臣。迦葉。菩薩亦爾。欲為佛事。須假智慧方便。我今於彼。而說頌曰。譬如國王 欲行王事 須仗宰臣而得成就 菩薩亦爾 欲為佛事假方便慧 決定成就,འོད་སྲུང་འདི་ལྟ་སྟེ་༎ དཔེར་ན་བློན་པོས་ཡོངས་སུ་ཟིན་པའི་རྒྱལ་པོ་རྣམས་ནི་རྒྱལ་པོའི་བྱ་བ་ཐམས་ཅད་བྱེད་དོ་༎ འོད་སྲུང་དེ་བཞིན་དུ་བྱང་ཆུབ་སེམས་དཔའ་ཐབས་མཁས་པས་ཡོངས་སུ་ཟིན་པའི་ཤེས་རབ་ཀྱང་སངས་རྒྱས་ཀྱི་མཛད་པ་ཐམས་ཅད་བྱེད་དོ་༎ དེ་ལ་འདི་སྐད་ཅེས་བྱ་སྟེ་། དཔེར་ན་བློན་པོར་ལྡན་པའི་རྒྱལ་པོ་རྣམས་༎ བྱ་བ་ཐམས་ཅད་རྟག་ཏུ་བྱེད་པ་ལྟར་༎ ཐབས་ལྡན་བྱང་ཆུབ་སེམས་དཔའི་ཤེས་རབ་ཀྱང་༎ སངས་རྒྱས་དོན་རྣམས་རྟག་ཏུ་བྱེད་པ་ཡིན་༎
19c916ee2e324be2834e2ddba30ed90e,tadyathāpi nāma kāśyapa vyabhre deve vigatavalāhake nāsti varṣasyāyadvāraṃ evam eva kāśyapa alpaśrrutasya bodhisatvasyāntikā nāsti saddharmavṛṣṭer āyadvāraṃ · tatredam ucyate 15 vyabhre yathā vigatavalāhake nabhe varṣasya āyo na kadāci vidyate ·alpaśrrutasyāntika dharmadeśanā na bodhisatvasya kadāci labhyate,譬如天雨/星欲索雨不能得也。菩薩如是不學經道。豫知不高明也。,譬如迦葉天無雲者雨不可得。如是菩薩。不多聞者法雨不可得。,迦葉。譬如天晴明時。淨無雲翳必無雨相。寡聞菩薩無法雨相亦復如是。,佛告迦葉。譬如晴天無其雲霧。於彼世間終無降雨之相。迦葉。菩薩亦爾。寡聞小智於諸有情。終無說法之相。我今於此。而說頌曰。譬如虛空 晴無雲霧 於彼世間終不降雨 菩薩亦爾 寡聞少智於其有情 無說法相,འོད་སྲུང་འདི་ལྟ་སྟེ་དཔེར་ན་སྤྲིན་མེད་ཅིང་ནམ་ཐང་པའི་ནམ་མཁའ་ལ་ནི་ཆར་འབབ་པའི་རྒྱུ་མེད་དོ་༎ འོད་སྲུང་དེ་བཞིན་དུ་བྱང་ཆུབ་སེམས་དཔའ་ཐོས་པ་ཉུང་བ་ལ་ཡང་དམ་པའི་ཆོས་ཀྱི་ཆར་འབབ་པའི་རྒྱུ་མེད་དོ་༎ དེ་ལ་འདི་སྐད་ཅེས་བྱ་སྟེ་། དཔེར་ནི་སྤྲིན་མེད་ནམ་ཐང་ནམ་མཁའ་ལ་༎ ཆར་འབབ་རྒྱུ་ནི་ནམས་ཀྱང་མི་དམིགས་སོ་༎ དེ་བཞིན་བྱང་ཆུབ་སེམས་དཔའ་ཐོས་ཉུང་ལ་༎ ཆོས་སྟོན་ནམ་ཡང་དམིགས་པར་མི་འགྱུར་རོ་༎
