id,P000888,P000889,P000890,P000891,P000892,P000893
2a0761ff0ec54670b6dffb545f647acc,kāśyapaparivarta,佛說遺日摩尼寶經,佛說摩訶衍寶嚴經(一名大迦葉品),大寶積經,佛說大迦葉問大寶積正法經卷第一,འཕགས་པ་དཀོན་མཆོག་བརྩེགས་པ་ཆེན་པོའི་ཆོས་ཀྱི་རྣམ་གྲངས་ལེའུ་སྟོང་ཕྲག་བརྒྱ་པ་ལས་ལེའུ་བཞི་བཅུ་རྩ་གསུམ་པ་སྟེ་། འཕགས་པ་འོད་སྲུང་གིས་ཞུས་པ་ལུང་བསྟན་པ་། བམ་པོ་དང་པོ་༎ རྒྱ་གར་སྐད་དུ་༎ ཨའརྱ་ཀའ་སྱས་པ་རི་བ་རྟ་ནའ་མ་མ་ཧའ་ཡའ་ན་སའུ་ཏྲ་། བོད་སྐད་དུ་། འཕགས་པ་འོད་སྲུང་གི་ལེའུ་ཞེས་བྱ་བ་ཐེག་པ་ཆེན་པོའི་མདོ་༎
e2ddeaf464b242eea1cd0c8d8f3dac4d,siddham*,後漢月支國三藏支婁迦讖譯,晉代譯失三藏名,卷第一百一十二失譯附秦錄勘同編入普明菩薩會第四十三,西天譯經三藏朝散大夫試鴻臚少卿傳法大師臣施護奉　詔譯,སངས་རྒྱས་དང་། བྱང་ཆུབ་སེམས་དཔའ་ཐམས་ཅད་ལ་ཕྱག་འཚལ་ལོ་།
0aa69763100b4df2ab299de39965fbd4,evaṃ mayā śrutam ekasmiṃ samaye bhagavāṃn rrājagṛhe viharati sma · gṛddhakūṭe parvate mahatā bhikṣusaṃghena sārdhaṃm aṣṭābhir bhikṣusahasraiḥ ṣoḍaśabhiś ca bodhisatvasahasraiḥ nānābuddhakṣetrasaṃnipatitair ekajātiprrabaddhair yad utānutarasyāṃ samyaksaṃbodhau · tatra bhagavān āyuṣmantaṃ mahākāśyapam āmaṃtrayati sma ·,佛在舍衛國祇洹阿難邠坻阿藍時。與摩訶比丘僧千二百五十人。菩薩萬二千人。,聞如是。一時佛遊王舍城耆闍崛山中。與大比丘眾八千人俱。菩薩萬六千人。從諸佛國而來集此。悉志無上正真之道。,如是我聞。一時佛在王舍城耆闍崛山中。與大比丘眾八千人俱。菩薩摩訶薩萬六千人。皆是阿惟越致。從諸佛土而來集會。悉皆一生當成無上正真大道。,如是我聞。一時佛在王舍城鷲峯山中。與大比丘眾八千人俱。菩薩一萬六千。及一生獲得無上正等正覺。種種佛剎皆來集會。,འདི་སྐད་བདག་གིས་ཐོས་པ་དུས་གཅིག་ན་། བཅོམ་ལྡན་འདས་རྒྱལ་པོའི་ཁབ་ནི་བྱ་རྒོད་ཀྱི་ཕུང་པོའི་རི་ལ་། དགེ་སློང་བརྒྱད་སྟོང་གི་དགེ་སློང་གི་དགེ་འདུན་ཆེན་པོ་དང་། བྱང་ཆུབ་སེམས་དཔའ་སངས་རྒྱས་ཀྱི་ཞིང་སྣ་ཚོགས་ནས་། འདུས་པ་ཁྲི་དྲུག་སྟོང་ཐམས་ཅད་ཀྱང་འདི་ལྟ་སྟེ་། བླ་ན་མེད་པ་ཡང་དག་པར་རྫོགས་པའི་བྱང་ཆུབ་ཏུ་སྐྱེ་བ་གཅིག་གིས་ཐོགས་པ་ཤ་སྟག་དང་ཐབ་ཅིག་ཏུ་བཞུགས་ཏེ་། དེའི་ཚེ་ན་ཚེ་དང་ལྡན་པ་འོད་སྲུང་ཆེན་པོ་འཁོར་དེ་ཉིད་དུ་འདུས་པར་གྱུར་ནས་འདུག་གོ་། དེ་ནས་བཅོམ་ལྡན་འདས་ཀྱིས་ཚེ་དང་ལྡན་པ་འོད་སྲུང་ཆེན་པོ་ལ་བཀའ་སྩལ་པ་།
5426217f97384771b7892f1b1f1c70f8,catvāra ime kāśyapa dharmā bodhisatvasya prrajñāpārihāṇāya saṃvartante · katame catvāraḥ yad uta agauravau bhavati dharme ca dharmabhāṇake ca · dharmamātsaraś ca bhavaṃti · dharmācāryamuṣṭiñ ca karoti dharmakāmānāñ ca pudgalānāṃ dharmāntarāyaṃ karoti · vicchandayati vikṣipati · na deśayati · prraticchādayati · ābhimānikaś ca bhavaty ātmotkarṣī parapaṃsakaḥ ime kāśyapa catvāro dharmā bodhisatvasya prrajñāpārihāṇāya saṃvartate · tatredam ucyate ·· agauravo bhavati ca dharmabhāṇake dharmeṣu mātsaryarato ca bhoti ·ācāryamuṣṭiṃ cchā karoti dharme dharmārthikānā ca karauti vighnam*vicchadayanto vividhaṃ kṣipantau dharmaṃ na deśayati jinapraśastān*so ātmotkarṣaṇi nittyayuko parapaṃsane cābhirataḥ kusīdau ·caturo ime dharmā jinena prroktā prajñāprrahāṇāya jinorasānām*etāṃ hi catvāri jahitva dharmāś caturau parāṃ dharmajinokta bhāvayet* ··,爾時佛語摩訶迦葉比丘言。菩薩有四事法智慧為減。何等為四事。一者不敬經不敬師。二者人有欲聞經者中斷之。三者人有求深經者愛惜不肯與。四者自貢高輕侮他人。是為四。,爾時世尊告尊者大迦葉曰。菩薩有四法。失般若波羅蜜云何為四。一者不尊法不敬法師。二者為法師者慳惜悋法。三者欲得法者為法作礙。呵責輕易不為說法。四者憎慢貢高自大譽毀他。是謂迦葉。菩薩有四法失般若波羅蜜。,菩薩有四法退失智慧。何謂為四。不尊重法不敬法師。所受深法祕不說盡。有樂法者為作留難。說諸因緣沮壞其心。憍慢自高卑下他人。迦葉。是為菩薩四法退失智慧。,爾時尊者大迦葉波。在大眾中安詳而坐。爾時世尊。告迦葉言。有四種法。破壞菩薩智慧。迦葉白言。四種法者。其義云何。四種法者。一者於佛教法而生輕慢。二者於法師處憎嫉法師。三者隱藏正法令不見聞。四者他欲樂法數數障礙。瞋恚斷善覆蓋不說。誑賺他人唯自求利。迦葉。如是四種。是名壞滅菩薩智慧。我今於此。重說頌曰。若人慢佛法 憎嫉法師處樂法作隱藏 求法而障礙瞋怒斷善根 覆法不為說愛樂誑賺他 恒行自求利我說此四法 斷滅菩薩慧四法如是故 汝等應當知,འོད་སྲུང་ཆོས་བཞི་པོ་འདི་དག་ནི་བྱང་ཆུབ་སེམས་དཔའི་ཤེས་རབ་ཡོངས་སུ་ཉམས་པར་འགྱུར་བ་སྟེ་། བཞི་གང་ཞེ་ན་། འདི་ལྟ་སྟེ་། ཆོས་དང་ཆོས་སྨྲ་བ་ལ་མི་གུས་པ་ཡིན་། ཆོས་ལ་སེར་སྣ་བྱེད་ཅིང་ཆོས་ལ་སློབ་དཔོན་གྱི་དཔེ་མ་ཁྱུད་བྱེད་པ་ཡིན་། ཆོས་འདོད་པའི་གང་ཟག་རྣམས་ལ་ཆོས་ཀྱི་བར་ཆད་བྱེད་ཅིང་འདུན་པ་ཟློག་པར་བྱེད་། རྣམ་པར་འཁྲུག་པར་བྱེད་དེ་། མི་སྟོན་ཅིང་རབ་ཏུ་འཆབ་པ་ཡིན་། མངོན་པའི་ང་རྒྱལ་གྱིས་བདག་ལ་བསྟོད་ཅིང་གཞན་ལ་སྨོད་པ་ཡིན་ཏེ་༎ འོད་སྲུང་ཆོས་བཞི་པོ་དེ་དག་ནི་བྱང་ཆུབ་སེམས་དཔའི་ཤེས་རབ་ཡོངས་སུ་ཉམས་པར་འགྱུར་བའོ་༎ དེ་ལ་འདི་སྐད་ཅེས་བྱ་སྟེ་། ཆོས་སྨྲ་བ་ལ་གུས་པ་མེད་པ་ཡིན་༎ ཆོས་ལ་སེར་སྣ་བྱེད་པར་གྱུར་པ་དང་༎ ཆོས་ལ་སློབ་དཔོན་དཔེ་མཁྱུད་བྱེད་པ་ཡིན་༎ ཆོས་འདོད་རྣམས་ལ་བགེགས་ནི་བྱེད་གྱུར་ཅིང་༎ འདུན་པ་ཟློག་ལ་དེ་བཞིན་རྣམ་འཁྲུག་བྱེད་༎ རྒྱལ་བས་བསྔགས་པའི་ཆོས་ནི་ཡོང་མི་སྟོན་༎ ལེ་ལོ་ཅན་དེ་བདག་བསྟོད་རྟག་ཏུ་བརྩོན་༎ གཞན་ལ་སྨོད་པར་བྱེད་ལ་མངོན་པར་དགའ་༎ ཆོས་བཞི་འདི་དག་རྒྱལ་བའི་སྲས་རྣམས་ཀྱི་༎ ཤེས་རབ་ཉམས་པར་འགྱུར་བར་རྒྱལ་བས་གསུངས་༎ ཆོས་བཞི་འདི་དག་རབ་ཏུ་སྤང་བྱས་ལ་༎ རྒྱལ་བས་གསུངས་པའི་ཆོས་བཞི་གཞན་བསྒོམ་མོ་༎
76971c64978f454bb0e3bb986d565d48,catvāra ime kāśyapa dharmā bodhisatvasya mahāprajñatāyaiḥ saṃvartaṃte · katame catvāraḥ yad uta sagauravo bhavati dharme ca dharmabhāṇake ca · yathāśrutāṃś ca dharmān yathāparyāptān parebhyo vistareṇa saṃprrakāśayati · nirāmiṣeṇa cittenāpratikāṃkṣayati + +.. lābhasatkāraślokaṃ bāhuśrutyena ca prrajñāgamaṃ viditvā · ādiptaśiraścailopamaḥ śrutaṃ paryeṣate śrutāś ca dharmān dhārayati · prratipattisāraś ca bhavati na vyāhārapadavākyaparamaḥi me kāśyapa catvāro dharmāḥ bodhisatvasya mahāprajñatāyaiḥ saṃvartaṃte idam uvāca bhagavāṃs tatredam  ucyate ··sagoravau bhavati ca dharmabhāṇake yathāśrutān dharma pareṣu bhāṣate ·nirāmiśaś cāpratikāṃkṣamāṇo na lābhasatkāraśiloka + + .y. taḥśrutena prajñāgama so viditvā ādiptaśīṣaḥ śrutam eṣate sadā ·yathāśrutān dhārayati ca dharmān dhāritva dharmā pratipattiyā sthitaḥpratipattisāro ca sa bhoti paṇḍito na vākpa + + +  ta paro ca bhauti :catvārimā dharma bhajaṃta paṇḍitāḥ prajñām anāpnoti jinapraśastā :,菩薩復有四事法智慧為增。何等為四。一者恭敬經尊師。二者人有來聽經者不中斷。三者人有欲得深經者不愛藏。四者具足為人說經。不從人有所徼冀。常自精進常隨法行不嘩說。是為四。,復次迦葉。菩薩有四法。得般若波羅蜜。云何四。一者尊法敬重法師。二者隨受聞法廣為他說。心無愛著亦無所求。為般若波羅蜜故。捨一切財物。求多學問如救頭然。三者聞已受持。四者行法不著言說。是謂迦葉。菩薩有四法得般若波羅蜜。,復次迦葉。菩薩有四法得大智慧。何謂為四。常尊重法恭敬法師。隨所聞法以清淨心廣為人說。不求一切名聞利養。知從多聞生於智慧。勤求不懈如救頭然。聞經誦持樂如說行不隨言說。迦葉。是為菩薩四法得大智慧。,佛告迦葉波。有四最上法觀。增長菩薩大智。迦葉白言。是義云何。此四法者。一者於佛教法深生尊重。二者於法師處勿生輕慢。三者如聞得法為他解說。起正直心不求一切利養。四者稱讚多聞增長智慧。一向正心如聞受持。行真實行而不妄語。迦葉。此四種法。增長菩薩大智慧故。我今於此。重說頌曰。尊重於佛法 及彼法師處如聞為他說 不求於利養亦不要稱揚 一向而求聞多聞生智慧 如聞受持法持已依法行 稱法真實故是彼法師行 口意無虛妄四法可為師 得佛大智慧,འོད་སྲུང་ཆོས་བཞི་པོ་འདི་དག་ནི་བྱང་ཆུབ་སེམས་དཔའི་ཤེས་རབ་ཆེན་པོར་འགྱུར་བ་སྟེ་། བཞི་གང་ཞེ་ན་། འདི་ལྟ་སྟེ་། ཆོས་དང་ཆོས་སྨྲ་བ་ལ་གུས་པ་དང་བཅས་པ་ཡིན་། ཟང་ཟིག་མེད་པའི་སེམས་ཀྱིས་རྙེད་པ་དང་བཀུར་སྟི་དང་། ཚིགས་སུ་བཅད་པ་ལ་མི་རེ་བར་ཇི་ལྟར་ཐོས་པ་དང་། ཇི་ལྟར་ཁོང་དུ་ཆུད་པའི་ཆོས་རྣམས་གཞན་དག་ལ་རྒྱ་ཆེར་ཡང་དག་པར་རབ་ཏུ་སྟོན་པར་བྱེད་པ་ཡིན་། མང་དུ་ཐོས་པ་ལས་ཤེས་རབ་འབྱུང་བར་རིག་ནས་མགོའམ་གོས་ལ་མེ་འབར་བ་བཞིན་དུ་ཐོས་པ་ཡོངས་སུ་ཚོལ་ཞིང་ཇི་ལྟར་ཐོས་པའི་ཆོས་རྣམས་འཛིན་པར་བྱེད་པ་ཡིན་། ནན་ཏན་སྙིང་པོར་བྱེད་ཀྱི་སྨྲ་བ་དང་བརྗོད་པའི་ཚིག་ལྷུར་ལེན་པ་མ་ཡིན་པ་སྟེ་། འོད་སྲུང་ཆོས་བཞི་པོ་འདི་དག་ནི་བྱང་ཆུབ་སེམས་དཔའི་ཤེས་རབ་ཆེན་པོར་འགྱུར་བའོ་༎ དེ་ལ་འདི་སྐད་ཅེས་བྱ་སྟེ་། ཆོས་སྨྲ་བ་ལ་གུས་དང་བཅས་པ་ཡིན་༎ ཟང་ཟིང་མེད་ཅིང་རྙེད་དང་བཀུར་སྟི་ལ་༎ རེ་བ་མེད་ཅིང་ཚིག་བཅད་མི་སེམས་པར་༎ ཇི་ལྟར་ཐོས་པའི་ཆོས་རྣམས་གཞན་ལ་སྟོན་༎ ཐོས་ལ་ཤེས་རབ་འབྱུང་བར་དེས་རིག་ནས་༎ མགོ་ལ་འབར་བཞིན་རྟག་ཏུ་ཐོས་པ་ཚོལ་༎ དེ་ནི་ཇི་ལྟར་ཐོས་པའི་ཆོས་རྣམས་འཛིན་༎ ཆོས་བཟུང་ནས་ནི་ནན་ཏན་བྱ་ཕྱིར་གནས་༎ མཁས་དེ་ནན་ཏན་སྙིང་པོར་བྱེད་པ་ཡིན་༎ ཚིག་ལྷུར་མི་ལེན་སྨྲ་བ་ལྷུར་མི་ལེན་།མཁས་པས་ཆོས་བཞི་འདི་དག་བསྟེན་བྱས་ན་༎ རྒྱལ་བས་བསྔགས་པའི་ཤེས་རབ་ཐོབ་པར་འགྱུར་༎
6fe0060abbc441839f848782cfa92265,caturbhiḥ kāśyapa dharmaiḥ samanvāgatasya bodhisatvasya bodhicittaṃ muhyati katamaiś caturbhiḥ yad utācāryaguru dākṣinīyavisaṃvādanatayā · pareṣam akokṛtye kaukṛtyopasaṃhāraṇatayā mahāyānasaṃprasthitānāṃ ca satvānām avarṇāyaśakīrtiśabdaślokaniścāraṇatayā · māyāṣāṭṭhyena ca param upacarati nādhyāśayena · ebhiḥ kāśyapa caturbhiḥ dharmaiḥ samanvāgatasya bodhisatvasya bodhicittaṃ muhyati · idam uvāca bhagavāṃ tatredam ucyategurudākṣiṇīye na karoti proktuṃ pareṣu kaukṛtya upasaṃharanti ·bodhāya saṃprasthita ye ca satvās teṣām avarṇaṃ ayaśaṃ bhaṇaṃti ·māyāya śāṭhyena ca ketavena parañ ca sevanti ca nāśayena ·catvāro ime dharm. niṣevyamāṇā* mohenti* cittaṃ varabuddhabodhayeḥtasmād imān dharmān niṣevamāṇo varāgrabodhīya* sudūri vartate** ·.. tādvipa .. .. .. niṣevamāṇo varāgrabodhiṃ spṛśatiḥ praśāst. + + +,世世亡菩薩道意。何等為四。一者欺調其師。二者主持他人長短。人無長短誹謗之。三者壞敗菩薩道。四者罵詈為菩薩道者。是為四。,復次迦葉。菩薩成就四法忘菩薩心。云何為四。一者欺誑師尊長老。二者他無惡事說有所犯。三者摩訶衍者毀呰誹謗。四者諂偽心無至誠。是謂迦葉。菩薩成就四法忘菩薩心。,復次迦葉。菩薩有四法失菩提心。何謂為四。欺誑師長已受經法而不恭敬。無疑悔處令他疑悔。求大乘者訶罵誹謗廣其惡名。以諂曲心與人從事。迦葉。是為菩薩四法失菩提心。,佛告大迦葉。有四法具足。迷障菩薩菩提心。迦葉白言。云何四法迷障菩提心。此四法者。一者所有阿闍梨師及諸善友。行德尊重反生毀謗。二者他善增盛於彼破滅。三者若諸眾生行大乘行。而不稱讚妄言謗毀。四者棄背正心邪妄分別。如是迦葉。此四種法迷障菩薩菩提心我今於此。重說頌曰。闍梨師善友 行德俱尊重不行恭敬心 反生於輕毀他善增熾盛 破壞滅除他菩提大行人 謗毀行輕慢棄背正真心 邪妄而分別如斯四惡行 迷障佛菩提是故此四法 遠離無上覺無此四過者 最上得菩提,འོད་སྲུང་བྱང་ཆུབ་སེམས་དཔའ་ཆོས་བཞི་དང་ལྡན་ན་བྱང་ཆུབ་ཀྱི་སེམས་བརྗེད་པར་འགྱུར་ཏེ་། བཞི་གང་ཞེ་ན་། འདི་ལྟ་སྟེ་། སློབ་དཔོན་དང་། བླ་མ་དང་། སྦྱིན་གནས་ལ་སླུ་བ་དང་། གཞན་འགྱོད་པ་མེད་པ་དག་ལ་འགྱོད་པ་ཉེ་བར་སྒྲུབ་པ་དང་། ཐེག་པ་ཆེན་པོ་ལ་ཡང་དག་པར་ཞུགས་པའི་སེམས་ཅན་རྣམས་ལ་བསྔགས་པ་མ་ཡིན་པ་དང་། མི་སྙན་པ་དང་། བརྗོད་པ་མ་ཡིན་པའི་སྒྲ་ཚིགས་སུ་བཅད་པ་འབྱིན་པ་དང་སྒྱུ་དང་གཡསོ་གཞན་ལ་ཉེ་བར་སྤྱོད་ཀྱི་ལྷག་པའི་བསམ་པས་མ་ཡིན་པ་སྟེ་། འོད་སྲུང་བྱང་ཆུབ་སེམས་དཔའ་ཆོས་བཞི་པོ་དེ་དག་དང་ལྡན་ན་བྱང་ཆུབ་ཀྱི་སེམས་བརྗེད་པར་འགྱུར་རོ་༎ དེ་ལ་འདི་སྐད་ཅེས་བྱ་སྟེ་། སྦྱིན་གནས་བླ་མས་བསྒོ་བཞིན་མི་བྱེད་དང་༎ གཞན་དག་ལ་ཡང་ཐེ་ཚོམ་ཉེར་སྒྲུབ་དང་༎ སེམས་ཅན་གང་དག་བྱང་ཆུབ་རབ་ཞུགས་པ་༎ དེ་ལ་བསྔགས་མིན་མི་སྙན་སྨྲ་བ་དང་༎ སྒྱུ་དང་གཡོ་དང་རྒྱན་ལ་དོར་བྱེད་པས་༎ གཞན་ལ་སྟེན་གྱི་བསམ་པས་མ་ཡིན་པ་༎ ཆོས་བཞི་འདི་དག་ཀུན་ཏུ་བསྟེན་བྱས་ན་༎ སངས་རྒྱས་བྱང་ཆུབ་སེམས་མཆོག་ཉམས་པར་འགྱུར་༎ དེ་ལྟ་བས་ན་ཆོས་འདི་སྟེན་བྱེད་ན་༎ བྱང་ཆུབ་མཆོག་ལས་དེ་ནི་རིང་བར་འགྱུར་༎ དེ་ལས་བཟློག་པ་སྟེན་པར་བྱེད་ན་ནི་༎ བྱང་ཆུབ་མཆོག་རབ་བསྔགས་པ་རེག་པར་འགྱུར་༎
