f41466e1c64a483bb71ee087fa0f3bfc,tadyathāpi nāma kāśyapa rājā kṣatriyo mūrdhnābhiṣiktaḥ pratyavarayā ceṭikayā saha pratipadyeta · tasya tata putra utpadyeta · kiṃ cāpi kāśyapa sa pratyavarayā ceṭikayā sāṃtikād utpanno ’tha ca puna sa rājaputra iti vaktavyaḥ evam eva kāśyapa kiṃ cāpi prathamacittotpādiko bodhisatvaḥ apratibalaḥ saṃsāre saṃsarat* satvān vinayituṃ kāmam atha ca puna sa tathāgataputro iti vaktavyaḥ tatredam ucyate 18 ceṭīya sārdhaṃ yatha cakkravarttī saṃvāsaṃ gatvā janayeta putraṃ ·kiṃ cāpi ceṭīya sakāśa jāto taṃ rājaputreti vadeti loke ·citte tathā prathame bodhisatvo balena hīno tribhave bhramaṃto ·dānena satvā vinayaṃn upāyair jinātmajo vuccati śuddhasatvo : 3,譬如遮迦越羅與青衣交通却後生子。具足成遮迦越羅相。雖從青衣生。由為是遮迦越羅子也。如是菩薩雖在生死中行力少會為佛子。,譬如剎利頂生大王賤女共會。若後生子。於意云何。賤人所生當言此子非王子耶。答曰不也世尊。此是王子。如是迦葉。雖從賤生而是王子。菩薩如是初發道心。住於生死教化眾生。而彼一切是如來子。,迦葉。譬如剎利大王與使人通懷妊生子。雖出下姓得名王子。初發心菩薩亦復如是。雖未具足福德智慧。往來生死隨其力勢利益眾生。是名如來真實佛子。,佛告迦葉。譬如剎帝利受灌頂王。有近侍婢王所愛幸。彼後生子。迦葉於意云何。此婢生之子得名王子不。迦葉答云。此是王子。迦葉如是初發心菩薩。雖道力微劣化彼眾生。未免輪迴亦得名為如來之子。我今於此而說頌曰。譬如輪王婢 為王之愛幸而後生其男 亦是剎帝子菩薩亦如是 初發菩提心德行而羸劣 方便化眾生雖未出三界 所作稱佛心得名真佛子,འོད་སྲུང་འདི་ལྟ་སྟེ་དཔེར་ན་རྒྱལ་པོ་རྒྱལ་རིགས་སྤྱི་བོ་ནས་དབང་བསྐུར་བ་བྲན་མོ་ངན་པ་དང་ཉལ་བ་དེ་ལས་དེའི་བུ་བྱུང་ན་། འོད་སྲུང་དེ་བྲན་མོ་ངན་པ་ལས་བྱུང་དུ་ཟིན་ཀྱང་དེ་ལ་རྒྱལ་པོའི་སྲས་ཞེས་བྱའོ་༎ འོད་སྲུང་དེ་བཞིན་དུ་བྱང་ཆུབ་སེམས་དཔའ་སེམས་དང་པོ་བསྐྱེད་པ་འཁོར་བ་ན་འཁོར་ཞིང་སེམས་ཅན་རྣམས་འདུལ་བའི་མཐུ་མ་ཐོབ་ཏུ་ཟིན་ཀྱང་དེ་ནི་དེ་བཞིན་གཤེགས་པའི་སྲས་ཞེས་བྱའོ་༎ དེ་ལ་འདི་སྐད་ཅེས་བྱ་སྟེ། དཔེར་ན་འཁོར་ལོས་སྒྱུར་བ་བྲན་མོ་དང་༎ ཉལ་བར་གྱུར་པ་དེ་ལས་བུ་བྱུང་བ་༎ བྲན་མོ་ལས་ནི་བྱུང་བར་གྱུར་ཀྱང་དེ་༎ རྒྱལ་པོའི་སྲས་ཞེས་འཇིག་རྟེན་ཟེར་བ་ལྟར་༎ བྱང་ཆུབ་སེམས་དཔའ་དང་པོ་སེམས་བསྐྱེད་པ་༎ སྲིད་པ་གསུམ་ན་འཁོར་ཞིང་མཐུ་ཆུང་སྟེ་༎ སྦྱིན་དང་ཐབས་ཀྱིས་སེམས་ཅན་མི་འདུལ་ཡང་༎ སེམས་ཅན་དག་པ་རྒྱལ་བའི་སྲས་ཞེས་བྱ་༎༎ བམ་པོ་གཉིས་པ་སྟེ་ཐ་མ་།
9406602e264644d7a89868a04cee9037,tadyathāpi nāma kāśyapa rājñā cakkravartinaḥ putrasahasraṃ bhavet* na cātra kaści cakkravartilakṣaṇasamanvāgato bhavet* na tatra rājñaś cakkravartinaḥ putrasaṃjña manyeta · evam eva kāśyapa kiṃ cāpi tathāgato koṭīśatasahasraparivāraḥ śrāvaker na cātra kaścid bodhisatvo bhavati na tatra tathāgatasya putrasaṃjñotpadyate · tatredam ucyate 18 yathā sahasraṃ nṛpate sutānāṃ na c’ eka putro ’pi salakṣaṇaḥ syāt*na tatra saṃjñā nṛvarasya teṣu voḍhū yatas te na dhuraṃ samarthāḥtathā hi buddho bahukoṭinirvṛtaḥ syāt teṣu kaścin na ca bodhisatvaḥna putrasaṃjñā sugatasya teṣu na bodhisatvo ’sti yato ’tra kaścit* 2 ,譬如遮迦越羅有千子無有一子。應遮迦越羅相也。雖有爾所子。不在子計中也。有羅漢數千巨億萬人。不在佛計中無一菩薩。佛雖有爾所。羅漢不具足為佛子也。(Text moved),譬如聖王雖有千子無聖王相。聖王之意。起無子想。如是迦葉。如來雖有百千聲聞弟子之眾。無菩薩者。如來之意。起無子想。,迦葉。譬如轉輪聖王而有千子。未有一人有聖王相。聖王於中不生子想。如來亦爾。雖有百千萬億聲聞眷屬圍遶而無菩薩。如來於中不生子想。,佛告迦葉。譬如輪王生其千子。大力勇猛辯才端正。須得輪王相具足。彼所童子內。若無一子具有輪王相者。彼轉輪王不作親子之想。迦葉。如是如來會下有百千俱胝聲聞圍遶。若無一菩薩相者。如來亦不作子想。我今於此而說頌曰。譬如轉輪王 所生千太子若無一童子 具彼輪王相此乃無王分 王無自子想佛子亦如是 雖有千俱胝聲聞眾圍遶 無一菩薩相善逝觀彼人 不為佛子想,འོད་སྲུང་འདི་ལྟ་སྟེ་༎ དཔེར་ན་འཁོར་ལོས་སྒྱུར་བའི་རྒྱལ་པོ་ལ་བུ་གཞོན་ནུ་སྟོབས་ཆེ་ཞིང་མགྱོགས་པའི་ཤུགས་དང་ལྡན་པ་མཐུ་རྙེད་པ་སྟོང་ཡོད་པར་གྱུར་ལ་༎ དེ་དག་གང་ཡང་འཁོར་ལོས་སྒྱུར་བའི་མཚན་དང་མི་ལྡན་ན་དེ་དག་ལ་འཁོར་ལོས་སྒྱུར་བའི་རྒྱལ་པོའི་སྲས་སུ་འདུ་ཤེས་མི་སྐྱེད་པ་དེ་བཞིན་དུ་། འོད་སྲུང་དེ་བཞིན་གཤེགས་པའི་ཞབས་འབྲིང་བ་ཉན་ཐོས་བྱེ་བ་བརྒྱ་སྟོང་དེ་དག་གང་ཡང་བྱང་ཆུབ་སེམས་དཔར་མ་གྱུར་ན་དེ་དག་ལ་དེ་བཞིན་གཤེགས་པའི་སྲས་སུ་འདུ་ཤེས་མི་སྐྱེད་དོ་༎ དེ་ལ་འདི་སྐད་ཅེས་བྱ་སྟེ་། དཔེར་ན་མི་དབང་རྒྱལ་པོའི་སྲས་སྟོང་པོ་༎ འགའ་ཡང་བུ་ཡི་མཚན་དང་མི་ལྡན་ན་༎ དེ་ཕྱིར་དེ་དག་གཅེས་བྱེད་མི་ནུས་པས་༎ དེ་ལ་མི་མཆོག་བུ་ཡི་འདུ་ཤེས་མེད་༎ དེ་བཞིན་སངས་རྒྱས་ཞབས་འབྲིང་བྱེ་བ་མང་༎ འགའ་ཡང་བྱང་ཆུབ་སེམས་དཔའ་མ་ཡིན་ན་༎ དེ་ན་བྱང་ཆུབ་སེམས་དཔའ་འགའ་མེད་ཕྱིར་༎ དེ་ལ་བདེ་གཤེགས་སྲས་སུ་དགོངས་མི་མཛད་༎
03f4a016fcbd41a0b603849fe7636038,tadyathāpi nāma kāśyapa rājñaś cakkravartino agrramahiṣyā kukṣe saptarātropapannaḥ kumāraś cakkravartilakṣaṇasamanvāgataḥ tasya kukṣigatasyāparipakvendriyasya kalalamahābhūtagatasya balavantatarā tatra devatā spṛham utpādayaṃti · na tv eva teṣu balajavanavegasthāmaprāpteṣu kumāreṣu tat kasmād dheto sa hi cakkravartivaṃśasyānupacchedāya sthāsyati · evam evakāśyapa prathamacittotpādiko bodhisatvaḥ aparipakvendriya kalalamahābhūtagata eva samānodatha ca punar balavaṃtatarā tatra pūrvadarśano devā spṛhām utpādayaṃti · na tv evāṣṭavimokṣadhyāyīṣv arhatsu · tat kasmād dhetoh sa hi buddhavaṃśasyānupacchedāya sthāsyati · tatredam ucyate 19 yathāgradevī ya tu cakkravartino kukṣisthito lakṣaṇapuṇyasatvo ·balavaṃtaraṃ deva spṛhā karonti na sthāmaprāptāna kumārakānāṃ ·ekāgracitte sthitabodhisatve saṃsārasaṃsthe ghaṭamāna bodhaye ·janenti tasya spṛha devanāgā na śrāvakeṣu trivimokṣadhyāyiṣu,譬如遮迦越羅夫人懷軀七日。會當成遮迦越羅相也。諸天皆徹視見腹中胞胎。雖遮迦越羅子。多者無遮迦越羅相。諸天言由不如供養腹中七日子也。發意菩薩如是中有為佛道。諸天心念言雖有羅漢數千萬億豪尊。不如供養發意菩薩也。,譬如迦葉聖王皇后持齋七日。生一童子。具聖王相。三十三天咸共嘆之。而不稱說其餘大者。所以者何。童子雖小而不斷於聖王種故。菩薩如是初發道心。諸根未具彼諸天眾。曾見佛者咸共嘆之。而不稱說諸阿羅漢具八解脫。所以者何。雖初發菩薩心諸根未具。不斷諸佛如來種故。,迦葉。譬如轉輪聖王有大夫人。懷妊七日是子具有轉輪王相。諸天尊重過餘諸子具身力者。所以者何。是胎王子必紹尊位繼聖王種。如是迦葉。初發心菩薩亦復如是。雖未具足諸菩薩根。如胎王子諸天神王深心尊重。過於八解大阿羅漢。所以者何。如是菩薩。名紹尊位不斷佛種。,佛告迦葉。譬如轉輪聖王。所有皇后懷娠七夜必生童子。具輪王相。彼在胎藏迦羅羅大。未有根形。雖未成形而有天人發心愛重。非愛彼子勇猛大力。於意云何。重彼輪王王種不斷。迦葉。亦復如是。初發心菩薩根雖未熟未免輪迴。樂行佛法。彼過去佛見生其愛重。於彼正觀八解脫阿羅漢。而不愛重。何以故。為彼初心菩薩佛種不斷故。我今於此而說頌曰。譬如轉輪王 皇后懷娠姙七日未成形 天人生愛護非重勇猛力 而重輪王種菩薩亦如是 初發菩提心欲度輪迴故 過去諸如來於彼而恭敬 此人紹佛事於諸聲聞眾 正觀八解者不生於敬愛 無彼成佛分,འོད་སྲུང་འདི་ལྟ་སྟེ་༎ དཔེར་ན་འཁོར་ལོས་སྒྱུར་བའི་རྒྱལ་པོའི་བཙུན་མོ་དམ་པའི་མངལ་དུ་གཞོན་ནུ་འཁོར་ལོས་སྒྱུར་བའི་མཚན་དང་ལྡན་པ་ཆགས་ནས་ཞག་བདུན་ལོན་ཏེ་འབྱུང་བ་ཆེན་པོ་མེར་མེར་པོར་འདུག་ཀྱང་ཤིན་ཏུ་སྟོབས་དང་ལྡན་པས་དེ་ལ་ལྷ་རྣམས་རེ་བ་སྐྱེད་ཀྱི་། གཞོན་ནུ་སྟོབས་ཆེ་ལ་མགྱོགས་པའི་ཤུགས་དང་ལྡན་ཞིང་མཐུ་རྙེད་པ་དེ་དག་ལ་ནི་མ་ཡིན་ནོ་༎ དེ་ཅིའི་ཕྱིར་ཞེ་ན་། དེ་ནི་འཁོར་ལོས་སྒྱུར་བའི་རིགས་མི་འཆད་པར་གནས་པའི་ཕྱིར་རོ་༎ འོད་སྲུང་དེ་བཞིན་དུ་བྱང་ཆུབ་སེམས་དང་པོ་བསྐྱེད་པ་དབང་པོ་ཡོངས་སུ་མ་སྨིན་པ་། ཉོན་མོངས་པའི་འབྱུང་བ་ཆེན་པོ་མེར་མེར་པོར་གྱུར་པ་འཁོར་བ་ན་འཁོར་ཞིང་སངས་རྒྱས་ཀྱི་ཆོས་རྣམས་ཡང་དག་པར་སྒྲུབ་པ་ཡང་ཤིན་ཏུ་སྟོབས་དང་ལྡན་པས་དེ་ལ་སྔོན་སངས་རྒྱས་མཐོང་བའི་ལྷ་རྣམས་རེ་བ་སྐྱེད་ཀྱི་༎ དགྲ་བཅོམ་པ་རྣམ་པར་ཐར་པ་བརྒྱད་ལ་བསམ་གཏན་པ་དེ་དག་ལ་ནི་མ་ཡིན་ནོ་༎ དེ་ཅིའི་ཕྱིར་ཞེ་ན་༎ དེ་སངས་རྒྱས་ཀྱི་གདུང་མི་འཆད་པར་གནས་པའི་ཕྱིར་རོ་༎ དེ་ལ་འདི་སྐད་ཅེས་བྱ་སྟེ་། དཔེར་ན་འཁོར་ལོས་སྒྱུར་བའི་བཙུན་མོ་མཆོག་༎ དེ་མངལ་བསོད་ནམས་མཚན་ལྡན་སེམས་ཅན་ཆགས་༎ སྟོབས་དང་ལྡན་པས་ལྷ་རྣམས་རེ་བ་སྐྱེད་༎ གཞོན་ནུ་མཐུ་ཐོབ་རྣམས་ལ་མ་ཡིན་ལྟར་༎ བྱང་ཆུབ་སེམས་དཔའ་རྩེ་གཅིག་སེམས་གནས་ཤིང་༎ འཁོར་བར་གནས་ཏེ་བྱང་ཆུབ་ཚོལ་བྱེད་པ་༎ དེ་ལ་ལྷ་དང་ཀླུ་རྣམས་རེ་བ་སྐྱེད་༎ རྣམ་ཐར་བརྒྱད་པོས་བསམ་གཏན་བྱེད་ལ་མིན་༎
3f6adc04b74f431a8dc8a670aba50c65,tadyathāpi nāma kāśyapa karaviṅkapotaka āṇḍakoṣaprakṣiptaḥ anirbhinne nayane sarvapakṣigaṇam abhibhavati · yad uta gaṃbhīramadhuranirghoṣarutaravitet* evam eva kāśyapaḥ prathamacittotpādiko bodhisatvo avidyāṇḍakośaprakṣipta karmakleśatamas timirapaṭalaparyavanaddhaḥ nayano ’pi sarvaśrrāvakapratyekabuddhā-m-abhibhavati · yad uta kuśalamūlapariṇāmanāprayoganirhārarutaravitena 20  tadyathāpi nāma kāśyapa rājñaś cakkravartina agramahiṣyā tatkṣaṇajātaṃ kumāraṃ sarvaśrreṣṭhinaigamajānapatayaḥ koṭṭarājānaś ca namasyaṃty evam eva kāśyapa prathamacittotpādiko bodhisatvaḥ sadevako loko namaskaronti 21,,,,佛告迦葉。譬如迦陵頻伽鳥。住彼卵中之時。早能與彼一切飛禽而皆不同。迦葉於意云何。當發一切美妙音聲故。迦葉。如是彼初發心菩薩雖住業煩惱無明藏中。早與一切聲聞辟支佛而不可同。迦葉於意云何。彼有迴向善根說法方便故。我今於此而說頌曰。譬如頻伽鳥 住彼卵子中雖未見身形 而與諸禽異當發美妙音 令人常愛樂佛子亦如是 初發菩提心未出煩惱藏 一切辟支佛及彼聲聞眾 亦復不能比迴向大安樂 方便利有情無垢慈悲意 能宣微妙音,འོད་སྲུང་འདི་ལྟ་སྟེ་། དཔེར་ན་བྱ་ཀ་ལ་པིང་ཀའི་ཕྲུག་གུ་སྒོ་ངའི་སྦུབས་ན་འདུག་པ་མིག་མ་བྱེ་བ་ཡང་འདི་ལྟ་སྟེ་༎ ཟབ་ཅིང་སྙན་པའི་སྒྲ་སྐད་ཀྱིས་བྱའི་ཚོགས་ཐམས་ཅད་ཟིལ་གྱིས་གནོན་ཏོ་༎ འོད་སྲུང་དེ་བཞིན་དུ་བྱང་ཆུབ་སེམས་དཔའ་སེམས་དང་པོ་བསྐྱེད་པ་མ་རིག་པའི་སྒོ་ངའི་སྦུབས་ན་འདུག་པ་ལས་དང་ཉོན་མོངས་པའི་མུན་པ་དང་རབ་རིབ་ཀྱི་ལིང་ཏོག་གིས་མིག་ཁེབས་པ་ཡང་འདི་ལྟ་སྟེ་། དགེ་བའི་རྩ་བ་ཡོངས་སུ་བསྔོ་བའི་སྦྱོར་བའི་སྒྲ་སྐད་ཀྱིས་ཉན་ཐོས་དང་རང་སངས་རྒྱས་ཐམས་ཅད་ཟིལ་གྱིས་གནོན་ཏོ་༎ ༼ཊེ྾ཏ་མོབེ༹ད༽
cbb6d753740640c0a6ac953c1a440dcf,tadyathāpi nāma kāśyapa ekaṃ vaiḍūryaṃ maṇiratnaṃ sumerumātraṃ rāśikācamaṇikān abhibhavati evam eva kāśyapa prathamacittotpādiko bodhisatvaḥ sarvaśrrāvakapratyekabuddhān abhibhavati · tatredam ucyate 22 yathāpi vaiḍūryamaṇi prabhāsvaraḥ kācāmaṇīn abhibhavate prabhūtān*em eva citte prathame bodhisatvo abhībhavati pṛthakcchrāvakān guṇān*,譬如摩尼珠。有水精大如須彌山。不如一摩尼珠。初發意菩薩眾。阿羅漢辟支佛所不能及也。,譬如有小摩尼真珠。勝於水精如須彌山。菩薩如是初發道心。出過一切聲聞之上。,迦葉。譬如一琉璃珠勝於水精。如須彌山。菩薩亦爾。從初發心便勝聲聞辟支佛眾。,佛告迦葉。譬如假摩尼瑠璃珠。聚如妙高山。不及一真摩尼瑠璃寶。迦葉。如是假使一切聲聞辟支佛。不能及一初發菩提心菩薩。我今於此而說頌曰。譬如假瑠璃 及彼摩尼珠積聚如須彌 不及真摩尼瑠璃之一寶 菩薩亦如是其數如微塵 不及初發心求彼菩提者 菩薩之一人,འོད་སྲུང་འདི་ལྟ་སྟེ་དཔེར་ན་ནོར་བུ་རིན་པོ་ཆེ་བཻ་ḍūར་ཡ་གཅིག་གིས་མཆིང་བུའི་ནོར་བུའི་ཕུང་པོ་རི་རབ་ཙམ་ཟིལ་གྱིས་གནོན་ཏོ་༎ འོད་སྲུང་དེ་བཞིན་དུ་བྱང་ཆུབ་སེམས་དཔའ་སེམས་དང་པོ་བསྐྱེད་པས་ཀྱང་ཉན་ཐོས་དང་རང་སངས་རྒྱས་ཐམས་ཅད་ཟིལ་གྱིས་གནོན་ཏོ་༎ དེ་ལ་འདི་སྐད་ཅེས་བྱ་སྟེ་། དཔེར་ན་འོད་གསལ་རིན་ཆེན་བཻ་ḍūརྱས་༎ མཆིད་བུའི་ནོར་བུ་མང་པོ་ཟིལ་གྱིས་གནོན་༎ བྱང་ཆུབ་སེམས་དཔའ་ཐོག་མར་སེམས་བསྐྱེད་པས་༎ ཉན་ཐོས་སྟོང་ཡང་དེ་ལྟར་ཟིལ་གྱིས་གནོན་༎
7bd53f5ee9e84712b074b1843ec2c579,tadyathāpi nāma kāśyapa rājño ’grramahiṣyāḥ tatkṣaṇajātaṃ kumāra sarvaśreṣṭhinaigamajānapadā koṭṭarājānaś ca namasyanti · evam eva kāśyapa prathamacittotpādiko bodhisatvaḥ sadevako loko namasyanti · tatredam ucyate 23 yathāpi rājña pṛthivīśvarasya putro bhavel lakṣaṇacitritāṅgaṃdṛṣṭvā eva taṃ jātamātraṃ kumāraṃ sakoṭṭa rājā praṇamaṃti paurāḥutpannamātre tatha bodhisatve sallakṣaṇaṃ taṃ jinarājaputraṃlokas sadevo ’pi namaskaronti prasannacittaṃ bahumānapūrvam*,譬如遮迦越羅有少子。諸小王傍臣皆為作禮。初發意菩薩如是。諸天釋梵世間人龍鬼神皆為作禮。,譬如迦葉聖王皇后初生童子。一切臣屬皆為作禮。菩薩如是初發道心。一切天人皆為作禮。,迦葉。譬如大王夫人生子之日。小王群臣皆來拜謁。菩薩亦爾。初發心時諸天世人皆當禮敬。,佛告迦葉。譬如輪王皇后。所生王子具足輪王福相。一切國王及諸人民悉皆歸伏。迦葉。如是初發心菩薩。天上人間一切有情悉皆歸伏。我今於此而說頌曰。譬如轉輪王 皇后所生子雖為童子身 具足王福相國王及臣民 一切皆歸向菩薩亦如是 初發菩提心佛子相具足 一切諸世間　天人眾生類 清淨心歸向,འོད་སྲུང་འདི་ལྟ་སྟེ་། དཔེར་ན་འཁོར་ལོས་སྒྱུར་བའི་རྒྱལ་པོའི་བཙུན་མོ་དམ་པ་ལས་གཞོན་ནུ་འཁོར་ལོས་སྒྱུར་བའི་མཚན་དང་ལྡན་པ་བཅས་མ་ཐག་ཏུ་ཚོང་དཔོན་དང་གྲོང་རྡལ་གྱི་མི་དང་། ཡུལ་གྱི་མི་ཐམས་ཅད་དང་། རྒྱན་ཕྲན་ཐམས་ཅད་ཕྱག་འཚལ་བར་འགྱུར་རོ་༎ འོད་སྲུང་དེ་བཞིན་དུ་བྱང་ཆུབ་སེམས་དཔའ་སེམས་དང་པོ་སྐྱེད་པ་ལ་ཡང་ལྷ་དང་བཅས་པའི་འཇིག་རྟེན་ཕྱག་འཚལ་ལོ་༎ དེ་ལ་འདི་སྐད་ཅེས་བྱ་སྟེ་༎ དཔེར་ན་ས་བདག་ཆེན་པོ་རྒྱལ་པོ་ལ་༎ མཚན་གྱིས་ལུས་སྤྲས་བུ་ཞིག་ཡོད་གྱུར་ན་༎ གཞོན་ནུ་དེ་ནི་བཙས་པར་མཐོང་མ་ཐག་༎ གྲོང་ཁྱེར་མི་དང་རྒྱལ་ཕྲན་ཐམས་ཅད་འདུད་༎ དེ་བཞིན་བྱང་ཆུབ་སེམས་ནི་བསྐྱེད་མ་ཐག་༎ མཚན་ལྡན་རྒྱལ་བའི་སྲས་པོ་དེ་ལ་ནི་༎ ལྷ་དང་བཅས་པའི་འཇིག་རྟེན་ཕྱག་འཚལ་ཞིང་༎ དང་བའི་སེམས་ཀྱིས་ཤིན་ཏུ་གཅེས་པར་འཛིན་༎
6e18e26151544bf4b9fd8328cd68ab41,tadyathāpi nāma kāśyapa yāni himavantaḥ parvatarājā bhaiṣajyāni virohaṃti sarvāny amamāny aparigrrahāny avikalpāni · yatra ca punar vyādhyā vyupanāmyaṃte taṃ vyādhiṃ praśamayaṃti · evam eva kāśyapa prathamacittotpādiko bodhisatvo yajñānabhaiṣajyaṃ samudānayati tat sarvanirvikalpa samudānayati samacittatā sarvasatveṣu cikitsā prayati · tatredam ucyate 24 himavaṃta ye parvatarāja bheṣajā rohaṃti te nirmamanirvikalpā ·yatropanāmyaṃti ca taṃ śamenti vyādhiṃ jarā cāpanayanti kecit*jinātmajāpi samudānayaṃti yaṃ jñānabheṣajya vikalpa muktvā ·hitārtha sarvaṃ samudānayaṃti samacitta satveṣu cikitsa kurvan*,譬如大山諸藥草。悉出其巔亦無有主。隨其有病者與諸病皆愈。菩薩如是持智慧藥。愈十方天下人生死老病悉等心。,譬如須彌山王。出諸良藥。為一切人療治苦患。無所適莫。菩薩如是。學智慧藥為一切人療生死患。亦無適莫。,迦葉。譬如雪山王中生諸藥草。無有所屬無所分別。隨病所服皆能療治。菩薩亦爾。所集智藥無所分別。普為眾生平等救護。,佛告迦葉。譬如大雪山王出生上好藥草。能治一切諸病。修合服食。無復心疑決定得差。迦葉。如是若彼菩薩所有智藥能療一切眾生煩惱諸病。菩薩以平等心普施一切有情。服者無復疑惑病即除愈。我今於此而說頌曰。譬如大雪山 出生上妙藥療治一切病 若有服之者獲差勿復疑 佛子亦如是出生妙智藥 能療一切人煩惱生老病 平等而賜之所有服食者 無疑決定差,འོད་སྲུང་འདི་ལྟ་སྟེ་དཔེར་ན་རིའི་རྒྱལ་པོ་གངས་རི་ལ་སྨན་གང་དག་སྐྱེས་པ་དེ་དག་ཐམས་ཅད་ནི་ང་ཡིར་བྱ་བ་མེད་། རིས་སུ་བཅད་པ་མེད་། རྣམ་པར་རྟོག་པ་མེད་དེ་༎ ནད་གང་ལ་བཏང་ཡང་ན་དེ་རབ་ཏུ་ཞི་བར་བྱེད་དོ་༎ འོད་སྲུང་དེ་བཞིན་དུ་བྱང་ཆུབ ༡༣༦བ༦་སེམས་དཔའ་ཡེ་ཤེས་ཀྱི་སྨན་གང་ཡང་དག་པར་སྒྲུབ་པ་དེ་ཐམས་ཅད་རྣམ་པར་མི་རྟོག་པར་སྒྲུབ་ཅིང་༎ སེམས་ཅན་ཐམས་ཅད་ལ་སྙོམས་པའི་སེམས་ཀྱིས་གསོ་བར་རབ་ཏུ་སྦྱོར་རོ་༎ དེ་ལ་འདི་སྐད་ཅེས་བྱ་སྟེ་། དཔེར་ན་རི་རྒྱལ་གངས་ཀྱི་རི་བོ་ལ་༎ སྨན་སྐྱེས་དེ་དག་མི་རྟོག་ངར་འཛིན་མེད་༎ གང་ལ་བཏང་བ་དེ་ཀུན་ཞི་བར་བྱེད་༎ ཁ་ཅིག་ནད་དང་རྒ་བ་འང་སེལ་བར་བྱེད་༎ དེ་བཞིན་རྒྱལ་བའི་སྲས་པོ་ཡེ་ཤེས་སྨན་༎ ཡང་དག་སྒྲུབ་པའང་རྣམ་པར་རྟོག་སྤངས་ནས་༎ སེམས་ཅན་ཕན་ཕྱིར་ཐམས་ཅད་ཡང་དག་སྒྲུབ་༎ སྙོམས་པའི་སེམས་ཀྱིས་སེམས་ཅན་གསོ་བར་བྱེད་༎
