e5674486c7b847218cce4ff3c6b27e32,,བཅོམ་ལྡན་འདས་འདི་ནི་ཆགས་པ་མ་མཆིས་པའི་དཔལ་ཏེ་། དེ་ནི་འཇམ་དཔལ་ལོ་༎ བཅོམ་ལྡན་འདས་འདི་ནི་མི་གཉིས་པའི་དཔལ་ཏེ་། དེ་ནི་འཇམ་དཔལ་ལོ་༎ བཅོམ་ལྡན་འདས་འདི་ནི་དངོས་པོ་མ་མཆིས་པའི་དཔལ་ཏེ་། དེ་ནི་འཇམ་དཔལ་ལོ་༎ བཅོམ་ལྡན་འདས་འདི་ནི་ཉོན་མོངས་པ་མ་མཆིས་པའི་དཔལ་ཏེ་། དེ་ནི་འཇམ་དཔལ་ལོ་༎ བཅོམ་ལྡན་འདས་འདི་ནི་དེ་བཞིན་ཉིད་ཀྱི་དཔལ་ཏེ་། དེ་ནི་འཇམ་དཔལ་ལོ་༎ བཅོམ་ལྡན་འདས་འདི་ནི་མ་ནོར་བ་དེ་བཞིན་ཉིད་ཀྱི་དཔལ་ཏེ་། དེ་ནི་འཇམ་དཔལ་ལོ་༎ བཅོམ་ལྡན་འདས་འདི་ནི་ཆོས་ཀྱི་དབྱིངས་ཀྱི་དཔལ་ཏེ་། དེ་ནི་འཇམ་དཔལ་ལོ་༎ བཅོམ་ལྡན་འདས་འདི་ནི་ཡང་དག་པའི་མཐའི་དཔལ་ཏེ་། དེ་ནི་ཇམ་དཔལ་ལོ་༎ བཅོམ་ལྡན་འདས་འདི་ནི་དམ་པའི་དཔལ་ཏེ་། དེ་ནི་ཇམ་དཔལ་ལོ་༎ བཅོམ་ལྡན་འདས་འདི་ནི་མཆོག་གི་དཔལ་ཏེ་། དེ་ནི་འཇམ་དཔལ་ལོ་༎ བཅོམ་ལྡན་འདས་འདི་ནི་ཕུལ་གྱི་དཔལ་ཏེ་། དེ་ནི་ཇམ་དཔལ་ལོ་༎ བཅོམ་ལྡན་འདས་འདི་ནི་བླ་ན་མ་མཆིས་པའི་དཔལ་ཏེ་། དེ་ནི་ཇམ་དཔལ་ལོ་༎,世尊。文殊師(757c1)利名爲無礙尸利。文殊師利名爲不二尸利。(2)名爲無餘尸利。名爲無所有尸利。名爲如尸(3)利法性尸利實際尸利第一尸利上尸利。無(4)上尸利。,(26)世尊。無著尸利。此謂曼殊尸利。世尊。無二(27)尸利。此謂曼殊尸利。世尊。無有尸利。此謂(28)曼殊尸利。世尊。無餘尸利此謂曼殊尸利。(29)世尊。如尸利。實際尸利。法界尸利。勝尸(770a1)利。最勝尸利。無上尸利。無上上尸利。無等(2)尸利。無等等尸利。世尊。此謂曼殊尸利童(3)眞。,
19cc76edce6349f2983be6fc05bf382d,,དེ་སྐད་ཅེས་སྨྲས་པ་དང་། འཇམ་དཔལ་གཞོན་ནུར་གྱུར་པས་ལྷའི་བུ་དེ་དག་ལ་འདི་སྐད་ཅེས་སྨྲས་སོ་༎ ལྷའི་བུ་དག་ཆོག་གིས་བདག་ལ་མ་རྟོག་རྣམ་པར་མ་རྟོག་ཤིག་། ཁོ་བོས་ནི་ཆོས་གང་ཡང་དམ་པ་ཞེས་བྱ་བའམ་། མཆོག་ཅེས་བྱ་བའམ་། ཕུལ་ཞེས་བྱ་བ་དེ་ལྟ་བུ་ཡང་དག་པར་རྗེས་སུ་མ་མཐོང་ངོ་༎ ལྷའི་བུ་དག་ཁོ་བོ་ནི་འདོད་ཆགས་ཀྱི་དཔལ་ཏེ་། དེའི་ཕྱིར་ཁོ་བོ་འཇམ་དཔལ་ལོ་༎ ཁོ་བོ་ནི་ཞེ་སྡང་གི་དཔལ་ཏེ་། དེའི་ཕྱིར་ཁོ་བོ་འཇམ་དཔལ་ལོ་༎ ཁོ་བོ་ནི་གཏི་མུག་གི་དཔལ་ཏེ་། དེའི་ཕྱིར་ཁོ་བོ་འཇམ་དཔལ་ལོ་༎ ལྷའི་བུ་དག་ཁོ་བོ་ནི་འདོད་ཆགས་ལས་ཡོངས་སུ་འདས་པ་མ་ཡིན་། ཞེ་སྡང་ལས་ཡོངས་སུ་འདས་པ་མ་ཡིན་། གཏི་མུག་ལས་ཡོངས་སུ་འདས་པ་མ་ཡིན་ཏེ་། ལྷའི་བུ་དག་བྱིས་པ་སོ་སོའི་སྐྱེ་བོ་དག་ནི་འདའ་ཞིང་ཡོངས་སུ་འདའ་བ་དང་། རྣམ་པར་འདའ་བ་དག་བྱེད་ཀྱི་། བྱང་ཆུབ་སེམས་དཔའ་རྣམས་ནི་ཆོས་གང་ལ་ཡང་འཕོ་བའམ་། འགྲོ་བའམ་། འདའ་བ་མེད་དོ་༎,文殊師利語諸天子言。止止諸天子(5)汝等勿取相分別。我不見諸法是上是中是(6)下。不如汝説。文殊師利言。我者我是貪(7)欲尸利瞋恚尸利愚癡尸利。是故我名文殊(8)師利。諸天子。我不出貪欲瞋恚愚癡。凡夫(9)人分別諸法求過出至到。諸菩薩於法無過(10)無出無至無到。,如是語已。曼殊尸利童眞告彼天子言。止(4)止天子。莫分別我。我不見一法若勝若劣(5)若最勝若妙。又天子。汝若説言曼殊尸利(6)者。我欲尸利彼是我曼殊尸利。我瞋尸利彼(7)是我曼殊尸利。我癡尸利彼是我曼殊尸利。(8)如是説者。名爲正説。何以故。天子。我不過(9)欲。不過瞋。不過癡。天子。諸凡夫小兒有行(10)有到。諸菩薩無一處法中有行有到。,
5bf05cdc9a69408b8ddb50acc7fe4a9c,,ལྷའི་བུ་རྣམས་ཀྱིས་སྨྲས་པ་། འཇམ་དཔལ་འོ་ན་བྱང་ཆུབ་སེམས་དཔའ་རྣམས་སངས་རྒྱས་ཀྱི་ཆོས་རྣམས་རྣམ་པར་མི་གནོན་ཏམ་། ས་བཅུ་རྗེས་སུ་མི་གནོན་ཏམ་། འཇམ་དཔལ་གྱིས་སྨྲས་པ་། ལྷའི་བུ་དག་དེ་ཇི་སྙམ་དུ་སེམས་། སྒྱུ་མས་སྤྲུལ་པའི་སེམས་དང་སེམས་ལས་བྱུང་བ་དག་སངས་རྒྱས་ཀྱི་ཆོས་རྣམ་པར་གནོན་ཅིང་ས་བཅུ་རྗེས་སུ་གནོན་པ་ཡོད་དམ་།,諸天子言。菩薩不到十地不(11)至佛法耶。文殊師利言。於諸天子意云何。(12)幻人能到十地至佛法不。,天子言。(11)曼殊尸利。諸菩薩不到佛法不行十地耶。曼(12)殊尸利言。天子。於意云何。幻人心心數法(13)行十地耶。,
8981630e8825450894f88b5659eec2e0,,ལྷའི་བུ་རྣམས་ཀྱིས་སྨྲས་པ་། འཇམ་དཔལ་སྒྱུ་མའི་སྐྱེ་བུ་ལ་གནས་ཀྱང་མེད་ན་། སངས་རྒྱས་ཀྱི་ཆོས་རྣམ་པར་གནོན་པའམ་། ས་རྗེས་སུ་གནོན་པ་ལྟ་ག་ལ་ཡོད་། འཇམ་དཔལ་གྱིས་སྨྲས་པ་། ལྷའི་བུ་དག་དེ་བཞིན་དུ་ཆོས་ཐམས་ཅད་ནི་སྒྱུ་མ་ལྟ་བུ་སྟེ་། དེ་དག་ནི་གནོན་པ་མེད་། རྣམ་པར་གནོན་པ་མེད་། ཡོངས་སུ་གནོན་པ་མེད་དེ་འདའ་མེད་དོ་༎,諸天子言。幻化(13)人尚無住處。何況從此住地至於餘地。文殊(14)師利言。諸天子。一切法如幻無去無來無過(15)無出無至無到。,天子言。曼殊尸利。如是幻人本(14)無住處。何處於地復有行到。曼殊尸利言。(15)如是天子。諸法喩幻彼無行踐。無他處到。(16)無用力行。無自主行。,
a85db26847ab49fab7d2adc673a9e9cb,,ལྷའི་བུ་དག་གིས་སྨྲས་པ་། འོ་ན་འཇམ་དཔལ་ཁྱོད་བྱང་ཆུབ་མངོན་པར་རྫོགས་པར་འཚང་རྒྱ་བར་མི་འགྱུར་རམ་། འཇམ་དཔལ་གྱིས་སྨྲས་པ་། ལྷའི་བུ་དག་དེ་ཇི་སྙམ་དུ་སེམས་། བྱིས་པ་སོ་སོའི་སྐྱེ་བོ་འདོད་ཆགས་ཀྱིས་ཀུན་ནས་གླགས་པ་ཞིག་བྱང་ཆུབ་ཀྱི་སྙིང་པོར་འདུག་ན་ཐམས་ཅད་མཁྱེན་པའི་ཡེ་ཤེས་དང་ལྡན་པར་འགྱུར་རམ་།,諸天子言。汝不當得。阿耨(16)多羅三藐三菩提耶。文殊師利言。諸天子。(17)於意云何。凡夫貪欲覆心能坐道場得一切(18)智不。諸天子言不也。,天子言。曼殊尸利。汝(17)不當覺菩提耶。曼殊尸利言。天子。於意云(18)何。凡夫小兒貪欲繞住。能坐菩提場具足遍(19)智不。,
11e2c531ad8740b695c917ba259d23e6,,ལྷའི་བུ་དག་གིས་སྨྲས་པ་། ཅི་འཇམ་དཔལ་འོ་ན་ཁྱོད་འདོད་ཆགས་ཀྱིས་ཀུན་ནས་གླགས་པའི་བྱིས་པ་སོ་སོའི་སྐྱེ་བོ་ཡིན་ནམ་། འཇམ་དཔལ་གྱིས་སྨྲས་པ་། ལྷའི་བུ་དག་དེ་དེ་བཞིན་ཏེ་། བདག་ནི་འདོད་ཆགས་ཀྱིས་ཀུན་ནས་གླགས་པའོ་༎ ཞེ་སྡང་གིས་ཀུན་ནས་གླགས་པའོ་༎ གཏི་མུག་གིས་ཀུན་ནས་གླགས་པའོ་༎ བདག་ནི་མུ་སྟེགས་ཅན་གཞན་ནོ་༎ ལོག་པ་ལ་ཞེན་པའོ་༎,諸天子言。文殊師利。(19)汝今貪欲覆心是凡夫耶。文殊師利言。如是(20)如是。我是凡夫從貪欲起。從瞋恚起。從愚(21)癡起。我是外道是邪行人。,天子言。曼殊尸利。汝豈復貪欲繞住(20)是凡夫小兒耶。曼殊尸利言。如是天子。我欲(21)繞住。我瞋繞住。我癡繞住。我是外道。我是(22)邪行。,
03ca865c366b454cbab21e32c0b5dbb6,,ལྷའི་བུ་དག་གིས་སྨྲས་པ་། འཇམ་དཔལ་ཅི་ལས་བསམས་ཏེ་དེ་སྐད་དུ་བདག་ནི་འདོད་ཆགས་ཀྱིས་ཀུན་ནས་གླགས་པའོ་༎ ཞེ་སྡང་གིས་ཀུན་ནས་གླགས་པའོ་༎ གཏི་མུག་གིས་ཀུན་ནས་གླགས་པའོ་ཞེས་སྨྲ་། འཇམ་དཔལ་གྱིས་སྨྲས་པ་། ལྷའི་བུ་དག་དེ་ནི་ཇི་ལྟར་མི་གནས་པའི་ཚུལ་གྱིས་འདོད་ཆགས་དང་། ཞེ་སྡང་དང་། གཏི་མུག་གི་ངོ་བོ་ཉིད་ལ་གནས་པའི་ཕྱིར་། ཇི་ལྟར་ཕྱོགས་བཅུ་ཀུན་ཏུ་གནས་མེད་པ་དེ་ལྟར་གནས་སོ་༎,諸天子言。以何(22)故。自言我是凡夫。從貪欲起瞋恚起愚癡起。(23)文殊師利言。是貪欲瞋恚愚癡性。十方求之(24)不可得。我以不住法住是性中故。説我是(25)凡夫三毒所覆。,天子言。曼殊尸利。以何義意説如是(23)言。我欲繞住。我瞋繞住。我癡繞住。我是外(24)道。我是邪行。曼殊尸利言。天子。我所有繞(25)住無有住處。於十方中無欲瞋癡。自性住處(26)故。以無住處相應故。,
59ab424cc2a24eaf95a835e89a022f17,,ལྷའི་བུ་དག་གིས་སྨྲས་པ་། འཇམ་དཔལ་ཁྱོད་ཇི་ལྟར་མུ་སྟེགས་ཅན་གཞན་ཞེས་བྱ་བ་ཡིན་། སྨྲས་པ་། ལྷའི་བུ་དག་ཁོ་བོ་ནི་མུ་སྟེགས་ཅན་གཞན་དུ་མི་འགྲོ་སྟེ་། དེའི་ཕྱིར་མུ་སྟེགས་ཅན་གཞན་ཞེས་བྱའོ་༎ ལྷའི་བུ་དག་གིས་སྨྲས་པ་། འཇམ་དཔལ་ཁྱོད་ཇི་ལྟར་ལོག་པ་ལ་ཞེན་ཅེས་བྱ་། འཇམ་དཔལ་གྱིས་སྨྲས་པ་། ལྷའི་བུ་དག་ཁོ་བོས་ནི་ཆོས་ཐམས་ཅད་ལོག་པར་ཤེས་ཏེ་། ཡང་དག་པ་མ་ཡིན་ཞིང་ནོར་བ་ཡོངས་སུ་བརྟགས་པར་ཁོང་དུ་ཆུད་པས་། དེའི་ཕྱིར་ཁོ་བོ་ནི་ལོག་པ་ལ་ཞེན་པའོ་༎,文殊師利。汝云何名外道。(26)文殊師利言。我終不到外道。諸道性不可得(27)故。我於一切道爲外。諸天子言。汝云何是(28)邪行人。文殊師利言。我已知一切法皆是邪(29)虚妄不實。是故我是邪行人。,天子言。曼殊尸利汝(27)云何是外道。曼殊尸利言。天子。我於外道無(28)所行到。彼因縁故我是外道。天子言。曼殊(29)尸利。汝云何是邪行。曼殊尸利言。天子。我知(770b1)諸法是邪不實不如。但是分別。彼因縁故我(2)是邪行。,
5fd9af751eea45f9a4a88d7aec4b00e9,,དེ་ནས་དེའི་ཚེ་ལྷའི་བུ་སྟོང་ཕྲག་བཅུ་པོ་དེ་དག་གིས་། འཇམ་དཔལ་གྱིས་བསྟན་པ་དེ་ཐོས་ནས་། མི་སྐྱེ་བའི་ཆོས་ལ་བཟོད་པ་ཐོབ་པར་གྱུར་ཏོ་༎ འདི་སྐད་ཅེས་ཀྱང་སྨྲས་ཏེ་། རྡོ་རྗེའི་ཚིག་དང་། ས་བོན་གྱི་ཚིག་དང་། ཕུར་པའི་ཚིག་རྣམ་པ་འདི་ལྟ་བུ་དག་གང་གི་རྣ་ལམ་དུ་གྲག་པར་གྱུར་པ་དེ་དག་ཀྱང་ཐོབ་པར་བྱ་བ་ལེགས་པར་ཐོབ་པ་ཡིན་ན་། གང་གིས་ཐོས་ནས་མོས་པར་གྱུར་པ་དང་། ཡིད་ཆེས་པ་དང་། ལུང་འབོགས་པ་དང་། ཁ་ཏོན་བྱེད་པ་དང་། འཛིན་པ་དང་། ཀློག་པ་དང་། སྟོན་པ་དང་། དེ་བཞིན་ཉིད་དུ་ནན་ཏན་བྱེད་པ་ལྟ་སྨོས་ཀྱང་ཅི་དགོས་ཏེ་། དེ་དག་ནི་ཐོགས་པ་མེད་པའི་སྤོབས་པ་རྗེས་སུ་ཐོབ་པར་འགྱུར་རོ་༎ ཆོས་ཐམས་ཅད་ལ་སྣང་བ་ཐོབ་པར་འགྱུར་རོ་༎ ཚུལ་གཅིག་ཏུ་བསྟན་པ་ལ་མཁས་པར་འགྱུར་རོ་༎ ཆོས་ཐམས་ཅད་ཀྱང་སངས་རྒྱས་ཀྱི་ཆོས་དང་སྦྱོར་བར་འགྱུར་རོ་༎,説是法時萬天(758a1)子得聞是語。皆得無生法忍。各作是言。是諸(2)衆生皆得大利。得聞眞正金剛語句。何況聞(3)已信解受持讀誦爲人解説如説修行。當得(4)無礙辯才一切法中得眞慧照明。巧説諸法(5)一相一門。能示衆生一切諸法皆是佛法,爾時十千天子。於曼殊尸利童眞邊。(3)聞此説已。無生法中得忍。彼得忍已説如是(4)言。世尊。若彼衆生善此金剛句光明到耳者(5)得勝利。何況聞已。信解爲縁受持讀誦。修習(6)演説如所説行。世尊。彼於諸法中當得無著(7)辯才。及得明照善説一相諸法。於佛法中相(8)續不斷。顯示諸法皆是佛法,
