cd9edc140e144a40a40163f082e6bc7b,saṃkalpaprabhavo rāgo dveṣo mohaś ca kathyate |śubhāśubhaviparyāsān saṃbhavanti pratītya hi ||1||,從憶想分別 生於貪恚癡淨不淨顛倒 皆從眾緣生,༎ འདོད་ཆགས་ཞེ་སྡང་གཏི་མུག་རྣམས་། ། ཀུན་ཏུ་རྟོག་ལས་འབྱུང་བར་གསུངས་། །སྡུག་དང་མི་སྡུག་ཕྱིན་ཅི་ལོག་། ། བརྟེན་པ་ཉིད་ལས་ཀུན་ཏུ་འབྱུང་། །,"It is said that desire, hatred, stupidity arise from conceptuality; they arise in dependence on the pleasant, the unpleasant and confusion. they arise in dependence on confusion about the pleasant and unpleasant"
c318aceac8ef4b75be02ba0aec26f056,śubhāśubhaviparyāsān saṃbhavanti pratītya ye |te svabhāvān na vidyante tasmāt kleśā na tattvataḥ ||2||,若因淨不淨 顛倒生三毒三毒即無性 故煩惱無實,གང་དག་སྡུག་དང་མི་སྡུག་དང་། ། ཕྱིན་ཅི་ལོག་ལས་བརྟེན་འབྱུང་བ་། །༼༦༽དེ་དག་རང་བཞིན་ལས་མེད་དེ་། ། དེ་ཕྱིར་ཉོན་མོངས་ཡང་དག་མེད་། །,"Whatever arises in dependence upon the pleasant, the unpleasant and confusion, (whatever arises in dependence on confusion about the pleasant and unpleasant) they have no own-nature, therefore, afflictions do not really exist (do not exist in themselves)."
4f89d740fd7d461bb3e27ec5c384482f,ātmano ’stitvanāstitve na kathaṃ cic ca sidhyataḥ |taṃ vināstitvanāstitve kleśānāṃ sidhyataḥ katham ||3||,我法有以無 是事終不成無我諸煩惱 有無亦不成,བདག་གི་ཡོད་ཉིད་མེད་ཉིད་ནི་། ། ཇི་ལྟ་བུར་ཡང་གྲུབ་པ་མེད་། །དེ་མེད་ཉོན་མོངས་རྣམས་ཀྱི་ནི་། ། ཡོད་ཉིད་མེད་ཉིད་ཇི་ལྟར་འགྲུབ་། །,"The existence or non-existence of self is not established in any way. Without that, how can the existence or non-existence of afflictions be established?"
236bcb7e10534fdda7578c1a6f818289,kasya cid dhi bhavantīme kleśāḥ sa ca na sidhyati |kaścid āho vinā kaṃcit santi kleśā na kasyacit ||4||,誰有此煩惱 是即為不成若離是而有 煩惱則無屬,ཉོན་མོངས་དེ་དག་གང་གི་ཡིན་། ། དེ་ཡང་གྲུབ་པ་ཡོད་མ་ཡིན་། །འགའ་མེད ༼༧༽པར་ནི་གང་གི་ཡང་། ། ཉོན་མོངས་པ་དག་ཡོད་མ་ཡིན་། །,"These afflictions are someone’s. But that someone is not established. Without someone, the afflictions are not anyone’s."
efc0cdf1394c40969df6edb91170ea56,svakāyadṛṣṭivat kleśāḥ kliṣṭe santi na pañcadhā |svakāyadṛṣṭivat kliṣṭaṃ kleśeṣv api na pañcadhā ||5||,如身見五種 求之不可得煩惱於垢心 五求亦不得,རང་ལུས་ལྟ་བཞིན་ཉོན་མོངས་རྣམས་། ། ཉོན་མོངས་ཅན་ལ་རྣམ་ལྔར་མེད་། །རང་ལུས་ལྟ་བཞིན་ཉོན་མོངས་ཅན་། ། ཉོན་མོངས་པ་ལ་རྣམ་ལྔར་མེད་། །,"Like the self apprehended in the view of one’s own body, the afflictions do not exist in five ways in the afflicted. Like the self apprehended in the view of one’s own body, the afflicted does not exist in five ways in the afflictions."
74e392a33a7c4e208a95b511c9aa5c52,svabhāvato na vidyante śubhāśubhaviparyayāḥ |pratītya katamān kleśāḥ śubhāśubhaviparyayān ||6||,淨不淨顛倒 是則無自性云何因此二 而生諸煩惱,སྡུག་དང་མི་སྡུག་ཕྱིན་ཅི་ལོག་། རང་བཞིན་ལས་ནི་ཡོད་མིན་ན་། །༼༡༤ཨ༡༽སྡུག་དང་མི་སྡུག་ཕྱིན་ཅི་ལོག་། ། བརྟེན་ནས་ཉོན་མོངས་གང་དག་ཡིན་། །,"If confusion about the pleasant and unpleasant does not exist from its own nature, what afflictions can depend on confusion about the pleasant and unpleasant?"
ab9523676aba4415bfabc420f1bb2ead,rūpaśabdarasasparśā gandhā dharmāś ca ṣaḍvidham |vastu rāgasya doṣasya mohasya ca vikalpyate ||7||,色聲香味觸 及法為六種如是之六種 是三毒根本,གཟུགས་སྒྲ་རོ་དང་རེག་པ་དང་། ། དྲི་དང་ཆོས་དག་རྣམ་དྲུག་ནི་། །གཞི་སྟེ་འདོད་ཆགས་ཞེ་སྡང་དང་། ། གཏི་མུག་གི་ནི་ཡིན་པར་བརྟགས་། །,"Colour/shape, sound, taste, tactile sensation, smell and dharmas: these six are conceived as the basis of desire, hatred and stupidity."
03333cd497cc48298a3fa30d2936d61a,rūpaśabdarasasparśā gandhā dharmāś ca kevalāḥ |gandharvanagarākārā marīcisvapnasaṃnibhāḥ ||8||,色聲香味觸 及法體六種皆空如炎夢 如乾闥婆城,གཟུགས་སྒྲ་རོ་དང་རེག་པ་དང་། ། དྲི་དང་ཆོས་དག ༼༢༽འབའ་ཞིག་སྟེ་། །དྲི་ཟའི་གྲོང་ཁྱེར་ལྟ་བུ་དང་། ། སྨིག་རྒྱུ་རྨི་ལམ་འདྲ་བ་ཡིན་། །,"Colour/shape, sound, taste, tactile sensation, smell and dharmas: these are like gandharva-cities and similar to mirages, dreams."
544380016bc942c795185d25310cab6b,aśubhaṃ vā śubhaṃ vāpi kutas teṣu bhaviṣyati |māyāpuruṣakalpeṣu pratibimbasameṣu ca ||9||,如是六種中 何有淨不淨猶如幻化人 亦如鏡中像,སྒྱུ་མའི་སྐྱེས་བུ་ལྟ་བུ་དང་། ། གཟུགས་བརྙན་འདྲ་བ་དེ་དག་ལ་། །སྡུག་པ་དང་ནི་མི་སྡུག་པ་། ། འབྱུང་བར་ཡང་ནི་ག་ལ་འགྱུར་། །,How can the pleasant and unpleasant occur in those things which are like phantoms and similar to reflections?
64087912732144478bde93dc6fe47fa6,anapekṣya śubhaṃ nāsty aśubhaṃ prajñapayemahi |yat pratītya śubhaṃ tasmāc chubhaṃ naivopapadyate ||10||,不因於淨相 則無有不淨因淨有不淨 是故無不淨,གང་ལ་བརྟེན་ནས་སྡུག་པ་ཞེས་། ། གདགས་པར་བྱ་བ་མི་སྡུག་པ་། །སྡུག ༼༣༽ལ་མི་ལྟོས་ཡོད་མིན་པས་། ། དེ་ཕྱིར་སྡུག་པ་འཐད་མ་ཡིན་། །,"Something is called “pleasant” in dependence on the unpleasant. Since that would not exist without relation to the pleasant, therefore, the pleasant is not tenable."
f4df4dbee6194b87ad269616ff90b347,anapekṣyāśubhaṃ nāsti śubhaṃ prajñapayemahi |yat pratītyāśubhaṃ tasmād aśubhaṃ naiva vidyate ||11||,不因於不淨 則亦無有淨因不淨有淨 是故無有淨,གང་ལ་བརྟེན་ནས་མི་སྡུག་པར་། ། གདགས་པར་བྱ་བ་སྡུག་པ་ནི་། །མི་སྡུག་མི་སྟོས་ཡོད་མིན་པས་། ། དེ་ཕྱིར་མི་སྡུག་འཐད་མ་ཡིན་། །,"Something is called “unpleasant” in dependence on the pleasant. Since that would not exist without relation to the unpleasant, therefore, the unpleasant is not tenable."
f4c8448e93fa4578888c0cfb9b6fc050,avidyamāne ca śubhe kuto rāgo bhaviṣyati |aśubhe ’vidyamāne ca kuto dveṣo bhaviṣyati ||12||,若無有淨者 何由而有貪若無有不淨 何由而有恚,སྡུག་པ་ཡོད་པ་མ་ཡིན་ན་། ། འདོད་ཆགས་ཡོད་པར་ག་ལ་འགྱུར་། །མི ༼༤༽སྡུག་ཡོད་པ་མ་ཡིན་ན་། ། ཞེ་སྡང་ཡོད་པར་ག་ལ་འགྱུར་། །,"If the pleasant does not exist, how can desire exist? If the unpleasant does not exist, how can hatred exist?"
4b6f0101d9f2489d982ada4b1c6208d9,anitye nityam ity evaṃ yadi grāho viparyayaḥ |nānityaṃ vidyate śūnye kuto grāho viparyayaḥ ||13||,於無常著常 是則名顛倒空中無有常 何處有常倒,གལ་ཏེ་མི་རྟག་རྟག་པ་ཞེས་། ། དེ་ལྟར་འཛིན་པ་ལོག་ཡིན་ན་། །སྟོང་ལ་མི་རྟག་ཡོད་མིན་པས་། ། འཛིན་པ་ཇི་ལྟར་ལོག་པ་ཡིན་། །,"If such an apprehension as “the impermanent is permanent” is confused, since impermanence does not exist in the empty, how can such an apprehension be confused?"
aa95e3fe61e94a198701894359ccc90c,anitye nityam ity evaṃ yadi grāho viparyayaḥ |anityam ity api grāhaḥ śūnye kiṃ na viparyayaḥ ||14||,若於無常中 著無常非倒空中無無常 何有非顛倒,གལ་ཏེ་མི་རྟག་རྟག་གོ་ཞེས་། ། དེ་ལྟར་འཛིན་པ་ལོག་ཡིན་ན་། །སྟོང་ལ་མི་རྟག ༼༥༽པའོ་ཞེས་། ། འཛིན་པའང་ཇི་ལྟར་ལོག་མ་ཡིན་། །,"If such an apprehension as “the impermanent is permanent” is confused, how would the apprehension “there is impermanence in the empty” also not be confused?"
06d2a2f6db39429cb07828618d9dc6fd,yena gṛhṇāti yo grāho grahītā yac ca gṛhyate |upaśāntāni sarvāṇi tasmād grāho na vidyate ||15||,可著著者著 及所用著法是皆寂滅相 云何而有著,གང་གིས་འཛིན་དང་འཛིན་གང་དང་། ། འཛིན་པ་པོ་དང་གང་གཟུང་བ་། །ཐམས་ཅད་ཉེ་བར་ཞི་བ་སྟེ་། ། དེ་ཕྱིར་འཛིན་པ་ཡོད་མ་ཡིན་། །,"The means by which one apprehends, the apprehension itself, the apprehender and the apprehended: all are completely pacified, therefore there is no apprehending."
3173f27e01a24a948785569b74d8c8d1,avidyamāne grāhe ca mithyā vā samyag eva vā |bhaved viparyayaḥ kasya bhavet kasyāviparyayaḥ ||16||,若無有著法 言邪是顛倒言正不顛倒 誰有如是事,ལོག་པའམ་ཡང་དག་ཉིད་དུ་ནི་། ། འཛིན་པ་ཡོད་པ་མ་ཡིན་ན་། །གང་ལ་ཕྱིན་ཅི་ལོག་ཡོད་ཅིང་།  ༼༦༽གང་ལ་ཕྱིན་ཅི་མ་ལོག་ཡོད་། །,"If there is neither confused nor right apprehension, who is confused and who is not confused?"
ea5797487a3a4e639f73de0e4362b00a,na cāpi viparītasya saṃbhavanti viparyayāḥ |na cāpy aviparītasya saṃbhavanti viparyayāḥ ||17||,有倒不生倒 無倒不生倒倒者不生倒 不倒亦不生,ཕྱིན་ཅི་ལོག་ཏུ་གྱུར་པ་ལ་། ། ཕྱིན་ཅི་ལོག་དག་མི་སྲིད་དེ་། །ཕྱིན་ཅི་ལོག་ཏུ་མ་གྱུར་ལ་། ། ཕྱིན་ཅི་ལོག་དག་མི་སྲིད་དེ་། །,Confusions do not occur for those who are already confused; confusions do not occur for those who are not yet confused;
329e5b02fe6a4716885dd3abbf46d6ac,na viparyasyamānasya saṃbhavanti viparyayāḥ |vimṛśasva svayaṃ kasya saṃbhavanti viparyayāḥ ||18||,若於顛倒時 亦不生顛倒汝可自觀察 誰生於顛倒,ཕྱིན་ཅི་ལོག་ཏུ་གྱུར་བཞིན་ལ་། ། ཕྱིན་ཅི་ལོག་དག་མི་སྲིད་དེ་། །གང་ལ་ཕྱིན་ཅི་ལོག་སྲིད་པ་། ། བདག་ཉིད་ཀྱིས་ནི་རྣམ ༼༧༽པར་དཔྱོད་། །,confusions do not occur for those who are being confused. For whom do confusions occur? Examine this by yourself!
f9b057ecb7374ea995752697c768a395,anutpannāḥ kathaṃ nāma bhaviṣyanti viparyayāḥ |viparyayeṣv ajāteṣu viparyayagataḥ kutaḥ ||19||,諸顛倒不生 云何有此義無有顛倒故 何有顛倒者,ཕྱིན་ཅི་ལོག་རྣམས་མ་སྐྱེས་ན་། ། ཇི་ལྟ་བུར་ན་ཡོད་པར་འགྱུར་། །ཕྱིན་ཅི་ལོག་རྣམས་སྐྱེ་མེད་ན་། ། ཕྱིན་ཅི་ལོག་ཅན་ག་ལ་ཡོད་། །,"If confusions are not born, how can they exist? If confusions are not born, where can there be someone who has confusion?"
19d36aaeb92a4715bd9a1c1bd85a8e1e,na svato jāyate bhāvaḥ parato naiva jāyate |na svataḥ parataś ceti viparyayagataḥ kutaḥ ||20||,,དངོས་པོ་བདག་ལས་མི་སྐྱེ་སྟེ་། ། གཞན་ལས་སྐྱེ་བ་ཉིད་མ་ཡིན་། །བདག་དང་གཞན་ལས་ཀྱང་མིན་ན་། ། ཕྱིན་ཅི་ལོག་ཅན་ག ༼༡༤བ༡༽ལ་ཡོད་། །,"Things are not born from themselves, not born from others. If they are also not from self and others, where can there be someone who has confusion?"
f112bd2062284a828c6c4979531c0169,ātmā ca śuci nityaṃ ca sukhaṃ ca yadi vidyate |ātmā ca śuci nityaṃ ca sukhaṃ ca na viparyayaḥ ||21||,若常我樂淨 而是實有者是常我樂淨 則非是顛倒,གལ་ཏེ་བདག་དང་གཙང་བ་དང་། ། རྟག་དང་བདེ་བ་ཡོད་ན་ནི་། །བདག་དང་གཙང་དང་རྟག་པ་དང་། ། བདེ་བ་ཕྱིན་ཅི་ལོག་མ་ཡིན་། །,"If self and purity and permanence and happiness were existent, self and purity and permanence and happiness would not be confusions."
4541b3959d2c4f69b2ad23a6588ecb61,nātmā ca śuci nityaṃ ca sukhaṃ ca yadi vidyate |anātmā ’śucy anityaṃ ca naiva duḥkhaṃ ca vidyate ||22||,若常我樂淨 而實無有者無常苦不淨 是則亦應無,གལ་ཏེ་བདག་དང་གཙང་བ་དང་། ། རྟག་དང་བདེ་བ་མེད་ན་ནི་། །བདག་མེད་མི་གཙང་མི་རྟག་དང་། ། སྡུག་བསྔལ ༼༢༽ཡོད་པ་མ་ཡིན་ནོ་། །,"If self and purity and permanence and happiness were non-existent, selflessness, impurity, impermanence and anguish would not exist."
c17588c21591404491cc28f4e9cc912e,evaṃ nirudhyate ’vidyā viparyayanirodhanāt |avidyāyāṃ niruddhāyāṃ saṃskārādyaṃ nirudhyate ||23||,如是顛倒滅 無明則亦滅以無明滅故 諸行等亦滅,དེ་ལྟར་ཕྱིན་ཅི་ལོག་འགགས་པས་། ། མ་རིག་པ་ནི་འགག་པར་འགྱུར་། །མ་རིག་འགགས་པར་གྱུར་ན་ནི་། ། འདུ་བྱེད་ལ་སོགས་འགག་པར་འགྱུར་། །,"Thus by stopping confusion, ignorance will stop. If ignorance is stopped, impulsive acts etc. will stop."
a21ad8a3745e48979fa1c5ad4737429b,yadi bhūtāḥ svabhāvena kleśāḥ kecid dhi kasyacit |kathaṃ nāma prahīyeran kaḥ svabhāvaṃ prahāsyati ||24||,若煩惱性實 而有所屬者云何當可斷 誰能斷其性,གལ་ཏེ་ལ་ལའི་ཉོན་མོངས་པ་། ། གང་དག་རང་བཞིན་གྱིས་ཡོད་ན་། །ཇི་ལྟ་བུར ༼༣༽ན་སྤོང་བར་འགྱུར་། ། ཡོད་པ་སུ་ཞིག་སྤོང་བར་བྱེད་། །,"If the afflictions of some existed by their own nature, how could they be let go of? Who can let go of what exists by nature?"
f2d3d146bb4442698f7b5fa391470757,yady abhūtāḥ svabhāvena kleśāḥ kecid dhi kasyacit |kathaṃ nāma prahīyeran ko ’sadbhāvaṃ prahāsyati ||25||,若煩惱虛妄 無性無屬者云何當可斷 誰能斷無性,གལ་ཏེ་ལ་ལའི་ཉོན་མོངས་པ་། ། གང་དག་རང་བཞིན་གྱིས་མེད་ན་། །ཇི་ལྟ་བུར་ན་སྤོང་བར་འགྱུར་། ། མེད་པ་སུ་ཞིག་སྤོང་བར་བྱེད་། །,"If the afflictions of some did not exist by their own nature, how could they be let go of? Who can let go of what does not exist?"
1a6b7b026c1a48f2baee37abb96c4f4e,viparyāsaparīkṣā nāma trayoviṃśatitamaṃ prakaraṇaṃ ||,中論觀顛倒品第二十三(二十四偈),ཕྱིན་ཅི་ལོག་བརྟག་པ་ཞེས་བྱ་བ་སྟེ་རབ་ཏུ་བྱེད་པ་ཉི་ཤུ་གསུམ་པའོ་༎,Investigation of Error
d4cc60b0c6b54fc8a57756a22a7a198f,yadi śūnyam idaṃ sarvam udayo nāsti na vyayaḥ |caturṇām āryasatyānām abhāvas te prasajyate ||1||,若一切皆空 無生亦無滅如是則無有 四聖諦之法,༎ ༼༤༽གལ་ཏེ་འདི་དག་ཀུན་སྟོང་ན་། ། འབྱུང་བ་མེད་ཅིང་འཇིག་པ་མེད་། །འཕགས་པའི་བདེན་པ་བཞི་པོ་རྣམས་། ། ཁྱོད་ལ་མེད་པར་ཐལ་བར་འགྱུར་། །,"“If all were empty, nothing could come about or perish. It would follow for you that the four ennobling truths could not exist."
c5ded56949874eeab7b4605a662b2e59,parijñā ca prahāṇaṃ ca bhāvanā sākṣikarma ca |caturṇām āryasatyānām abhāvān nopapadyate ||2||,以無四諦故 見苦與斷集證滅及修道 如是事皆無,འཕགས་པའི་བདེན་པ་བཞི་མེད་པས་། ། ཡོངས་སུ་ཤེས་དང་སྤོང་བ་དང་། །སྒོམ་དང་མངོན་དུ་བྱ་བ་དག་། ། འཐད ༼༥༽པར་འགྱུར་པ་མ་ཡིན་ནོ་། །,"Since the four ennobling truths would not exist, understanding, letting go, cultivating and realizing would no longer be valid."
c3a49fd333164b689d5414649eacec5e,tadabhāvān na vidyante catvāry āryaphalāni ca |phalābhāve phalasthā no na santi pratipannakāḥ ||3||,以是事無故 則無四道果無有四果故 得向者亦無,དེ་དག་ཡོད་པ་མ་ཡིན་པས་། ། འབྲས་བུ་བཞི་ཡང་ཡོད་མ་ཡིན་། །འབྲས་བུ་མེད་ན་འབྲས་གནས་མེད་། ། ཞུགས་པ་དག་ཀྱང་ཡོད་མ་ཡིན་། །,"“Since they would not exist, the four fruits would also not exist. If the fruits did not exist, there could be no abiding in the fruits. Experiencing them would also not exist."
f669ead59de944c7a6632d9314340cdd,saṃgho nāsti na cet santi te ’ṣṭau puruṣapudgalāḥ |abhāvāc cāryasatyānāṃ saddharmo ’pi na vidyate ||4||,若無八賢聖 則無有僧寶以無四諦故 亦無有法寶,གལ་ཏེ་སྐྱེས་བུ་གང་ཟག་བརྒྱད་། ། དེ་དག་མེད་ན་དགེ་འདུན་མེད་། །འཕགས་པའི ༼༦༽བདེན་རྣམས་མེད་པའི་ཕྱིར་། ། དམ་པའི་ཆོས་ཀྱང་ཡོད་མ་ཡིན་། །,"“If those eight beings did not exist, the Community would not exist. Since there would be no ennobling truths, the sublime Dharma could also not exist."
95ffdeac12214effa6bf242cfc1eda79,dharme cāsati saṃghe ca kathaṃ buddho bhaviṣyati |evaṃ trīṇy api ratnāni bruvāṇaḥ pratibādhase ||5||,以無法僧寶 亦無有佛寶如是說空者 是則破三寶,ཆོས་དང་དགེ་འདུན་ཡོད་མིན་ན་། ། སངས་རྒྱས་ཇི་ལྟར་ཡོད་པར་འགྱུར་། །དེ་སྐད་སྟོང་པ་ཉིད་སྨྲ་ན་། ། དཀོན་མཆོག་གསུམ་ལ་གནོད་པ་ནི་། །,"“If the Community and the Dharma did not exist, how could Buddha exist? When you talk of emptiness, the three Jewels are maligned."
dbe72b4d227e450099cf1dac0eb76b9c,śūnyatāṃ phalasadbhāvam adharmaṃ dharmam eva ca |sarvasaṃvyavahārāṃś ca laukikān pratibādhase ||6||,空法壞因果 亦壞於罪福亦復悉毀壞 一切世俗法,བྱེད་ཅིང་འབྲས་བུ་ཡོད་པ་དང་། ། ཆོས་མ་ཡིན་པ ༼༧༽ཆོས་ཉིད་དང་། །འཇིག་རྟེན་པ་ཡི་ཐ་སྙད་ནི་། ། ཀུན་ལའང་གནོད་པ་བྱེད་པ་ཡིན་། །,"“The existence of actions and fruits, what is not Dharma and what is Dharma, the conventions of the world: all these too are maligned.”"
24f793a29e1c44d38bc071eca2a50061,atra brūmaḥ śūnyatāyāṃ na tvaṃ vetsi prayojanam |śūnyatāṃ śūnyatārthaṃ ca tata evaṃ vihanyase ||7||,汝今實不能 知空空因緣及知於空義 是故自生惱,དེ་ལ་བཤད་པ་ཁྱོད་ཀྱིས་ནི་། ། སྟོང་ཉིད་དགོས་དང་སྟོང་ཉིད་དང་། །སྟོང་ཉིད་དོན་ནི་མ་རྟོགས་པས་། ། དེ་ཕྱིར་དེ་ལྟར་གནོད་པ་ཡིན་། །,"An explanation for that: since you do not understand the need for emptiness, emptiness, and the point of emptiness, therefore in that way you malign."
18ffb58e70b44394ae6123b4fbf3c61c,dve satye samupāśritya buddhānāṃ dharmadeśanā |lokasaṃvṛtisatyaṃ ca satyaṃ ca paramārthataḥ ||8||,諸佛依二諦 為眾生說法一以世俗諦 二第一義諦,སངས་རྒྱས་རྣམས་ཀྱིས་ཆོས་བསྟན་པ་། ། ༼༡༥ཨ༡༽བདེན་པ་གཉིས་ལ་ཡང་དག་བརྟེན་། །འཇིག་རྟེན་ཀུན་རྫོབ་བདེན་པ་དང་། ། དམ་པའི་དོན་གྱི་བདེན་པའོ་། །,The Dharma taught by Buddhas perfectly relies on two truths: the ambiguous truths of the world and the truths of the sublime meaning.
997a232f1d854f0ea9b0e449aaa72e85,ye ’nayor na vijānanti vibhāgaṃ satyayor dvayoḥ |te tattvaṃ na vijānanti gambhīraṃ buddhaśāsane ||9||,若人不能知 分別於二諦則於深佛法 不知真實義,གང་དག་བདེན་པ་དེ་གཉིས་ཀྱི་། ། རྣམ་དབྱེ་རྣམ་པར་མི་ཤེས་པ་། །དེ་དག་སངས་རྒྱས་བསྟན་པ་ནི་། ། ཟབ་མོའི་དེ་ཉིད་རྣམ་མི་ཤེས་། །,"Those who do not understand the division into two truths, cannot understand the profound reality of the Buddha’s teaching."
9305f22de3de4b7495aef694c244377f,vyavahāram anāśritya paramārtho na deśyate |paramārtham anāgamya nirvāṇaṃ nādhigamyate ||10||,若不依俗諦 不得第一義不得第一義 則不得涅槃,༼༢༽ཐ་སྙད་ལ་ནི་མ་བརྟེན་པར་། ། དམ་པའི་དོན་ནི་བསྟན་མི་ནུས་། །དམ་པའི་དོན་ནི་མ་རྟོགས་པར་། ། མྱ་ངན་འདས་པ་ཐོབ་མི་འགྱུར་། །,"Without relying on conventions, the sublime meaning cannot be taught. Without understanding the sublime meaning, one will not attain nirvana."
544c88631fa74856ad53b93175ec0ebc,vināśayati durdṛṣtā śūnyatā mandamedhasam |sarpo yathā durgṛhīto vidyā vā duṣprasādhitā ||11||,不能正觀空 鈍根則自害如不善咒術 不善捉毒蛇,སྟོང་པ་ཉིད་ལ་བལྟ་ཉེས་ན་། ། ཤེས་རབ་ཆུང་རྣམས་ཕུང་བར་འགྱུར་། །ཇི་ལྟར་སྤྲུལ་ལ་གཟུང་ཉེས་དང་། ། རིག ༼༣༽སྔགས་ཉེས་པར་བསྒྲུབས་པ་བཞིན་། །,"If their view of emptiness is wrong, those of little intelligence will be hurt. Like handling a snake in the wrong way, or casting a spell in the wrong way."
