id,P001812,P001813,P001814,P001815
5e8bfc2f5c514f59872537cf7c7e5e28,mūlamadhyamakakārikāḥ,中論卷第一,༼༡ཨ༡༽༎ རྒྱ་གར་སྐད་དུ་། ། པྲ་ཛཉའ་ནའ་མ་མའུ་ལ་མ་དྷཡའ་མ་ཀ་ཀའ་རི་ཀ་། བོད་སྐད་དུ་། ། དབུ་མ་རྩ་བའི་ཚིག་ལེའུར་བྱས་པ་ཤེས་རབ་ཅེས་བྱ་བ་།,Herein lie the Root Verses of the Center called “Intelligence”. In the language of India: Prajnanamamulamadhyamakakarika. In the language of Tibet: dBu ma rtsa ba’i tshig le’ur byas pa shes rab ces bya ba.
0bcb874722c14699a068976f5e28dc34,anirodham anutpādam anucchedam aśāśvatam |anekārtham anānārtham anāgamam anirgamam |yaḥ pratītyasamutpādaṃ prapañcopaśamaṃ śivam |deśayām āsa saṃbuddhas taṃ vande vadatāṃ varam |,不生亦不滅 不常亦不斷不一亦不異 不來亦不出能說是因緣 善滅諸戲論我稽首禮佛 諸說中第一,འཇམ་དཔལ་གཞོན་ནུར་གྱུར་པ ༼༢༽ལ་ཕྱག་འཚལ་ལོ་། །གང་གིས་རྟེན་ཅིང་འབྲེལ་པར་འབྱུང་། ། འགག་པ་མེད་པ་སྐྱེ་མེད་པ་། །ཆད་པ་མེད་པ་རྟག་མེད་པ་། ། འོང་བ་མེད་པ་འགྲོ་མེད་པ་། །ཐ་དད་དོན་མིན་དོན་གཅིག་མིན་། ། ༼༣༽སྤྲོས་པ་ཉེར་ཞི་ཞི་བསྟན་པ་། །རྫོགས་པའི་སངས་རྒྱས་སྨྲ་རྣམས་ཀྱི་། ། དམ་པ་དེ་ལ་ཕྱག་འཚལ་ལོ་། །,"I prostrate to the youthful Manjushri.I bow down to the most sublime of speakers, the completely awakened one who taught contingency (no cessation, no birth, no annihilation, no permanence, no coming, no going, no difference, no identity) to ease fixations."
402d0684e40042fbadcfc81d059c1426,na svato nāpi parato na dvābhyāṃ nāpy ahetutaḥ |utpannā jātu vidyante bhāvāḥ kva cana ke cana ||1||,諸法不自生 亦不從他生不共不無因 是故知無生,བདག་ལས་མ་ཡིན་གཞན་ལས་མིན་། ། གཉིས་ལས་མ་ཡིན་རྒྱུ་མེད་མིན་། །དངོས་པོ་གང ༼༤༽དག་གང་ན་ཡང་། ། སྐྱེ་བ་ནམ་ཡང་ཡོད་མ་ཡིན་། །,"No thing anywhere is ever born from itself, from something else, from both or without a cause."
255a8159c7854892abb233cc76e167f4,catvāraḥ pratyayā hetur ārambaṇam anantaram |tathaivādhipateyaṃ ca pratyayo nāsti pañcamaḥ ||2||,如諸法自性 不在於緣中以無自性故 他性亦復無1,རྐྱེན་རྣམ་བཞི་སྟེ་རྒྱུ་དང་ནི་། ། དམིགས་པ་དང་ནི་དེ་མ་ཐག་། །བདག་པོ་ཡང་ནི་དེ་བཞིན་ཏེ་། ། རྐྱེན་ལྔ་པ་ནི་ཡོད་མ་ཡིན་། །,"There are four conditions: Causes, objects, immediate and dominant. There is no fifth."
5c741421ae6a4f71ae9bf5304ef43ea9,na hi svabhāvo bhāvānāṃ pratyayādiṣu vidyate |avidyamāne svabhāve parabhāvo na vidyate ||3||,因緣次第緣 緣緣增上緣四緣生諸法 更無第五緣2,དངོས་པོ་རྣམས་ཀྱི ༼༥༽རང་བཞིན་ནི་། ། རྐྱེན་ལ་སོགས་ལ་ཡོད་མ་ཡིན་། །བདག་གི་དངོས་པོ་ཡོད་མིན་ན་། ། གཞན་དངོས་ཡོད་པ་མ་ཡིན་ནོ་། །,"The essence of things does not exist in conditions and so on. If an own thing does not exist, an other thing does not exist."
c37fa078867340958732295585782873,kriyā na pratyayavatī nāpratyayavatī kriyā |pratyayā nākriyāvantaḥ kriyāvantaś ca santy uta ||4||,果為從緣生 為從非緣生是緣為有果 是緣為無果,བྱ་བ་རྐྱེན་དང་ལྡན་པ་ཡིན་། ། རྐྱེན་དང་མི་ལྡན་བྱ་བ་མེད་། །བྱ་བ་མི་ལྡན་རྐྱེན ༼༢ཨ༡༽མ་ཡིན་། ། བྱ་བ་ལྡན་ཡོད་འོན་ཏེ་ན་། །,"There is no activity which has conditions. There is no activity which does not have conditions. There are no conditions which do not have activity, and none which do have activity."
3671305181dd4220b8ddf6f0533cb532,utpadyate pratītyemān itīme pratyayāḥ kila |yāvan notpadyata ime tāvan nāpratyayāḥ katham ||5||,因是法生果 是法名為緣若是果未生 何不名非緣,འདི་དག་ལ་བརྟེན་སྐྱེ་བས་ན་། ། དེ་ཕྱིར་འདི་དག་རྐྱེན་ཅེས་གྲག་། །ཇི་སྲིད་མི་སྐྱེ་དེ་སྲིད་དུ་། ། འདི་དག་རྐྱེན་མིན་ཇི་ལྟར་མིན་། །,"Since something is born in dependence upon them, then they are known as “conditions”. As long as it is not born, why are they not non-conditions?"
6306b4f17ba04aa1b438243f28a205d7,naivāsato naiva sataḥ pratyayo ’rthasya yujyate |asataḥ pratyayaḥ kasya sataś ca pratyayena kim ||6||,果先於緣中 有無俱不可先無為誰緣 先有何用緣,མེད་དམ་ཡོད་པའི་དོན་ལ་ཡང་། ། རྐྱེན་ནི་རུང ༼༢༽བ་མ་ཡིན་ཏེ་། །མེད་ན་གང་གི་རྐྱེན་དུ་འགྱུར་། ། ཡོད་ན་རྐྱེན་གྱིས་ཅི་ཞིག་བྱ་། །,"It is impossible for something that either exists or not to have conditions. If it were non-existent, of what would they be the conditions? If it were existent, why would it need conditions?"
e6184035439b44da8197106fc5326617,na san nāsan na sad asan dharmo nirvartate yadā |kathaṃ nirvartako hetur evaṃ sati hi yujyate ||7||,若果非有生 亦復非無生亦非有無生 何得言有緣,གང་ཚེ་ཆོས་ནི་ཡོད་པ་དང་། ། མེད་དང་ཡོད་མེད་མི་འགྲུབ་པ་། །ཇི་ལྟར་སྒྲུབ་བྱེད་རྒྱུ་ཞེས་བྱ་། ། དེ་ལྟ་ཡིན་ན་མི་རིགས་སོ་། །,"When things cannot be established as either existent, non-existent or both, how can one speak of an “establishing cause.” Such would be impossible."
4fabb3d0f4d54c0daae1b5d3ee0b99c4,anārambaṇa evāyaṃ san dharma upadiśyate |athānārambaṇe dharme kuta ārambaṇaṃ punaḥ ||8||,果若未生時 則不應有滅滅法何能緣 故無次第緣3,ཡོད་པའི་ཆོས་འདི ༼༣༽དམིགས་པ་ནི་། ། མེད་པ་ཁོ་ན་ཉེ་བར་བསྟན་། །ཅི་སྟེ་ཆོས་ནི་དམིགས་མེད་ན་། ། དམིགས་པ་ཡོད་པར་ག་ལ་འགྱུར་། །,"An existent phenomenon is clearly said to have no object at all. If the phenomenon has no object, where can the object exist?"
c85ed2b0412d42878f395ff285f0405c,anutpanneṣu dharmeṣu nirodho nopapadyate |nānantaram ato yuktaṃ niruddhe pratyayaś ca kaḥ ||9||,如諸佛所說 真實微妙法於此無緣法 云何有緣緣4,ཆོས་རྣམས་སྐྱེས་པ་མ་ཡིན་ན་། ། འགག་པ་འཐད་པར་མི་འགྱུར་རོ་། །དེ་ཕྱིར་དེ་མ་ཐག་མི་རིགས་། ། འགགས ༼༤༽ན་རྐྱེན་ཡང་གང་ཞིག་ཡིན་། །,"If phenomena are not born, it is invalid for there to be cessation. Therefore, an immediate condition is unreasonable. What, having ceased, can also be a condition?"
026e05b0c2414fa29c402c1e47fa510b,bhāvānāṃ niḥsvabhāvānāṃ na sattā vidyate yataḥ |satīdam asmin bhavatīty etan naivopapadyate ||10||,諸法無自性 故無有有相說有是事故 是事有不然,དངོས་པོ་རང་བཞིན་མེད་རྣམས་ཀྱི་། ། ཡོད་པ་གང་ཕྱིར་ཡོད་མིན་ན་། །འདི་ཡོད་པས་ན་འདི་འབྱུང་ཞེས་། ། བྱ་བ་འདི་ནི་འཐད་མ་ཡིན་། །,"Because the existence of essence-less things does not exist, it is incorrect to say:“When this exists, that arises.”"
d16b3bcd566d40a6a20ea0d2b592b26a,na ca vyastasamasteṣu pratyayeṣv asti tat phalam |pratyayebhyaḥ kathaṃ tac ca bhaven na pratyayeṣu yat ||11||,略廣因緣中 求果不可得因緣中若無 云何從緣出,རྐྱེན་རྣམས་སོ་སོ་འདུས་པ་ལ་། ། འབྲས་བུ་དེ་ནི་མེད་པ་ཉིད་། །རྐྱེན ༼༥༽རྣམས་ལ་ནི་གང་མེད་པ་། ། དེ་ནི་རྐྱེན་ལས་ཇི་ལྟར་སྐྱེ་། །,There is no effect at all in the conditions individually or together. How can that which is not in the conditions itself be born from conditions?
c5c39f856f5f440992dacf85b3e0b87f,athāsad api tat tebhyaḥ pratyayebhyaḥ pravartate |apratyayebhyo ’pi kasmān nābhipravartate phalam ||12||,若謂緣無果 而從緣中出是果何不從 非緣中而出,ཅི་སྟེ་དེ་ནི་མེད་པར་ཡང་། ། རྐྱེན་དེ་དག་ལས་སྐྱེ་འགྱུར་ན་། །རྐྱེན་མ་ཡིན་པ་དག་ལས་ཀྱང་། ། ཅི་ཡི་ཕྱིར་ན་སྐྱེ་མི་འགྱུར་། །,"If, although the effect is not there, it is born from those conditions, why is an effect not born from what are not its conditions?"
0ba8d407b717472cbd4f3113cc3374cd,phalaṃ ca pratyayamayaṃ pratyayāś cāsvayaṃmayāḥ |phalam asvamayebhyo yat tat pratyayamayaṃ katham ||13||,若果從緣生 是緣無自性從無自性生 何得從緣生,འབྲས་བུ་རྐྱེན་གྱི་རང་བཞིན་ན་། ། རྐྱེན་རྣམས་བདག་གི་རང ༼༢བ༡༽བཞིན་མིན་། །བདག་དངོས་མིན་ལས་འབྲས་བུ་གང་། ། དེ་ནི་ཇི་ལྟར་རྐྱེན་རང་བཞིན་། །,Effects are of the nature of conditions. Conditions do not have own nature. How can those effects of what does not have own nature be of the nature of conditions?
1658a6f767484b88be52206d79451836,tasmān na pratyayamayaṃ nāpratyayamayaṃ phalam |saṃvidyate phala_bhāvāt pratyayāpratyayāḥ kutaḥ ||14||,果不從緣生 不從非緣生以果無有故 緣非緣亦無,དེ་ཕྱིར་རྐྱེན་གྱི་རང་བཞིན་མིན་། ། རྐྱེན་མིན་རང་བཞིན་འབྲས་བུ་ནི་། །ཡོད་མིན་འབྲས་བུ་མེད་པས་ན་། ། རྐྱེན་མིན་རྐྱེན་དུ་ག་ལ་འགྱུར་། །,"Therefore, it does not have the nature of conditions, nor is there an effect with the nature of non-conditions. Since there is no effect, what could be its non-conditions or conditions?"
ef2faa9ed6044952ae278d3700db87c4,pratyayaparīkṣā nāma prathamaṃ prakaraṇaṃ ||,中論觀因緣品第一(十六偈),རྐྱེན་བརྟག་པ་ཞེས་བྱ་བ་སྟེ་། ། རབ་ཏུ་བྱེད་པ་དང་པོའོ་༎༎,Investigation of Conditions
37c14dcb4de84bdf8e535cc2629debb9,gataṃ na gamyate tāvad agataṃ naiva gamyate |gatāgatavinirmuktaṃ gamyamānaṃ na gamyate ||1||,已去無有去 未去亦無去離已去未去 去時亦無去,༼༢༽རེ་ཞིག་སོང་ལ་མི་འགྲོ་སྟེ་། ། མ་སོང་བ་ལའང་འགྲོ་བ་མིན་། ། སོང་དང་མ་སོང་མ་གཏོགས་པར་། ། བགོམ་པ་ཤེས་པར་མི་འགྱུར་རོ་། །,Then there is no going in what has gone; there is no going also in what has not yet gone. Motion is unknowable apart from what has gone and not yet gone.
44292e79e8654ea2a3fe1b4968652f99,ceṣṭā yatra gatis tatra gamyamāne ca sā yataḥ |na gate nāgate ceṣṭā gamyamāne gatis tataḥ ||2||,動處則有去 此中有去時非已去未去 是故去時去,གང་ན་གཡོ་བ་དེ་ན་འགྲོ་། ། དེ་ཡང་གང་གི་བགོམ་པ་ལ་། །གཡོ་བ་སོང་མིན་མ་སོང་མིན་། ། དེ་ཕྱིར་བགོམ་ལ་འགྲོ་བ་ཡོད་། །,"Where there is moving, there there is going. Furthermore, because moving is within motion -- and is neither gone nor not yet gone, therefore, there is going within motion."
fdd9d9e61f13481a8732702508446645,gamyamānasya gamanaṃ kathaṃ nāmopapatsyate |gamyamānaṃ vigamanaṃ yadā naivopapadyate ||3||,云何於去時 而當有去法若離於去法 去時不可得,བགོམ་ལ་འགྲོ་བ ༼༣༽ཡིན་པར་ནི་། ། ཇི་ལྟ་བུར་ན་འཐད་པར་འགྱུར་། །གང་ཚེ་འགྲོ་བ་མེད་པ་ཡི་། ། བགོམ་པ་འཐད་པ་མེད་ཕྱིར་རོ་། །,How can going be possible within motion? Because motion that is not going is impossible.
a949e1f29cc94af0bccdd952571c67ac,gamyamānasya gamanaṃ yasya tasya prasajyate |ṛte gater gamyamānaṃ gamyamānaṃ hi gamyate ||4||,若言去時去 是人則有咎離去有去時 去時獨去故,གང་གི་བགོམ་པ་ལ་འགྲོ་བ་། ། དེ་ཡི་བགོམ་ལ་འགྲོ་མེད་པར་། །ཐལ་བར་འགྱུར་ཏེ་གང་གི་ཕྱིར་། ། བགོམ་ལ་འགྲོ་བ་ཡིན་ཕྱིར་རོ་། །,"For whomever there is going within motion, for him it will follow that there could be no going within motion, because there is going within motion. (Or, following the structure and wording of v. 10: “To claim that there is going within motion implies that there could be no going within motion, because it is asserted there is going within motion.”)"
6ddb3e6d446d4219b4f8af14f161a853,gamyamānasya gamane prasaktaṃ gamanadvayam |yena tad gamyamānaṃ ca yac cātra gamanaṃ punaḥ ||5||,若去時有去 則有二種去一謂為去時 二謂去時去,བགོམ་ལ་འགྲོ་བ་ཡོད་ན་ནི་། ། ༼༤༽འགྲོ་བ་གཉིས་སུ་ཐལ་འགྱུར་ཏེ་། །གང་གིས་དེ་བགོམ་འགྱུར་བ་དང་། ། དེ་ལ་འགྲོ་བ་གང་ཡིན་པའོ་། །,"If there were going within motion, it would follow that going would be twofold: that by which one becomes someone in motion in a place and that by which one goes in that place."
283f2de14b92470aaebd4d9a2f74504e,dvau gantārau prasajyete prasakte gamanadvaye |gantāraṃ hi tiraskṛtya gamanaṃ nopapadyate ||6||,若有二去法 則有二去者以離於去者 去法不可得,འགྲོ་བ་གཉིས་སུ་ཐལ་འགྱུར་ན་། ། འགྲོ་བ་པོ་ཡང་གཉིས་སུ་འགྱུར་། །གང་ཕྱིར་འགྲོ་པོ་མེད་པར་ནི་། ། འགྲོ་བ་འཐད་པར་མི་འགྱུར་ཕྱིར་། །,"If going were twofold, the goer also would be twofold, because going is impossible without a goer."
e79507fd637d4e8283382f3a5919e1f9,gantāraṃ cet tiraskṛtya gamanaṃ nopapadyate |gamane ’sati gantātha kuta eva bhaviṣyati ||7||,若離於去者 去法不可得以無去法故 何得有去者,གལ་ཏེ་འགྲོ་པོ་མེད་གྱུར་ན་། ། འགྲོ་བ ༼༥༽འཐད་པར་མི་འགྱུར་ཏེ་། །འགྲོ་བ་མེད་ན་འགྲོ་བ་པོ་། ། ཡོད་པ་ཉིད་དུ་ག་ལ་འགྱུར་། །,"If there were no goer, going would be impossible. If there were no going, where could a goer be existent?"
58c0aba66e284f94a834ef62950aefea,gantā na gacchati tāvad agantā naiva gacchati |anyo gantur agantuś ca kas tṛtīyo ’tha gacchati ||8||,去者則不去 不去者不去離去不去者 無第三去者,རེ་ཞིག་འགྲོ་པོ་མི་འགྲོ་སྟེ་། ། འགྲོ་བ་པོ་མིན་འགྲོ་བ་མིན་། །འགྲོ་པོ་འགྲོ་པོ་མིན་ལས་གཞན་། ། གསུམ་པ་གང་ཞིག་འགྲོ་བར་འགྱུར་། །,"When a goer does not go, a non-goer cannot go; what third one other than a goer and a non-goer could go?"
116c442daa474cd3aea8330e2f455382,gantā tāvad gacchatīti katham evopapatsyate |gamanena vinā gantā yadā naivopapadyate ||9||,若言去者去 云何有此義若離於去法 去者不可得,གང་ཚེ་འགྲོ་བ་མེད་པར་ནི་། ། འགྲོ་པོ་འཐད་པར་མི་འགྱུར་ན་། །༼༦༽རེ་ཞིག་འགྲོ་པོ་འགྲོའོ་ཞེས་། ། ཇི་ལྟར་འཐད་པ་ཉིད་དུ་འགྱུར་། །,"When a goer is impossible without going, then how is it possible to say: “a goer goes”?"
ac239e0dca104dd2975c8616cfeb824c,pakṣo gantā gacchatīti yasya tasya prasajyate |gamanena vinā gantā gantur gamanam icchataḥ ||10||,若去者有去 則有二種去一謂去者去 二謂去法去,གང་གི་ཕྱོགས་ལ་འགྲོ་བ་པོ་། ། འགྲོ་བ་དེ་ལ་འགྲོ་མེད་པའི་། །འགྲོ་པོ་ཡིན་པར་ཐལ་འགྱུར་ཏེ་། ། འགྲོ་པོ་འགྲོ་བར་འདོད་ཕྱིར་རོ་། །,"To claim that a goer goes implies that there could be a goer who does not go, because it is asserted that a goer goes."
d714a66855834161ba52a24450158a79,gamane dve prasajyete gantā yady uta gacchati |ganteti cājyate yena gantā san yac ca gacchati ||11||,若謂去者去 是人則有咎離去有去者 說去者有去,གལ་ཏེ་འགྲོ་པོ་འགྲོ་གྱུར་ན་། ། འགྲོ་བ་གཉིས་སུ་ཐལ་འགྱུར་ཏེ་། །གང་གིས་འགྲོ་པོར་མངོན ༼༧༽པ་དང་། ། འགྲོ་པོར་གྱུར་ནས་གང་འགྲོ་བའོ་། །,"If the goer goes, it would follow that going would be twofold: that which reveals* the goer and that which goes once he has become a goer."
d681519edd8e4d5ca910a7ac44f7500a,gate nārabhyate gantuṃ gantuṃ nārabhyate ’gate |nārabhyate gamyamāne gantum ārabhyate kuha ||12||,已去中無發 未去中無發去時中無發 何處當有發,སོང་ལ་འགྲོ་བའི་རྩོམ་མེད་དེ་། ། མ་སོང་བ་ལའང་འགྲོ་རྩོམ་མེད་། །བགོམ་ལ་རྩོམ་པ་ཡོད་མིན་ན་། ། གང་དུ་འགྲོ་བ་རྩོམ་པར་བྱེད་། །,"If a beginning of going does not exist in what has gone, if a beginning of going does not exist also in what has not yet gone and if there does not exist a beginning within motion, wherein is a beginning of going made?"
9400c932f24e4b91badb4c834de8b273,na pūrvaṃ gamanārambhād gamyamānaṃ na vā gatam |yatrārabhyeta gamanam agate gamanaṃ kutaḥ ||13||,未發無去時 亦無有已去是二應有發 未去何有發,འགྲོ་བ་རྩོམ་པའི་སྔ་རོལ་ན་། ། གང་དུ་འགྲོ་བ་རྩོམ་འགྱུར་བ་། །བགོམ་པ་མེད་ཅིང་སོང་བ་མེད་། ། མ་སོང ༼༣ཨ༡༽འགྲོ་བ་ག་ལ་ཡོད་། །,"Before a beginning of going, there is not any motion or anything which has gone wherein going could begin. How can going exist in what has not yet gone?"
b5aed4271b3f426bba8cbfb6d74ecd57,gataṃ kiṃ gamyamānaṃ kim agataṃ kiṃ vikalpyate |adṛśyamāna ārambhe gamanasyaiva sarvathā ||14||,無去無未去 亦復無去時一切無有發 何故而分別,འགྲོ་རྩོམ་རྣམ་པ་ཐམས་ཅད་དུ་། ། སྣང་བ་མེད་པ་ཉིད་ཡིན་ན་། །སོང་བ་ཅི་ཞིག་བགོམ་པ་ཅི་། ། མ་སོང་ཅི་ཞིག་རྣམ་པར་བརྟག་། །,"If a beginning of going is simply not apparent in any way, examine: what has gone? what is motion? what has not yet gone?"
f1e02d01d9514502847b228f512a0b77,gantā na tiṣṭhati tāvad agantā naiva tiṣṭhati |anyo gantur agantuś ca kas tṛtīyo ’tha tiṣṭhati ||15||,去者則不住 不去者不住離去不去者 何有第三住,རེ་ཞིག་འགྲོ་པོ་མི་སྡོད་དེ་། ། འགྲོ་བ་པོ་མིན་སྡོད་པ་མིན་། །འགྲོ་པོ་འགྲོ་པོ་མིན་ལས་གཞན་། ། གསུམ་པ་གང་ཞིག ༼༢༽སྡོད་པར་འགྱུར་། །,"When a goer does not stay, a non-goer cannot stay; what third one other than a goer and a non-goer could stay?"
bff2f0d4d756425d970a8e004c004553,gantā tāvat tiṣṭhatīti katham evopapatsyate |gamanena vinā gantā yadā naivopapadyate ||16||,去者若當住 云何有此義若當離於去 去者不可得,གང་ཚེ་འགྲོ་བ་མེད་པར་ནི་། ། འགྲོ་པོ་འཐད་པར་མི་འགྱུར་ན་། །རེ་ཞིག་འགྲོ་པོ་སྡོད་དོ་ཞེས་། ། ཇི་ལྟར་འཐད་པ་ཉིད་དུ་འགྱུར་། །,"When a goer is not possible without going, how then is it possible to say: “a goer stays.”"
1ec17522c5684372aba177785ad3f56f,na tiṣṭhati gamyamānān na gatān nāgatād api |gamanaṃ saṃpravṛttiś ca nivṛttiś ca gateḥ samā ||17||,去未去無住 去時亦無住所有行止法 皆同於去義,བགོམ་ལམ་ལྡོག་པར་མི་འགྱུར་ཏེ་། ། སོང་དང་མ་སོང་ལས་ཀྱང་མིན་། །འགྲོ་བ་དང་ནི་འཇུག་པ་དང་། ། ལྡོག་པ་ཡང་ནི་འགྲོ་དང ༼༣༽མཚུངས་། །,"There is no reversal of motion*, nor also of what has gone and what has not yet gone. Reversal of going, engagement to stay and reversal of staying are similar to going."
72b1a8e20f7749f6a6849815f53470de,yad eva gamanaṃ gantā sa eveti na yujyate |anya eva punar gantā gater iti na yujyate ||18||,去法即去者 是事則不然去法異去者 是事亦不然,འགྲོ་བ་དེ་དང་འགྲོ་བ་པོ་། ། དེ་ཉིད་ཅེས་ཀྱང་བྱར་མི་རུང་། །འགྲོ་བ་དང་ནི་འགྲོ་བ་པོ་། ། གཞན་ཉིད་ཅེས་ཀྱང་བྱར་མི་རུང་། །,It is inappropriate to say: “going and a goer are the same.” It is inappropriate to say: “going and a goer are different.”
87fa87724bdc49a980686014947992cb,yad eva gamanaṃ gantā sa eva hi bhaved yadi |ekībhāvaḥ prasajyeta kartuḥ karmaṇa eva ca ||19||,若謂於去法 即為是去者作者及作業 是事則為一,གལ་ཏེ་འགྲོ་བ་གང་ཡིན་པ་། ། དེ་ཉིད་འགྲོ་པོ་ཡིན་གྱུར་ན་། །བྱེད་པ་པོ་དང་ལས་ཉིད་ཀྱང་། ། གཅིག་པ་ཉིད་དུ་ཐལ་བར་འགྱུར་། །,"If whatever is going were a goer, it would follow that the actor and the act would be the same too."
4d26e326cc5a4542bb7c7162f8def9ab,anya eva punar gantā gater yadi vikalpyate |gamanaṃ syād ṛte gantur gantā syād gamanād ṛte ||20||,若謂於去法 有異於去者離去者有去 離去有去者,གལ ༼༤༽ཏེ་འགྲོ་དང་འགྲོ་བ་པོ་། ། གཞན་པ་ཉིད་དུ་རྣམ་བརྟག་ན་། །འགྲོ་པོ་མེད་པའི་འགྲོ་བ་དང་། ། འགྲོ་བ་མེད་པའི་འགྲོ་པོར་འགྱུར་། །,"If going and a goer were conceived as different, there could be going without a goer and a goer without going."
