dda78b238b6c4e038388dd8a2ac866de,asato ’pi na bhāvasya nirodha upapadyate |na dvitīyasya śirasaś chedanaṃ vidyate yathā ||31||,若法是無者 是即無有滅譬如第二頭 無故不可斷,དངོས་པོ་མེད་པར་གྱུར་པ་ལའང་། ། འགག་པ་འཐད་པར་མི་འགྱུར་རོ་། །མགོ་གཉིས་པ་ལ་ཇི་ལྟར་ནི་། ། གཅད་དུ ༼༦༽མེད་པ་དེ་བཞིན་ནོ་། །,Cessation is not possible also in what is not a thing. This is similar to how there is no cutting off a second head. i.e. a person cannot be beheaded twice
51a39680e536492fa9aa709d6653d973,na svātmanā nirodho ’sti nirodho na parātmanā |utpādasya yathotādo nātmanā na parātmanā ||32||,法不自相滅 他相亦不滅如自相不生 他相亦不生,འགག་པ་རང་གི་བདག་ཉིད་ཀྱིས་། ། ཡོད་མིན་འགག་པ་གཞན་གྱིས་མིན་། །ཇི་ལྟར་སྐྱེ་བ་རང་དང་ནི་། ། གཞན་གྱིས་སྐྱེད་པ་མ་ཡིན་བཞིན་། །,"Cessation does not exist by its own self, nor does cessation exist by something else. This is like how what has been born is not given birth to by itself or another"
782bda6652ee4398a99de418652a382f,utpādasthitibhaṅgānām asiddher nāsti saṃskṛtam |saṃskṛtasyāprasiddhau ca kathaṃ setsyaty asaṃskṛtam ||33||,生住滅不成 故無有有為有為法無故 何得有無為,སྐྱེ་དང་གནས་དང་འཇིག་པ་དག་། མ་གྲུབ་ཕྱིར་ན་འདུས་བྱས་མེད་། །འདུས་བྱས་རབ་ཏུ་མ་གྲུབ་པས་། ། འདུས་མ ༼༧༽བྱས་ནི་ཇི་ལྟར་འགྲུབ་། །,"Because birth and remaining and perishing are not established, there is no conditioned. Because the conditioned is utterly unestablished, how can the unconditioned be established?"
ada646727b0a454db5b4f9e4c1251140,yathā māyā yathā svapno gandharvanagaraṃ yathā |tathotpādas tathā sthānaṃ tathā bhaṅga udāhṛtam ||34||,如幻亦如夢 如乾闥婆城所說生住滅 其相亦如是,རྨི་ལམ་ཇི་བཞིན་སྒྱུ་མ་བཞིན་། ། དྲི་ཟའི་གྲོང་ཁྱེར་ཇི་བཞིན་དུ་། །དེ་བཞིན་སྐྱེ་དང་དེ་བཞིན་གནས་། ། དེ་བཞིན་དུ་ནི་འཇིག་པ་གསུངས་། །,"Like a dream, like a magician’s illusion, like a city of gandharvas, likewise birth and likewise remaining, likewise perishing are taught."
b59b9dd938084da9a57e6e46b7a5bb27,saṃskṛtaparīkṣā nāma saptamaṃ prakaraṇaṃ ||,觀三相品第七(三十五偈),སྐྱེ་བ་དང་གནས་པ་དང་འཇིག་པ་བརྟག་པ་ཞེས་བྱ་བ་སྟེ་རབ་ཏུ་བྱེད་པ་བདུན་པའོ་༎,"Investigation of Birth, Abiding and Perishing"
86c8555e1c32402d98ca61efc0da2342,sadbhūtaḥ kārakaḥ karma sadbhūtaṃ na karoty ayam |kārako nāpy asadbhūtaḥ karmāsadbhūtam īhate ||1||,決定有作者 不作決定業決定無作者 不作無定業,༎ བྱེད་པོ་ཡིན་པར་གྱུར་པ་དེ་། ། ལས ༼༦ཨ༡༽སུ་གྱུར་པ་མི་བྱེད་དོ་། །བྱེད་པོ་མ་ཡིན་གྱུར་པ་ཡང་། ། ལས་སུ་མ་གྱུར་མི་བྱེད་དོ་། །,One who exists as an actor does not do that which exists as an act. One who does not exist as an actor also does not do that which does not exist as an act.
243963123a764cdc9a276b694f3ff590,sadbhūtasya kriyā nāsti karma ca syād akartṛkam |sadbhūtasya kriyā nāsti kartā ca syād akarmakaḥ ||2||,決定業無作 是業無作者定作者無作 作者亦無業,ཡིན་པར་གྱུར་ལ་བྱ་བ་མེད་། ། བྱེད་པོ་མེད་པའི་ལས་སུའང་འགྱུར་། །ཡིན་པའང་གྱུར་ལ་བྱ་བ་མེད་། ། ལས་མེད་བྱེད་པ་པོར་ཡང་འགྱུར་། །,One who exists has no activity; something would also exist as an act without an actor. One who exists has no activity; something would also exist as an actor without an act.
94f09c58baff4519a46eef6017b7f584,karoti yady asadbhūto ’sadbhūtaṃ karma kārakaḥ |ahetukaṃ bhavet karma kartā cāhetuko bhavet ||3||,若定有作者 亦定有作業作者及作業 即墮於無因,གལ་ཏེ་བྱེད་པོར་མ་གྱུར་པ་། ། ལས་སུ ༼༢༽མ་གྱུར་བྱེད་ན་ནི་། །ལས་ལ་རྒྱུ་ནི་མེད་པར་འགྱུར་། ། བྱེད་པ་པོ་ཡང་རྒྱུ་མེད་འགྱུར་། །,"If one who does not exist as an actor did that which does not exist as an act, the act would have no cause; the actor too would have no cause."
eee3520aa56b436aad5c5af2a5fb4405,hetāv asati kāryaṃ ca kāraṇaṃ ca na vidyate |tadabhāve kriyā kartā kāraṇaṃ ca na vidyate ||4||,若墮於無因 則無因無果無作無作者 無所用作法,རྒྱུ་མེད་ན་ནི་འབྲས་བུ་དང་། ། རྒྱུ་ཡང་འཐད་པར་མི་འགྱུར་རོ་། །དེ་མེད་ན་ནི་བྱ་བ་དང་། ། བྱེད་པ་པོ་དང་བྱེད་མི་རིགས་། །,"If there were no cause, effect and cause would not be evident. If they were non-existent, activity and agent and doing would not be evident."
3be1db589a1d457a9ef7dc8e0d0db3a0,dharmādharmau na vidyete kriyādīnām asaṃbhave |dharme cāsaty adharme ca phalaṃ tajjaṃ na vidyate ||5||,若無作等法 則無有罪福罪福等無故 罪福報亦無,བྱ་བ་ལ་སོགས་མི་རིགས་ན་། ། ཆོས་དང་ཆོས་མིན་ཡོད་མ་ཡིན་། །ཆོས ༼༣༽དང་ཆོས་མིན་མེད་ན་ནི་། ། དེ་ལས་བྱུང་བའི་འབྲས་བུ་མེད་། །,"If activity etc. did not appear, dharma and adharma would not be evident. If dharma and adharma did not exist, there would be no fruit that comes from them."
12b44a30166247c88259ccebd725b7ac,phale ’sati na mokṣāya na svargāyopapadyate |mārgaḥ sarvakriyāṇāṃ ca nairarthakyaṃ prasajyate ||6||,若無罪福報 亦無有涅槃諸可有所作 皆空無有果,འབྲས་བུ་མེད་ན་ཐར་པ་དང་། ། མཐོ་རིས་འགྱུར་པའི་ལམ་མི་འཐད་། །བྱ་བ་དག་ནི་ཐམས་ཅད་ཀྱང་། ། དོན་མེད་ཉིད་དུ་ཐལ་བར་འགྱུར་། །,"If there were no fruit, the path of liberation and higher states would not be appropriate. Also it would follow that all activities are meaningless."
52930fb1e183428d88f9229a43a3f815,kārakaḥ sadasadbhūtaḥ sadasat kurute na tat |parasparaviruddhaṃ hi sac cāsac caikataḥ kutaḥ ||7||,作者定不定 不能作二業有無相違故 一處則無二,བྱེད་པ་པོར་གྱུར་མ་གྱུར་པ་། ། གྱུར་མ་གྱུར་དེ་མི་བྱེད་དེ་། །ཡིན་དང་མ་ཡིན ༼༤༽གྱུར་ཅིག་ལ་། ། ཕན་ཚུན་འགལ་བས་ག་ལ་ཡོད་། །,"One who exists and does not exist as an actor does not do what exists and does not exist as an act. Since existence and non-existence are mutually contradictory in one thing, where can they exist?"
ad43daac8afc4de5a04230867a88aedd,satā ca kriyate nāsan nāsatā kriyate ca sat |kartrā sarve prasajyante doṣās tatra ta eva hi ||8||,,བྱེད་པ་པོར་ནི་གྱུར་པ་ཡིས་། ། མ་གྱུར་ལས་ནི་མི་བྱེད་དེ་། །མ་གྱུར་པས་ཀྱང་གྱུར་མི་བྱེད་། ། འདིར་ཡང་སྐྱོན་དེར་ཐལ་བར་འགྱུར་། །,One who exists as an actor does not do an act which is not existent. One who does not exist as an actor also does not do what exists as an act. Here too faults will follow for one.
55b0309970cd4a63983a5a4dbd177282,nāsadbhūtaṃ na sadbhūtaḥ sadasadbhūtam eva vā |karoti kārakaḥ karma pūrvoktair eva hetubhiḥ ||9||,有不能作無 無不能作有若有作作者 其過如先說,བྱེད་པ་པོར་ནི་གྱུར་པ་དང་། ། བཅས་པ་ལས་ནི་མ་གྱུར་དང་། །གྱུར་མ་གྱུར་པ་མི་བྱེད་དེ་། ། གཏན ༼༥༽ཚིགས་གོང་དུ་བསྟན་ཕྱིར་རོ་། །,"One who exists as an actor does not do what does not exist as an act and what neither exists or not as an act, because of what was demonstrated by the proof above."
6ef7a241a98941a0a01318b83aa494bf,nāsadbhūto ’pi sadbhūtaṃ sadasadbhūtam eva vā |karoti kārakaḥ karma pūrvoktair eva hetubhiḥ ||10||,作者不作定 亦不作不定及定不定業 其過如先說,བྱེད་པ་པོར་ནི་མ་གྱུར་པས་། ། ལས་ནི་གྱུར་དང་བཅས་པ་དང་། །གྱུར་མ་གྱུར་པ་མི་བྱེད་དེ་། ། གཏན་ཚིགས་གོང་དུ་བསྟན་ཕྱིར་རོ་། །,"One who does not exist as an actor does not do what exists as an act and what neither exists or not as an act, because of what was demonstrated by the proof above."
d5a06c60ccb44fc293b7195fda53597b,karoti sadasadbhūto na san nāsac ca kārakaḥ |karma tat tu vijānīyāt pūrvoktair eva hetubhiḥ ||11||,作者定不定 亦定亦不定不能作於業 其過如先說,བྱེད་པ་པོར་གྱུར་མ་གྱུར་ནི་། ། ལས་སུ་གྱུར་དང་མ་གྱུར་པ་། །མི་བྱེད་འདི་ཡང་གཏན་ཚིགས་ནི་། ། གོང་དུ་བསྟན་པས ༼༦༽ཤེས་པར་བྱ་། །,One who neither exists nor does not exist as an actor does not do that which exists and does not exist as an act. Here too this is to be known through the proof demonstrated above.
ca1854feb67a41f8a0f80a8f6f82ef2f,pratītya kārakaḥ karma taṃ pratītya ca kārakam |karma pravartate nānyat paśyāmaḥ siddhikāraṇam ||12||,因業有作者 因作者有業成業義如是 更無有餘事,བྱེད་པ་པོ་ལས་བརྟེན་བྱས་ཤིང་། ། ལས་ཀྱང་བྱེད་པོ་དེ་ཉིད་ལ་། །བརྟེན་ནས་འབྱུང་བ་མ་གཏོགས་པ་། ། འགྲུབ་པའི་རྒྱུ་ནི་མ་མཐོང་ངོ་། །,"An actor depends on acts and acts too occur in dependence on an actor. Apart from this, one does not see a cause which is established."
f48f83f21b994d94a7dfc64d9662d18b,evaṃ vidyād upādānaṃ vyutsargād iti karmaṇaḥ |kartuś ca karmakartṛbhyāṃ śeṣān bhāvān vibhāvayet ||13||,如破作作者 受受者亦爾及一切諸法 亦應如是破,དེ་བཞིན་ཉེར་ལེན་ཤེས་པར་བྱ་། ། ལས་དང་བྱེད་པོ་བསལ་ཕྱིར་རོ་། །བྱེད་པ་པོ་དང་ལས་དག་གིས་། ། དངོས་པོ་ལྷག་མ་ཤེས ༼༧༽པར་བྱ་། །,"Likewise, one should understand clinging, because act and actor are dispelled. Remaining things too should be understood by means of actor and act."
da540feb59964f5ebfc86345bc0d2f5b,karmakārakaparīkṣā nāma prakaraṇam aṣṭamaṃ ||,中論觀作作者品第八(十二偈),བྱེད་པ་པོ་དང་ལས་བརྟག་པ་ཞེས་བྱ་བ་སྟེ་རབ་ཏུ་བྱེད་པ་བརྒྱད་པའོ་༎,Investigation of Act and Actor
bf37f77f4aa64f4f848565d397b09dab,darśanaśravaṇādīni vedanādīni cāpy atha |bhavanti yasya prāg ebhyaḥ so ’stīty eke vadanty uta ||1||,眼耳等諸根 苦樂等諸法誰有如是事 是則名本住,༎ ལྟ་དང་ཉན་ལ་སོགས་པ་དང་། ། ཚོར་སོགས་དང་ཡང་དབང་བྱས་པ་། །གང་གི་ཡིན་པ་དེ་དག་གི་། སྔ་རོལ་དེ་ཡོད་ཁ་ཅིག་སྨྲ་། །,"Some say that whatever is involved in seeing, hearing etc. and feeling etc. exists prior to them."
d1c3ba2a0e9849a4ab8e39e961eb9f4a,kathaṃ hy avidyamānasya darśanādi bhaviṣyati |bhāvasya tasmāt prāg ebhyaḥ so ’sti bhāvo vyavasthitaḥ ||2||,若無有本住 誰有眼等法以是故當知 先已有本住,དངོས་པོ་ཡོད་པ་མ་ཡིན་ན་། ། ལྟ་བ་ལ་སོགས་ཇི་ལྟར་འགྱུར་། །༼༦བ༡༽དེ་ཕྱིར་དེ་དག་སྔ་རོལ་ན་། ། དངོས་པོ་གནས་པ་དེ་ཡོད་དོ་། །,"If that thing is not evident, how can there be seeing etc? Therefore, the presence of that thing must exist before them."
fc326bbda59f4ce0801d35a07e75ae26,darśanaśravaṇādibhyo vedanādibhya eva ca |yaḥ prāg vyavasthito bhāvaḥ kena prajñapyate ’tha saḥ ||3||,若離眼等根 及苦樂等法先有本住者 以何而可知,ལྟ་དང་ཉན་ལ་སོགས་པ་དང་། ། ཚོར་བ་ལ་སོགས་ཉིད་ཀྱི་ནི་། །སྔ་རོལ་དངོས་པོ་གང་གནས་པ་། ། དེ་ནི་གང་གིས་གདགས་པར་བྱ་། །,What configures/makes known that thing which is present before seeing and hearing etc. and feeling etc.?
f294462991924db3aa5fc1552941c583,vināpi darśanādīni yadi cāsau vyavasthitaḥ |amūny api bhaviṣyanti vinā tena na saṃśayaḥ ||4||,若離眼耳等 而有本住者亦應離本住 而有眼耳等,ལྟ་བ་ལ་སོགས་མེད་པར་ཡང་། ། གལ་ཏེ་དེ་ནི་གནས་གྱུར་ན་། །དེ་མེད་པར་ཡང་དེ ༼༢༽དག་ནི་། ། ཡོད་པར་འགྱུར་བར་ཐེ་ཚོམ་མེད་། །,"If it were present even without seeing etc., there would be no doubt that they would exist even without it."
eb9ee8994d174d0eb5ba40083e4719a9,ajyate kenacit kaścit kiṃcit kena cid ajyate |kutaḥ kiṃcid vinā kaścit kiṃcit kiṃcid vinā kutaḥ ||5||,以法知有人 以人知有法離法何有人 離人何有法,ཅི་ཡིས་གང་ཞིག་གསལ་བར་བྱེད་། ། གང་གིས་ཅི་ཞིག་གསལ་བར་བྱེད་། །ཅི་མེད་གང་ཞིག་ག་ལ་ཡོད་། ། གང་མེད་ཅི་ཞིག་ག་ལ་ཡོད་། །,It is illuminated by them; they are illuminated by it. How could it exist without them? How could they exist without it?
1bc6238ff33d4904ae051bccae13f3d1,sarvebhyo darśanādibhyaḥ kaścit pūrvo na vidyate |ajyate darśanādinām anyena punar anyadā ||6||,一切眼等根 實無有本住眼耳等諸根 異相而分別,ལྟ་ལ་སོགས་པ་ཐམས་ཅད་ཀྱི་། ། སྔ་རོལ་གང་ཞིག་ཡོད་པ་མིན་། །ལྟ་སོགས་ནང ༼༣༽ནས་གཞན་ཞིག་གིས་། ། གཞན་གྱི་ཚེ་ན་གསལ་བར་བྱེད་། །,It is not evident prior to the totality of seeing etc. From among seeing etc. a different one illuminates it at different times.
7494330c9524402db7d8265a29421fe3,sarvebhyo darśanādibhyo yadi pūrvo na vidyate |ekaikasmāt kathaṃ pūrvo darśanādeḥ sa vidyate ||7||,若眼等諸根 無有本住者眼等一一根 云何能知塵,ལྟ་ལ་སོགས་པ་ཐམས་ཅད་ཀྱི་། ། སྔ་རོལ་གལ་ཏེ་ཡོད་མིན་ན་། །ལྟ་ལ་སོགས་པ་རེ་རེ་ཡི་། ། སྔ་རོལ་དེ་ནི་ཇི་ལྟར་ཡོད་། །,"If it is not evident prior to the totality of seeing etc., how can it be evident prior to each of them seeing etc. individually?"
53bbab2bdd6d4cabb67cc3742772b38a,draṣṭā sa eva sa śrotā sa eva yadi vedakaḥ |ekaikasmād bhavet pūrvam evaṃ caitan na yujyate ||8||,見者即聞者 聞者即受者如是等諸根 則應有本住,ལྟ་པོ་དེ་ཉིད་ཉན་པོ་དེ་། ། གལ་ཏེ་ཚོར་པོའང་དེ་ཉིད་ན་། །རེ་རེའི་སྔ་རོལ་ཡོད་གྱུར་ན་། ། དེ་ནི ༼༤༽དེ་ལྟར་མི་རིགས་སོ་། །,"If the seer itself were the hearer and the feeler were it too, if it existed prior to each, in that way it would not make sense."
ab59316b381e4d29a77b47927ce17d45,draṣṭānya eva śrotānyo vedako ’nyaḥ punar yadi |sati syād draṣṭari śrotā bahutvaṃ cātmanāṃ bhavet ||9||,若見聞各異 受者亦各異見時亦應聞 如是則神多,གལ་ཏེ་ལྟ་པོ་གཞན་ཉིད་ལ་། ། ཉན་པ་པོ་གཞན་ཚོར་གཞན་ན་། །ལྟ་པོ་ཡོད་ཚེ་ཉན་པོར་འགྱུར་། ། བདག་ཀྱང་མང་པོ་ཉིད་དུ་འགྱུར་། །,"If the seer were different, the hearer different, the feeler different, at the time the seer exists, there would be a hearer. Many selves would come about."
d65226d7fbad4dfaba1b7810739b31f9,darśanaśravaṇādīni vedanādīni cāpy atha |bhavanti yebhyas teṣv eṣa bhūteṣv api na vidyate ||10||,眼耳等諸根 苦樂等諸法所從生諸大 彼大亦無神,ལྟ་དང་ཉན་ལ་སོགས་པ་དང་། ། ཚོར་བ་དག་ལ་སོགས་པ་དང་། །གང་ལས་འགྱུར་བའི་འབྱུང་དེ་ལའང་། ། དེ་ནི་ཡོད་པ་མ་ཡིན ༼༥༽ནོ་། །,Also it is not evident in the elements from which seeing and hearing etc. and feeling etc. occur.
c4564812c014428793641ba0c39ed12c,darśanaśravaṇādīni vedanādīni cāpy atha |na vidyate ced yasya sa na vidyanta imāny api ||11||,若眼耳等根 苦樂等諸法無有本住者 眼等亦應無,ལྟ་དང་ཉན་ལ་སོགས་པ་དང་། ། ཚོར་བ་དག་ལ་སོགས་པ་ཡང་། །གང་གི་ཡིན་པ་གལ་ཏེ་མེད་། ། དེ་དག་ཀྱང་ནི་ཡོད་མ་ཡིན་། །,"If that to which seeing and hearing etc. and feeling etc. belong is not evident, they too could not be evident."
dcab14adaf40439a8c51ccad890ef36d,prāk ca yo darśanādibhyaḥ sāṃprataṃ cordhvam eva ca |na vidyate ’sti nāstīti nivṛttās tatra kalpanāḥ ||12||,眼等無本住 今後亦復無以三世無故 無有無分別,གང་ཞིག་ལྟ་ལ་སོགས་པ་ཡི་། ། སྔ་རོལ་ད་ལྟ་ཕྱི་ན་མེད་། །དེ་ལ་ཡོད་དོ་མེད་དོ་ཞེས་། ། རྟོག་པ་དག་ནི་ལྡོག་པར་འགྱུར་། །,"Reject the concepts “it exists,” “it doesn’t exist” about that which is not evident prior to, now or after seeing etc."
e52e815c62dc4186a4b1ad4938277257,pūrvaparīkṣā nāma navamaṃ prakaraṇaṃ ||,中論觀本住品第九(十二偈),སྔ་རོལ་ན་གནས་པ ༼༦༽བརྟག་པ་ཞེས་བྱ་བ་སྟེ་རབ་ཏུ་བྱེད་པ་དགུ་པའོ་༎,Investigation of the Presence of Something Prior
c9db3060b5bd4df38f2ac388fdad2958,yad indhanaṃ sa ced agnir ekatvaṃ kartṛkarmaṇoḥ |anyaś ced indhanād agnir indhanād apy ṛte bhavet ||1||,若燃是可燃 作作者則一若燃異可燃 離可燃有燃,༎ བུད་ཤིང་གང་དེ་མེ་ཡིན་ན་། ། བྱེད་པ་པོ་དང་ལས་གཅིག་འགྱུར་། །གལ་ཏེ་ཤིང་ལས་མེ་གཞན་ན་། ། ཤིང་མེད་པར་ཡང་འབྱུང་བར་འགྱུར་། །,"If firewood were fire, actor and act would be one. If fire were other than wood, it would occur even without wood."
4bd5f320dcad4809bc27554b8d8072dc,nityapradīpta eva syād apradīpanahetukaḥ |punarārambhavaiyarthyam evaṃ cākarmakaḥ sati ||2||,如是常應燃 不因可燃生則無燃火功 亦名無作火,རྟག་ཏུ་འབར་བ་ཉིད་དུ་འགྱུར་། ། འབར་བྱེད་རྒྱུ་ལས་མི་འབྱུང་ཞིང་། །རྩོམ་པ་དོན་མེད་ཉིད ༼༧༽དུ་འགྱུར་། ། དེ་ལྟ་ཡིན་ན་ལས་ཀྱང་མེད་། །,"Fire would burn permanently and would not arise from causes for burning. Starting a fire would be meaningless. If it were like that, there would also be no act."
cfd235b89fb74bac9fcacc711cde656f,paratra nirapekṣatvād apradīpanahetukaḥ |punarārambhavaiyarthyaṃ nityadīptaḥ prasajyate ||3||,燃不待可燃 則不從緣生火若常燃者 人功則應空,གཞན་ལ་ལྟོས་པ་མེད་པའི་ཕྱིར་། ། འབར་བར་བྱེད་རྒྱུ་ལས་མི་འབྱུང་། །རྟག་ཏུ་འབར་བ་ཡིན་ན་ནི་། ། རྩོམ་པ་དོན་མེད་ཉིད་དུ་འགྱུར་། །,"Because fire does not depend on anything else, it would not arise from causes for burning. If it burned permanently, starting it would be meaningless."
4f2bb411230148698228236f03964e51,tatraitat syād idhyamānam indhanaṃ bhavatīti cet |kenedhyatām indhanaṃ tat tāvanmātram idaṃ yadā ||4||,若汝謂燃時 名為可燃者爾時但有薪 何物燃可燃,དེ་ལ་གལ་ཏེ་འདི་སྙམ་དུ་། ། སྲེག་བཞིན་བུད་ཤིང་ཡིན་སེམས་ན་། །གང་ཚེ་དེ་ཙམ་དེ་ཡིན་ན་། ། གང་གིས ༼༧ཨ༡༽བུད་ཤིང་དེ་སྲེག་བྱེད་། །,"Concerning this, if one thinks that while burning it is firewood, if it is such only at that time, by what could that firewood be ignited?"
266e4961dddb463384df639a346560f7,anyo na prāpsyate ’prapto na dhakṣyaty adahan punaḥ |na nirvāsyaty anirvāṇaḥ sthāsyate vā svaliṅgavān ||5||,若異則不至 不至則不燒不燒則不滅 不滅則常住,གཞན་ཕྱིར་མི་ཕྲད་ཕྲད་མེད་ན་། ། སྲེག་པར་མི་འགྱུར་མི་སྲེག་ན་། །འཆི་བར་མི་འགྱུར་མི་འཆི་ན་། ། རང་རྟགས་དང་ཡང་ལྡན་པར་གནས་། །,"Because fire is other, it would not connect; if it did not connect, it would not ignite; if it did not ignite, it would not die; if it did not die, it would also remain in possession of its own characteristic."
da75327adeb844aeaf59bf70ee48e156,anya evendhanād agnir indhanaṃ prāpnuyād yadi |strī saṃprāpnoti puruṣaṃ puruṣaś ca striyaṃ yathā ||6||,燃與可燃異 而能至可燃如此至彼人 彼人至此人,ཇི་ལྟར་བུད་མེད་སྐྱེས་པ་དང་། ། སྐྱེས་པའང་བུད་མེད་ཕྲད་པ་བཞིན་། །གལ་ཏེ་ཤིང་ལས་མེ ༼༢༽གཞན་ན་། ། ཤིང་དང་ཕྲད་དུ་རུང་བར་འགྱུར་། །,"Just as a woman connects with a man and a man too with a woman, although fire is other than wood, it is fit to connect with wood."
0e7b38f6fca34221955d475d49bd2635,anya evendhanād agnir indhanaṃ kāmam āpnuyāt |agnīndhane yadi syātām anyo’nyena tiraskṛte ||7||,若謂燃可燃 二俱相離者如是燃則能 至於彼可燃,གལ་ཏེ་མེ་དང་ཤིང་དག་ནི་། ། གཅིག་གིས་གཅིག་ནི་བསལ་གྱུར་ན་། །ཤིང་ལས་མེ་གཞན་ཉིད་ཡིན་ཡང་། ། ཤིང་དང་ཕྲད་པར་འདོད་ལ་རག་། །,"If fire and wood eliminated each other, even though fire is something other than wood, it would have to connect with wood."
